DHR,https://www.tradingview.com/chart/?symbol=DHR,Danaher Corporation,Healthcare,172.58,122147053568,3.7,9.8,-17.39,-2.63,46.35,182.54,205.88,False,False,False,NO CLEAR ENTRY,False,58.92,NEUTRAL,5,RBC Capital Resumes Coverage of Danaher Corporation (DHR) | Research Tools & Consumables Stocks Q1 Results: Benchmarking Danaher (NYSE:DHR) | A Look At Danaher (DHR) Valuation After Strong Q1 Earnings Beat And Raised Guidance,33.45,18.98,4568500224.0,37.17,7.08,14.89,45.36,IGNORE
CMS,https://www.tradingview.com/chart/?symbol=CMS,CMS Energy Corporation,Utilities,74.355,22969718784,11.6,8.9,-2.75,-1.75,50.01,75.49,72.54,False,True,True,NO CLEAR ENTRY,False,63.55,POSITIVE,5,CMS Energy Stock: Analyst Estimates & Ratings | 4 Low-Beta Utility Picks as Consumer Sentiment Hits Rock Bottom | Implied Volatility Surging for CMS Energy Stock Options,20.6,17.82,-2156000000.0,189.842,10.37,12.55,45.18,IGNORE
XOM,https://www.tradingview.com/chart/?symbol=XOM,Exxon Mobil Corporation,Energy,150.8,625058054144,2.6,-43.4,2.21,1.96,46.29,154.65,129.62,False,True,True,NO CLEAR ENTRY,False,67.31,POSITIVE,5,Here's How CVE Targets Higher Output Through Its Broad Asset Portfolio | Progress on Potential Middle East Peace Agreement Drives US Equity Futures Higher Pre-Bell | Exxon Mobil (XOM) in Talks to Re-Enter Venezuela After Nearly Two Decades,25.43,14.35,11630499840.0,18.261,9.87,7.76,45.03,IGNORE
CMCSA,https://www.tradingview.com/chart/?symbol=CMCSA,Comcast Corporation,Communication Services,25.035,89430745088,5.3,-32.6,-17.91,-9.16,27.2,27.47,28.02,False,False,False,NO CLEAR ENTRY,False,48.93,NEUTRAL,5,Disney World Strikes Back in 2026 | Down Over 10% This Year: 1 Free-Cash-Flow Machine Under $30 to Buy and Hold Forever | Markets Are Focused on Iran War. Peace Won’t Fix the Inflation Problem.,4.91,6.57,4013125120.0,106.858,20.92,15.0,44.96,IGNORE
HOOD,https://www.tradingview.com/chart/?symbol=HOOD,"Robinhood Markets, Inc.",Financial Services,74.045,66677899264,15.1,2.7,-6.8,-12.59,44.72,76.22,104.35,False,False,False,NO CLEAR ENTRY,False,65.65,POSITIVE,5,"Could Hyperliquid Be the Next Robinhood? | Canadian Regulator Approves Robinhood’s Purchase Of WonderFi | Coinbase, Circle, Bullish And Strategy Want More Than Bitcoin Exposure— They Want The Rails",35.94,27.09,,140.483,21.46,41.12,44.9,IGNORE
AES,https://www.tradingview.com/chart/?symbol=AES,The AES Corporation,Utilities,14.675,10465589248,8.7,951.1,-8.58,2.53,76.52,14.25,13.91,True,True,True,WATCH - OVERBOUGHT,False,45.78,NEUTRAL,5,AES Rate Proposal And Mega Renewables Project Reshape Earnings Visibility | AES (AES) Q2 2025 Earnings Call Transcript | AES (AES) Q3 2024 Earnings Call Transcript,7.64,6.14,-2964999936.0,259.603,5.26,10.82,44.81,IGNORE
SBAC,https://www.tradingview.com/chart/?symbol=SBAC,SBA Communications Corporation,Real Estate,202.17,21442760704,5.9,-14.7,6.56,-7.33,29.04,202.48,194.91,False,True,True,BUY THE DIP,False,56.25,NEUTRAL,5,5 Strong Buy Passive Income Giants Have Raised Their Dividends by Double Digits for Years | Are Wall Street Analysts Predicting SBA Communications Stock Will Climb or Sink? | Bernstein Lifts American Tower to Outperform With $207 Price Target. Time to Buy the Tower REITs?,21.28,24.94,-301849504.0,,,35.66,44.8,IGNORE
FTV,https://www.tradingview.com/chart/?symbol=FTV,Fortive Corporation,Technology,59.73,18209349632,7.7,-12.4,-0.01,-2.23,41.46,58.48,53.88,True,True,True,BULLISH TREND,False,57.36,NEUTRAL,5,Winners And Losers Of Q1: Fortive (NYSE:FTV) Vs The Rest Of The Professional Tools and Equipment Stocks | Is Fortive (FTV) Still Attractively Priced After Recent Share Price Pullback? | 3 Profitable Stocks We’re Skeptical Of,35.14,18.57,953612480.0,58.806,6.81,12.84,44.79,IGNORE
FE,https://www.tradingview.com/chart/?symbol=FE,FirstEnergy Corp.,Utilities,46.66,26989598720,11.6,12.9,-6.91,-4.59,60.2,48.09,45.83,False,True,True,NO CLEAR ENTRY,False,61.45,POSITIVE,5,"CDL’s $2.29 annual dividend beats Treasury yields despite rising interest rates | AEP, other Ohio utilities could own nuclear power plants under state bill | PPL Underperforms Its Industry in a Year: How to Play the Stock?",25.36,15.83,-1835124992.0,198.922,9.46,6.94,44.77,IGNORE
CVX,https://www.tradingview.com/chart/?symbol=CVX,Chevron Corporation,Energy,186.18,370795642880,2.3,-44.5,2.02,1.44,44.13,191.51,166.28,False,True,True,NO CLEAR ENTRY,False,63.7,POSITIVE,5,SCHD’s Dividend Quality Filter Now Concentrates 42 Percent of Your Money in Just Ten Stocks | Progress on Potential Middle East Peace Agreement Drives US Equity Futures Higher Pre-Bell | Chevron (CVX) Price Target Raised by $2 at Morgan Stanley,32.44,15.27,11776499712.0,23.989,6.64,5.93,44.75,IGNORE
AEE,https://www.tradingview.com/chart/?symbol=AEE,Ameren Corporation,Utilities,111.05,30733266944,3.7,19.6,-0.2,-0.06,47.97,110.51,104.23,True,True,True,BULLISH TREND,False,57.43,NEUTRAL,5,"The Bull Case For Ameren (AEE) Could Change Following New Midwest High-Voltage Grid Project Win | Google commits $15 billion to Missouri expansion with new data center project (GOOG) | Here Are Thursday’s Top Wall Street Analyst Research Calls: DraftKings, ETSY, GE Healthcare, Golar LNG, Mastec, Medtronic, Mobileye Global, Occidental Petroleum, and More",19.97,19.13,-1869374976.0,155.674,11.75,17.83,44.69,IGNORE
CPT,https://www.tradingview.com/chart/?symbol=CPT,Camden Property Trust,Real Estate,108.155,10717143040,-0.5,12.1,-0.82,6.29,65.2,102.04,103.71,True,True,False,BULLISH TREND,False,61.69,POSITIVE,5,Morgan Stanley Maintains Equal Weight Rating on Camden (CPT) | This REIT Yielding 16% Just Landed a New $5 Million Bet From EMG Holdings | KB Home Stock Is Down 15%. So Why Did One Investor Buy Up $4 Million in Shares Last Quarter?,30.21,88.41,688079616.0,104.147,9.06,24.49,44.59,IGNORE
GEHC,https://www.tradingview.com/chart/?symbol=GEHC,GE HealthCare Technologies Inc.,Healthcare,64.8,29476988928,7.4,-30.9,-22.75,-5.86,64.56,67.95,75.46,False,False,False,NO CLEAR ENTRY,False,57.23,NEUTRAL,5,"GE HealthCare and UW Medicine Radiology Expand CT, MI Research Tie | 1 S&P 500 Stock on Our Buy List and 2 We Question | GE HealthCare’s New AI Imaging Suite Tests Workflow And Revenue Potential",15.54,12.09,1483624960.0,97.055,19.46,9.1,44.43,IGNORE
CCL,https://www.tradingview.com/chart/?symbol=CCL,Carnival Corporation Ltd.,Consumer Cyclical,26.745,37045559296,6.1,,-17.71,-0.96,55.66,26.02,28.29,True,False,False,NO CLEAR ENTRY,False,60.76,POSITIVE,5,"1 Profitable Stock to Consider Right Now and 2 We Turn Down | Cruise Stocks Have Been Hit Hard. Norwegian Insiders See a Buying Opportunity. | Frontier, Carnival, and Norwegian Cruise Line Shares Skyrocket, What You Need To Know",11.78,10.29,2174000128.0,203.901,27.85,11.48,44.41,IGNORE
RSG,https://www.tradingview.com/chart/?symbol=RSG,"Republic Services, Inc.",Industrials,206.84,63637241856,2.6,7.5,-7.64,-1.41,53.93,211.85,217.4,False,False,False,NO CLEAR ENTRY,False,55.99,NEUTRAL,5,Republic Services Pick of the Week at Smart Insider Following Share Purchases by Cascade Investments | A Look At Republic Services (RSG) Valuation As Mixed Returns Meet 12.9% Upside Estimate | What Could Push Republic Services Stock to a Golden Cross?,29.63,25.66,1808875008.0,117.578,18.35,12.99,44.38,IGNORE
ABT,https://www.tradingview.com/chart/?symbol=ABT,Abbott Laboratories,Healthcare,86.6,150849732608,7.8,-19.7,-25.04,-4.97,48.28,95.36,116.14,False,False,False,NO CLEAR ENTRY,False,68.39,POSITIVE,5,Boston Scientific Bets on WATCHMAN to Drive Structural Heart Growth | Abbott Laboratories (ABT) Slid on Headwinds in Nutrition Business | Reassessing Abbott Laboratories (ABT) After A 32% One Year Share Price Decline,24.26,14.28,6341125120.0,64.773,12.33,13.9,44.32,IGNORE
ALLE,https://www.tradingview.com/chart/?symbol=ALLE,Allegion plc,Industrials,131.5701,11306590208,9.7,-7.0,-17.67,-9.95,48.7,139.65,159.54,False,False,False,NO CLEAR ENTRY,False,58.85,NEUTRAL,5,Is Allegion (ALLE) Still Attractive After Recent Share Price Weakness And DCF Upside Estimate | Allegion Stock Outlook: Is Wall Street Bullish or Bearish? | 1 Cash-Producing Stock Worth Your Attention and 2 We Brush Off,17.97,13.78,494362496.0,105.863,34.18,15.24,44.31,IGNORE
CLX,https://www.tradingview.com/chart/?symbol=CLX,The Clorox Company,Consumer Defensive,96.32,11647144960,0.1,2.7,-23.13,-2.39,74.95,98.3,108.05,False,False,False,WATCH - OVERBOUGHT,False,56.33,NEUTRAL,5,Clorox (CLX) Valuation Check As Investigation And Margin Outlook Reset Shake Investor Confidence | Pomerantz Probe Adds Governance And Legal Risk To Clorox Recovery Story | 1 Mid-Cap Stock to Target This Week and 2 We Ignore,15.66,15.3,62750000.0,4876.087,546.1,11.18,44.21,IGNORE
ALNY,https://www.tradingview.com/chart/?symbol=ALNY,"Alnylam Pharmaceuticals, Inc.",Healthcare,297.57,39729336320,96.4,,-10.16,-2.61,46.74,310.0,387.66,False,False,False,NO CLEAR ENTRY,False,46.92,NEUTRAL,5,"Citi Initiates Alnylam (ALNY) With Buy Rating | StubHub, Jazz Pharmaceuticals upgraded: Wall Street's top analyst calls | Immunic appoints Biogen, Cubist veteran Mike Bonney as board chair ahead of key MS trial readout",74.58,21.3,204714128.0,276.203,90.36,12.55,44.15,IGNORE
HBAN,https://www.tradingview.com/chart/?symbol=HBAN,Huntington Bancshares Incorporated,Financial Services,16.055,32545583104,33.6,-26.5,-7.54,-2.1,43.29,16.01,16.53,True,False,False,NO CLEAR ENTRY,False,57.23,NEUTRAL,5,Top Dividend Stocks To Consider In May 2026 | 3 Dividend Stocks To Consider With Yields Up To 5.7% | Top Three Dividend Stocks To Consider,12.35,8.43,,,8.39,26.6,44.13,IGNORE
CRH,https://www.tradingview.com/chart/?symbol=CRH,CRH plc,Basic Materials,101.51,67829002240,9.1,,-15.6,-13.66,29.72,109.11,115.21,False,False,False,NO CLEAR ENTRY,False,51.09,NEUTRAL,5,CRH (CRH) Appoints Company Veteran Aylwyn Bryan as New CFO | Driven Brands Generated $1.9 Billion in Revenue. So Why Did an Investor Cut $4 Million? | Why CRH (CRH) Is Moving Deeper Into U.S. Water Infrastructure,18.83,15.19,786124992.0,83.227,15.81,9.64,43.94,IGNORE
DVN,https://www.tradingview.com/chart/?symbol=DVN,Devon Energy Corporation,Energy,45.76,52760817664,-0.8,-75.3,7.83,-4.55,31.6,48.25,39.5,False,True,True,NO CLEAR ENTRY,False,56.6,NEUTRAL,5,"Barclays sees multi-year oil boom, sees upside in OXY, Devon and ConocoPhillips | Morgan Stanley Raises Devon Energy (DVN) Price Target by $7 | Occidental Is Trading Above 200-Day SMA: Buy, Hold or Sell the Stock?",12.75,8.54,1600499968.0,56.404,15.18,14.17,43.58,IGNORE
CNP,https://www.tradingview.com/chart/?symbol=CNP,"CenterPoint Energy, Inc.",Utilities,42.945,28093306880,1.9,6.7,0.4,1.67,47.13,42.57,39.81,True,True,True,BULLISH TREND,False,57.06,NEUTRAL,5,A Look At CenterPoint Energy (CNP) Valuation After Recent Pullback And Capital Plan Update | Phantom Data Centers Didn't Break the Power Grid—They Proved It Was Already Broken | Are Wall Street Analysts Predicting CenterPoint Energy Stock Will Climb or Sink?,26.35,20.63,-4945375232.0,215.591,9.56,11.38,43.51,IGNORE
DIS,https://www.tradingview.com/chart/?symbol=DIS,The Walt Disney Company,Communication Services,102.91,178704400384,6.5,-29.8,-2.5,0.3,55.1,101.39,108.1,True,False,False,NO CLEAR ENTRY,False,42.49,NEUTRAL,5,Disney World Strikes Back in 2026 | AI is rewiring digital media’s power structure | Disney's Star Wars Return Opens With $102 Million,16.47,13.73,3751375104.0,41.069,11.01,11.54,43.5,IGNORE
DLTR,https://www.tradingview.com/chart/?symbol=DLTR,"Dollar Tree, Inc.",Consumer Defensive,91.88,17891368960,9.0,,-27.63,-11.44,46.74,100.57,109.53,False,False,False,NO CLEAR ENTRY,False,46.71,NEUTRAL,5,"Dollar Tree Cuts Prices on Select Groceries After Weak Shopper Reaction, Oppenheimer Says | Case-Shiller Home Prices Rise Moderately | Pre-Markets to Open at Record Highs: Retail Earnings, Case-Shiller Report",15.47,12.46,1284562560.0,187.904,31.69,6.61,43.34,IGNORE
LOW,https://www.tradingview.com/chart/?symbol=LOW,"Lowe's Companies, Inc.",Consumer Cyclical,211.74,118786146304,10.3,-0.7,-19.53,-13.38,34.0,233.34,246.86,False,False,False,NO CLEAR ENTRY,False,52.22,NEUTRAL,5,Home Depot Sales Recovery And Mingledorff’s Deal Strengthen Pro Growth Story | The Careful Consumer: What Q1 Earnings Reveal—And Where Cracks May Appear | Telsey Advisory Group Says Lowe’s Continues to Execute Despite Housing Weakness,17.9,15.72,5280124928.0,,,7.51,43.28,IGNORE
OMC,https://www.tradingview.com/chart/?symbol=OMC,Omnicom Group Inc.,Communication Services,74.325,21183084544,69.2,-6.9,-11.38,-1.87,39.78,75.77,75.8,False,False,False,NO CLEAR ENTRY,False,50.0,NEUTRAL,5,"Omnicom Stock Outlook: Is Wall Street Bullish or Bearish? | Down 10.0% in 4 Weeks, Here's Why You Should You Buy the Dip in Omnicom (OMC) | Omnicom Reshapes PR Leadership As Data And Commerce Strategy Evolves",,5.98,5066650112.0,110.574,2.02,0.32,43.25,IGNORE
MGM,https://www.tradingview.com/chart/?symbol=MGM,MGM Resorts International,Consumer Cyclical,38.385,9820849152,4.2,-5.9,2.03,-2.92,53.04,37.66,35.66,True,True,True,BULLISH TREND,False,59.41,NEUTRAL,5,1 Small-Cap Stock with Exciting Potential and 2 That Underwhelm | Winners And Losers Of Q1: MGM Resorts (NYSE:MGM) Vs The Rest Of The Consumer Discretionary - Casino Operator Stocks | MGM Resorts Balances Record Revenue With Earnings Miss And Valuation Questions,52.58,17.23,528360256.0,951.186,13.49,1.03,43.2,IGNORE
MRSH,https://www.tradingview.com/chart/?symbol=MRSH,"Marsh & McLennan Companies, Inc.",Financial Services,162.0,78050705408,7.6,-15.4,-12.12,-4.76,41.36,169.83,182.89,False,False,False,NO CLEAR ENTRY,False,54.35,NEUTRAL,5,Marsh ENEOS Deal Tests Acquisition Driven Growth In Japanese Insurance Market | Booz Allen Hamilton Set to Report Q4 Earnings: What's in the Cards? | 2 Services Stocks with Competitive Advantages and 1 We Brush Off,20.28,14.31,4965374976.0,151.634,27.57,14.26,43.2,IGNORE
XYZ,https://www.tradingview.com/chart/?symbol=XYZ,"Block, Inc.",Technology,68.88,40996065280,4.9,,26.32,-3.84,44.32,66.4,67.7,True,True,False,BULLISH TREND,False,43.54,NEUTRAL,5,Canaccord Raises its Price Target on Block (XYZ) | Block Stock Gains 24.9% in Past 3 Months: Will It Continue to Rise? | Block (XYZ) Announces The Hat Selects Square as Unified Commerce Platform,53.81,13.87,-794561728.0,37.514,3.74,3.3,43.18,IGNORE
ED,https://www.tradingview.com/chart/?symbol=ED,"Consolidated Edison, Inc.",Utilities,108.08,39830691840,6.2,12.9,-1.6,-0.07,49.41,109.42,102.33,False,True,True,NO CLEAR ENTRY,False,63.22,POSITIVE,5,Top 3 Energy Dividend Stocks for Reliable Income in 2026 | Is It Time To Reassess Consolidated Edison (ED) After Its Recent Share Price Performance? | Will PPL Continue Raising Dividends for Long-Term Shareholders?,18.23,16.65,-833249984.0,106.177,8.73,12.52,43.11,IGNORE
PPL,https://www.tradingview.com/chart/?symbol=PPL,PPL Corporation,Utilities,35.95,27046995968,10.8,7.3,-6.17,-7.23,36.59,37.66,36.32,False,False,True,NO CLEAR ENTRY,False,52.12,NEUTRAL,5,Will PPL Continue Raising Dividends for Long-Term Shareholders? | PPL Leans Into Data Center Demand With US$23b Grid Buildout | PPL Underperforms Its Industry in a Year: How to Play the Stock?,22.06,16.98,-1615124992.0,135.116,8.32,13.09,43.02,IGNORE
JNJ,https://www.tradingview.com/chart/?symbol=JNJ,Johnson & Johnson,Healthcare,230.76,555489361920,9.9,-52.9,-5.22,1.43,58.58,233.15,209.81,False,True,True,NO CLEAR ENTRY,False,57.52,NEUTRAL,5,"Assessing Johnson & Johnson (JNJ) Valuation After Guidance Raise Growth Initiatives And Talc Litigation Update | Dow Gives Back Early Gains. Healthcare Stocks Are a Drag. | Inflation Adjusted Dividend Income: How to Replace $80,000 in Today’s Dollars 20 Years From Now",26.77,18.16,12511375360.0,67.73,26.42,21.83,43.0,IGNORE
MRNA,https://www.tradingview.com/chart/?symbol=MRNA,"Moderna, Inc.",Healthcare,47.5009,18847705088,260.2,,-8.14,-6.37,51.81,50.52,37.16,False,True,True,BUY THE DIP,False,46.01,NEUTRAL,5,Astellas eyes more cost cuts; FDA panel to debate Moderna vaccine | Litigation Windfall Driving Roivant Sciences’ Profit Swing Might Change The Case For Investing In Roivant Sciences (ROIV) | 3 Cash-Burning Stocks with Open Questions,,-11.3,-20000000.0,17.522,-36.56,-143.55,42.88,IGNORE
PFE,https://www.tradingview.com/chart/?symbol=PFE,Pfizer Inc.,Healthcare,25.755,146789187584,5.4,-10.1,-3.39,-3.04,44.03,26.45,25.05,False,True,True,NO CLEAR ENTRY,False,63.87,POSITIVE,5,"Thinning revenues: inside the $14bn Eliquis patent cliff | If Viking Therapeutics Is Acquired, Here’s Who Wins | Is Pfizer Inc. (PFE) One of the Best Medical Stocks to Invest in According to Billionaires?",19.66,9.08,12376625152.0,71.602,8.31,11.83,42.71,IGNORE
CAH,https://www.tradingview.com/chart/?symbol=CAH,"Cardinal Health, Inc.",Healthcare,201.215,47125729280,11.0,-19.5,-11.2,0.68,55.94,203.97,191.51,False,True,True,NO CLEAR ENTRY,False,71.03,POSITIVE,5,Cardinal Health (CAH) Valuation Check After Recent Sideways Share Performance | Can CAH's Surging Other Growth Businesses Become Its Next Profit Engine? | 1 of Wall Street’s Favorite Stock with Competitive Advantages and 2 We Find Risky,30.77,16.8,4849999872.0,,,0.62,42.58,IGNORE
A,https://www.tradingview.com/chart/?symbol=A,"Agilent Technologies, Inc.",Healthcare,115.305,32585459712,7.0,-3.6,-4.47,-0.21,44.04,114.79,129.0,True,False,False,NO CLEAR ENTRY,False,57.35,NEUTRAL,5,What To Expect From Agilent’s (A) Q1 Earnings | Assessing Agilent Technologies (NYSE:A) Valuation After TSA Deal And New Detection System Launches | Seeking Clues to Agilent (A) Q2 Earnings? A Peek Into Wall Street Projections for Key Metrics,25.45,17.57,855875008.0,51.39,19.95,18.26,42.24,IGNORE
CSGP,https://www.tradingview.com/chart/?symbol=CSGP,"CoStar Group, Inc.",Real Estate,33.145,13534950400,22.5,,-26.34,-9.04,39.67,37.5,61.69,False,False,False,NO CLEAR ENTRY,False,50.44,NEUTRAL,5,3 Reasons to Avoid CSGP and 1 Stock to Buy Instead | CoStar Data Highlights Shifting Office Yields And New Residential Insights | Are Wall Street Analysts Bullish on CoStar Group Stock?,473.5,18.43,202200000.0,14.526,0.3,0.73,42.19,IGNORE
PM,https://www.tradingview.com/chart/?symbol=PM,Philip Morris International Inc.,Consumer Defensive,181.955,283587575808,9.1,-9.3,-2.09,10.81,66.65,168.87,163.43,True,True,True,BULLISH TREND,False,52.88,NEUTRAL,5,Market Crash: 3 Stocks I'd Buy Without Hesitation | BofA Raises Philip Morris International (PM) Price Target by $9 | Should You Be Adding Philip Morris International (NYSE:PM) To Your Watchlist Today?,25.59,19.92,8575249920.0,,,26.74,41.93,IGNORE
MDT,https://www.tradingview.com/chart/?symbol=MDT,Medtronic plc,Healthcare,77.6303,99668377600,8.7,-11.8,-19.34,-6.83,49.37,82.86,92.01,False,False,False,NO CLEAR ENTRY,False,53.24,NEUTRAL,5,Broad-Based MedSurg Growth Likely to Aid MDT's Q4 Performance | Medtronic plc (MDT) Announces Intention to Acquire SPR Therapeutics (SPR) | Medtronic SPR Therapeutics Deal Expands Pain Portfolio As Shares Screen Undervalued,21.68,12.81,4073125120.0,57.06,9.39,13.0,41.86,IGNORE
TECH,https://www.tradingview.com/chart/?symbol=TECH,Bio-Techne Corporation,Healthcare,48.28,7559139328,-1.5,128.6,-16.49,-10.74,33.67,52.18,57.41,False,False,False,NO CLEAR ENTRY,False,58.43,NEUTRAL,5,Are Wall Street Analysts Bullish on Bio-Techne Stock? | 2 Healthcare Stocks to Research Further and 1 We Find Risky | The 5 Most Interesting Analyst Questions From Bio-Techne’s Q1 Earnings Call,68.97,23.39,299849376.0,13.922,5.34,9.05,41.82,IGNORE
FER,https://www.tradingview.com/chart/?symbol=FER,Ferrovial N.V.,Industrials,68.93,49414332416,5.7,-87.6,-6.03,0.75,50.02,67.13,63.84,True,True,True,BULLISH TREND,False,60.31,POSITIVE,5,TxDOT selects Ferrovial for $1.47bn SH 99 Grand Parkway project | Ferrovial (BME:FER) Valuation Check As Fair Value Sits Close To Market Price | Semafor World Economy: Ferrovial CEO Ignacio Madridejos on its Infrastructure,50.68,45.39,321375008.0,140.013,14.32,9.22,41.77,IGNORE
TTWO,https://www.tradingview.com/chart/?symbol=TTWO,"Take-Two Interactive Software, Inc.",Communication Services,221.8477,41189720064,6.1,,4.01,5.27,48.77,212.83,231.86,True,False,False,NO CLEAR ENTRY,False,62.04,POSITIVE,5,Wall Street Analysts Think Take-Two (TTWO) Is a Good Investment: Is It? | Wedbush sends bold message on Take-Two stock after earnings | 10 of 11 Sectors Higher: Why the S&P’s Rally Looks Healthier Than the Headlines Suggest,,22.04,1447787520.0,84.26,-10.56,-4.48,41.71,IGNORE
VRSK,https://www.tradingview.com/chart/?symbol=VRSK,"Verisk Analytics, Inc.",Industrials,170.83,22382460928,3.9,4.8,-15.48,-3.81,40.05,179.53,214.85,False,False,False,NO CLEAR ENTRY,False,58.26,NEUTRAL,5,Is It Time To Reassess Verisk Analytics (VRSK) After Its Recent Share Price Rebound? | Here's Why You Should Retain Verisk Stock in Your Portfolio Now | Verisk Analytics Stock Outlook: Is Wall Street Bullish or Bearish?,26.08,19.73,944362496.0,,,29.34,41.56,IGNORE
MSTR,https://www.tradingview.com/chart/?symbol=MSTR,Strategy Inc,Technology,162.785,57155366912,11.9,,22.03,-4.82,35.36,155.31,211.34,True,False,False,NO CLEAR ENTRY,False,45.01,NEUTRAL,5,"Michael Saylor buys back $1.5B worth debt | Strategy's Michael Saylor is buying bonds now instead of bitcoin | Strategy Cuts Convertible Debt By 18%, Bitmine Stakes $10B In ETH — MSTR And BMNR Move High",,36.48,-8699502592.0,18.094,-30.76,0.0,41.5,IGNORE
LUV,https://www.tradingview.com/chart/?symbol=LUV,Southwest Airlines Co.,Industrials,41.79,20425854976,12.8,,-17.59,5.93,60.02,39.56,38.16,True,True,True,BULLISH TREND,False,60.73,POSITIVE,5,Americans pick a new favorite airline for 2026 | American Airlines to Offer Starlink Internet on Flights | Why Is Southwest (LUV) Up 8% Since Last Earnings Report?,27.86,9.27,-372375008.0,93.033,10.06,2.83,41.31,IGNORE
WEC,https://www.tradingview.com/chart/?symbol=WEC,"WEC Energy Group, Inc.",Utilities,113.48,36963348480,9.0,7.9,-1.16,-0.13,47.29,113.76,109.83,False,True,True,NO CLEAR ENTRY,False,64.95,POSITIVE,5,Is WEC Energy Group (WEC) Fairly Priced After Recent Dividend Stability Focus? | CDL’s $2.29 annual dividend beats Treasury yields despite rising interest rates | Forget Utility Dividends. Kevin Warsh Just Made the 30-Year Treasury a Better Income Play,22.74,18.9,-2067012480.0,153.184,11.68,16.24,41.3,IGNORE
LDOS,https://www.tradingview.com/chart/?symbol=LDOS,"Leidos Holdings, Inc.",Technology,127.08,15984817152,3.7,-7.6,-27.56,-12.99,31.22,147.5,175.63,False,False,False,NO CLEAR ENTRY,False,43.45,NEUTRAL,5,Leidos (LDOS) Selected for $10B “Evolve” Contract to Modernize US State Department IT Systems | New US$2.7 Billion Hypersonic Weapons Contract Might Change The Case For Investing In Leidos Holdings (LDOS) | What Are Wall Street Analysts' Target Price for Leidos Holdings Stock?,11.63,9.63,1194749952.0,137.125,30.58,8.15,41.28,IGNORE
COP,https://www.tradingview.com/chart/?symbol=COP,ConocoPhillips,Energy,117.0,142540406784,-5.3,-20.2,6.48,-3.2,41.13,122.83,101.97,False,True,True,NO CLEAR ENTRY,False,50.26,NEUTRAL,5,"Barclays sees multi-year oil boom, sees upside in OXY, Devon and ConocoPhillips | ConocoPhillips (COP) Price Target Raised by $4 at Morgan Stanley | ConocoPhillips (COP) Rallied on Rise in Oil Prices",19.83,12.78,5289124864.0,36.143,11.28,12.33,41.12,IGNORE
MSI,https://www.tradingview.com/chart/?symbol=MSI,"Motorola Solutions, Inc.",Technology,409.54,67981832192,7.4,-13.8,-12.99,-6.55,38.33,432.36,426.67,False,False,True,NO CLEAR ENTRY,False,65.24,POSITIVE,5,"BlackBerry Is Back, But This Time It’s About Cars, Robots, and AI | 2 S&P 500 Stocks with Promising Prospects and 1 Facing Challenges | 3 Big Reasons to Love Motorola Solutions (MSI)",33.0,22.15,1815124992.0,374.132,99.29,17.61,41.12,IGNORE
MELI,https://www.tradingview.com/chart/?symbol=MELI,"MercadoLibre, Inc.",Consumer Cyclical,1648.64,83581403136,49.0,-15.6,-5.3,-10.17,37.41,1726.46,2035.97,False,False,False,NO CLEAR ENTRY,False,67.98,POSITIVE,5,Amazon.com vs. MercadoLibre: Which Consumer Stock Is a Better Buy in 2026? | 3 Cash-Heavy Stocks with Promising Prospects | MercadoLibre vs. eBay: Which E-Commerce Platform Holds the Edge?,43.44,27.86,-4104624896.0,169.977,31.26,6.04,41.09,IGNORE
CHTR,https://www.tradingview.com/chart/?symbol=CHTR,"Charter Communications, Inc.",Communication Services,144.52,20403097600,-1.0,8.9,-36.72,-19.77,35.85,193.26,222.53,False,False,False,NO CLEAR ENTRY,False,42.83,NEUTRAL,5,"3 Reasons to Sell CHTR and 1 Stock to Buy Instead | Charter Communications Stock Outlook: Is Wall Street Bullish or Bearish? | Charter Communications Eyes Cash Flow Lift as Network Upgrades, Cox Deal Advance",3.91,3.27,2403624960.0,459.525,27.5,9.03,40.98,IGNORE
ATO,https://www.tradingview.com/chart/?symbol=ATO,Atmos Energy Corporation,Utilities,177.9,29695035392,0.6,14.5,-3.12,-4.07,28.35,184.34,173.89,False,True,True,NO CLEAR ENTRY,False,64.27,POSITIVE,5,"Is Wall Street Bullish or Bearish on Atmos Energy Stock? | Top Research Reports for Visa, IBM & CrowdStrike | 4 Low-Beta Utility Picks as Consumer Sentiment Hits Rock Bottom",21.88,19.92,-2210371840.0,64.588,9.6,27.58,40.94,IGNORE
KHC,https://www.tradingview.com/chart/?symbol=KHC,The Kraft Heinz Company,Consumer Defensive,23.89,28328226816,0.8,13.6,-1.14,8.89,66.67,22.62,23.97,True,False,False,NO CLEAR ENTRY,False,49.06,NEUTRAL,5,JELL O Simply Launch Puts Kraft Heinz Valuation And Debt In Focus | Walmart Flags Higher Fuel Costs Eroding Retailer’s Earnings | Kraft Heinz launches Jell-O line without artificial dyes,,11.33,3212250112.0,50.258,-12.58,-23.05,40.87,IGNORE
EXR,https://www.tradingview.com/chart/?symbol=EXR,Extra Space Storage Inc.,Real Estate,143.66,31704889344,3.8,-10.6,-1.57,1.1,58.78,138.91,137.37,True,True,True,BULLISH TREND,False,58.07,NEUTRAL,5,A Look At Extra Space Storage (EXR) Valuation As Shares Show Mixed Recent Performance | Is Wall Street Bullish or Bearish on Extra Space Storage Stock? | Healthcare REITs and Storage Units Prop Up REZ While Residential Faces Headwinds,32.21,30.02,1340995200.0,98.092,6.83,27.14,40.85,IGNORE
