JKHY,https://www.tradingview.com/chart/?symbol=JKHY,"Jack Henry & Associates, Inc.",Technology,137.34,9758114816,8.7,12.5,-14.43,-9.14,32.69,151.85,162.53,False,False,False,NO CLEAR ENTRY,False,67.29,POSITIVE,5,"ROP vs. JKHY: Which Stock Should Value Investors Buy Now? | Here's Why Jack Henry (JKHY) is a Strong Growth Stock | Why Jack Henry (JKHY) Is Down 6.2% After Mixed Signals On Margins, Buybacks And Guidance",19.18,19.42,373407744.0,6.398,24.89,20.64,58.43,IGNORE
FDX,https://www.tradingview.com/chart/?symbol=FDX,FedEx Corporation,Industrials,400.78,95628812288,8.3,17.3,3.8,3.3,73.93,372.9,302.94,True,True,True,WATCH - OVERBOUGHT,False,56.38,NEUTRAL,5,"FedEx InPost Bid Tests Growth Ambitions Valuation Gap And Debt Concerns | FedEx sum-of-the-parts valuation points to upside as freight spin-off approaches, UBS says | Is the Stock Market Open Today? Here Are the Trading Hours for Memorial Day.",21.41,17.89,894000000.0,140.994,15.87,4.88,58.41,IGNORE
HAS,https://www.tradingview.com/chart/?symbol=HAS,"Hasbro, Inc.",Consumer Cyclical,88.8,12564373504,12.7,98.6,-11.52,-6.6,38.86,93.1,85.19,False,True,True,BUY THE DIP,False,57.87,NEUTRAL,5,"Do Options Traders Know Something About Hasbro Stock We Don't? | Jim Cramer Discusses Hasbro (HAS) Stock | HAS Q1 Deep Dive: Magic Drives Growth, Guidance Remains Unchanged Amid Cost Pressures",,13.85,547924992.0,574.488,-23.32,-4.62,58.33,IGNORE
WRB,https://www.tradingview.com/chart/?symbol=WRB,W. R. Berkley Corporation,Financial Services,67.3,25054226432,4.0,26.0,-5.98,1.16,54.73,66.56,70.08,True,False,False,NO CLEAR ENTRY,False,57.36,NEUTRAL,5,1 Unpopular Stock That Should Get More Attention and 2 We Turn Down | American Financial Trades Above 200-Day SMA: What Should Investors Do? | W. R. Berkley Stock: Analyst Estimates & Ratings,14.26,13.94,3222230528.0,31.76,20.16,12.64,58.24,IGNORE
DOC,https://www.tradingview.com/chart/?symbol=DOC,"Healthpeak Properties, Inc.",Real Estate,19.805,13653957632,7.1,363.9,15.06,21.18,86.0,17.41,17.04,True,True,True,WATCH - OVERBOUGHT,False,57.22,NEUTRAL,5,SPHD’s High Dividend Low Volatility Promise Has Returned Just 6 Percent Annualized While the S&P 500 Doubled It | A Look At Healthpeak Properties (DOC) Valuation After Strong Recent Share Price Momentum | Verizon and 4 Other Stocks With 5% Yields—and Market-Beating Returns,61.89,146.7,1109761536.0,118.243,2.8,7.73,58.23,IGNORE
MA,https://www.tradingview.com/chart/?symbol=MA,Mastercard Incorporated,Financial Services,492.5,435165069312,15.8,21.2,-4.16,-2.31,46.54,501.44,541.66,False,False,False,NO CLEAR ENTRY,False,57.64,NEUTRAL,5,"Buffett Bet Big On Visa, Mastercard Stocks 15 Years Ago: Here's How Much Those Positions Gained | Palantir’s AI Surge Meets Market Correction. Buy the PLTR Stock Dip Now. | Berkshire Hathaway’s latest stock purge sends a clear message",28.47,21.63,16148124672.0,282.059,232.08,45.88,58.11,IGNORE
GILD,https://www.tradingview.com/chart/?symbol=GILD,"Gilead Sciences, Inc.",Healthcare,135.405,168114765824,4.4,54.8,-5.28,3.84,54.19,135.67,127.47,False,True,True,NO CLEAR ENTRY,False,58.59,NEUTRAL,5,3 Stocks Estimated To Be Trading At Discounts Of Up To 44.1% | Astellas eyes more cost cuts; FDA panel to debate Moderna vaccine | Gilead Sciences (GILD) Acquires Tubulis for $3.15B to Expand Oncology Portfolio,18.42,14.12,7934125056.0,94.635,43.36,30.99,58.04,IGNORE
EPAM,https://www.tradingview.com/chart/?symbol=EPAM,"EPAM Systems, Inc.",Technology,100.62,5256837120,7.6,18.8,-27.41,-15.43,38.21,119.91,160.94,False,False,False,NO CLEAR ENTRY,False,55.86,NEUTRAL,5,EPAM Systems Targets Biotech Growth As Shares Trade Below Valuation Estimates | These 2 Computer and Technology Stocks Could Beat Earnings: Why They Should Be on Your Radar | What to Know About This Fund's $39 Million EPAM Exit After a 43% Stock Decline,14.46,7.13,692900224.0,8.391,10.93,6.96,57.97,IGNORE
PPG,https://www.tradingview.com/chart/?symbol=PPG,"PPG Industries, Inc.",Basic Materials,109.32,24367427584,6.7,4.2,-10.89,0.21,56.89,106.18,106.16,True,True,True,BULLISH TREND,False,56.12,NEUTRAL,5,A Look At PPG Industries (PPG) Valuation After Q1 Beat And Coatings Expansion | PPG Launches Selemix 7-140 Topcoat for Heavy Industries for EMEA | PPG Launches SEM Automotive Refinish Products in Mexico,15.66,12.62,728374976.0,93.736,20.75,9.83,57.89,IGNORE
UHS,https://www.tradingview.com/chart/?symbol=UHS,"Universal Health Services, Inc.",Healthcare,156.63,9481808896,9.6,17.7,-23.27,-10.16,33.08,176.49,200.55,False,False,False,NO CLEAR ENTRY,False,48.41,NEUTRAL,5,2 Reasons UHS is Risky and 1 Stock to Buy Instead | Universal Health Services (UHS): Cheap NYSE Stocks to Buy According to Analysts | Do Wall Street Analysts Like Universal Health Services Stock?,6.54,6.15,650819008.0,67.405,21.37,8.56,57.87,IGNORE
STE,https://www.tradingview.com/chart/?symbol=STE,STERIS plc,Healthcare,215.32,21133015040,7.3,52.2,-15.46,-2.92,52.67,218.34,241.54,False,False,False,NO CLEAR ENTRY,False,47.22,NEUTRAL,5,Reasons to Retain STE Stock in Your Portfolio for Now | Q1 Earnings Highs And Lows: STERIS (NYSE:STE) Vs The Rest Of The Surgical Equipment & Consumables - Diversified Stocks | STE Q1 Deep Dive: Margin Expansion and Service Growth Offset Cost Pressures,27.15,17.8,587568000.0,26.84,11.37,13.18,57.68,IGNORE
RTX,https://www.tradingview.com/chart/?symbol=RTX,RTX Corporation,Industrials,177.64,239076704256,8.7,32.5,-9.74,2.36,60.92,186.31,179.01,False,False,True,NO CLEAR ENTRY,False,60.72,POSITIVE,5,RTX Defense Breakthroughs Highlight Modular And Software Centric Growth Story | Raytheon awarded DARPA contract to advance adaptable rocket motor technology (RTX) | 3 Blue Chip Dividend Stocks to Buy in June as the Dow Jones Industrial Average Turns 130,33.31,23.48,7233375232.0,57.229,11.57,8.03,57.51,IGNORE
WMB,https://www.tradingview.com/chart/?symbol=WMB,"The Williams Companies, Inc.",Energy,76.725,93834543104,9.0,25.0,3.35,6.3,51.86,73.81,64.78,True,True,True,BULLISH TREND,False,65.06,POSITIVE,5,Why Natural Gas Stocks Still Yield More Than Most Dividend ETFs | Is It Too Late To Reassess Williams Companies (WMB) After Its 37% One-Year Rally? | 2 High-Yield Energy Stocks to Buy and Hold Forever,33.65,29.84,-190250000.0,199.855,19.66,23.06,57.5,IGNORE
AON,https://www.tradingview.com/chart/?symbol=AON,Aon plc,Financial Services,319.3451,68204748800,6.5,27.1,-3.05,-0.3,54.52,320.98,340.82,False,False,False,NO CLEAR ENTRY,False,51.67,NEUTRAL,5,"Zacks Industry Outlook Highlights Arthur J. Gallagher, Aon, Brown and Brown and Willis Towers Watson Public | Should You Continue to Hold AON Stock at 16.3X P/E Valuation? | 4 Insurance Brokerage Stocks to Gain From Demand and M&A",17.53,14.91,3341625088.0,155.05,46.45,22.54,57.33,IGNORE
TGT,https://www.tradingview.com/chart/?symbol=TGT,Target Corporation,Consumer Defensive,124.7401,56654098432,6.7,-24.7,9.69,-2.58,46.02,122.13,103.22,True,True,True,BULLISH TREND,False,47.56,NEUTRAL,5,"Walmart Sinks 8.1% Post Q1 Earnings: Exit WMT Stock or Stay Put? | Buy, Hold or Sell Costco Stock? Key Tips Ahead of Q3 Earnings | Insiders At Target Sold US$11m In Stock, Alluding To Potential Weakness",16.48,14.04,2776875008.0,117.152,22.02,3.24,57.25,IGNORE
TKO,https://www.tradingview.com/chart/?symbol=TKO,"TKO Group Holdings, Inc.",Communication Services,189.42,14200376320,25.9,63.0,-15.03,1.57,53.72,191.35,195.27,False,False,False,NO CLEAR ENTRY,False,53.99,NEUTRAL,5,TKO Group (TKO) Director Buys $988K in Shares | TKO Expands Event Footprint With Arizona Deal And Abu Dhabi Return | TKO Group Stock: Analyst Estimates & Ratings,70.68,40.63,830904512.0,58.229,6.74,4.47,57.22,IGNORE
PGR,https://www.tradingview.com/chart/?symbol=PGR,The Progressive Corporation,Financial Services,197.42,115194576896,8.7,9.8,-6.71,-1.73,49.39,200.26,211.44,False,False,False,NO CLEAR ENTRY,False,55.0,NEUTRAL,5,"Berkshire Hathaway Stock Lags Industry in 3 Months: Is it Still a Buy? | With EPS Growth And More, Progressive (NYSE:PGR) Makes An Interesting Case | Property & Casualty Insurance Stocks Q1 Results: Benchmarking Progressive (NYSE:PGR)",10.05,12.18,15501625344.0,26.174,37.9,12.93,57.2,IGNORE
VLTO,https://www.tradingview.com/chart/?symbol=VLTO,Veralto Corporation,Industrials,86.075,21139955712,6.8,13.3,-12.05,-2.87,41.08,88.17,97.68,False,False,False,NO CLEAR ENTRY,False,57.09,NEUTRAL,5,Assessing Veralto (VLTO) Valuation After Recent Share Weakness And Recurring Revenue Growth Narrative | Veralto Corporation Stock Outlook: Is Wall Street Bullish or Bearish? | 1 Oversold Stock Ready to Bounce Back and 2 We Ignore,22.18,18.51,768249984.0,95.542,36.46,17.32,57.12,IGNORE
CFG,https://www.tradingview.com/chart/?symbol=CFG,"Citizens Financial Group, Inc.",Financial Services,63.4,26810716160,13.8,46.8,-0.01,0.1,45.28,61.85,56.73,True,True,True,BULLISH TREND,False,60.9,POSITIVE,5,Regional Banks Stocks Q1 Recap: Benchmarking Citizens Financial Group (NYSE:CFG) | WFC's Efficiency Story: Will Cost Cuts Lift ROTCE to Its Target Level? | Is Citizens Financial (CFG) Balancing Slower Growth With Stronger Investor Communication Or Revealing Deeper Strains?,15.02,9.89,,,7.74,25.05,57.02,IGNORE
ES,https://www.tradingview.com/chart/?symbol=ES,Eversource Energy,Utilities,69.83,26261669888,9.4,7.4,-4.86,2.94,57.91,68.23,67.5,True,True,True,BULLISH TREND,False,60.2,POSITIVE,5,3 Beaten-Down Utility Stocks: Which Is the Best Dip-Buy Right Now? | Forget Utility Dividends. Kevin Warsh Just Made the 30-Year Treasury a Better Income Play | Eversource misclassified $385M transmission project to avoid scrutiny: ratepayer complaint,14.95,14.07,587291392.0,181.822,10.91,12.55,56.92,IGNORE
NEE,https://www.tradingview.com/chart/?symbol=NEE,"NextEra Energy, Inc.",Utilities,88.02,183574970368,7.3,160.0,-3.66,-7.62,28.03,92.75,84.2,False,True,True,BUY THE DIP,False,69.5,POSITIVE,5,Morgan Stanley Keeps Bullish View on NextEra Energy (NEE) Despite PT Cut | 5 Strong Buy Passive Income Giants Have Raised Their Dividends by Double Digits for Years | VST Stock Underperforms Industry in the Past 3 Months: How to Play?,22.34,20.04,-18453374976.0,156.686,10.32,29.37,56.86,IGNORE
AEP,https://www.tradingview.com/chart/?symbol=AEP,"American Electric Power Company, Inc.",Utilities,131.5,71549812736,10.2,6.7,0.27,-1.69,39.84,131.35,119.9,True,True,True,BULLISH TREND,False,59.46,NEUTRAL,5,"CDL’s $2.29 annual dividend beats Treasury yields despite rising interest rates | Why American Electric Power (AEP) Is Up 5.1% After $2.6 Billion Follow-On Equity Offering – And What's Next | AEP, other Ohio utilities could own nuclear power plants under state bill",19.45,19.18,-6953449984.0,157.099,12.58,16.29,56.66,IGNORE
CINF,https://www.tradingview.com/chart/?symbol=CINF,Cincinnati Financial Corporation,Financial Services,167.35,25886826496,11.6,,1.9,1.74,80.38,162.61,159.8,True,True,True,WATCH - OVERBOUGHT,False,59.01,NEUTRAL,5,MCY Outperforms Industry in a Year: Time to Add It for Better Returns? | Cincinnati Financial Stock: Analyst Estimates & Ratings | Assessing Cincinnati Financial (CINF) Valuation After Q1 2026 Profit Rebound And Lower Catastrophe Losses,9.57,18.22,2748250112.0,5.626,18.73,21.33,56.62,IGNORE
ISRG,https://www.tradingview.com/chart/?symbol=ISRG,"Intuitive Surgical, Inc.",Healthcare,438.62,155342913536,23.0,18.8,-13.47,-9.04,43.51,457.53,495.82,False,False,False,NO CLEAR ENTRY,False,58.13,NEUTRAL,5,Intuitive Surgical (ISRG) Announces Several Innovations to Advance Quintuple Aim | Is Intuitive Surgical (ISRG) One of the Best Robotic Surgery Stocks to Buy? | ISRG's Ion Platform: A Major Growth Engine in Lung Cancer Care?,53.23,37.21,2254087424.0,,17.23,28.15,56.5,IGNORE
BXP,https://www.tradingview.com/chart/?symbol=BXP,"BXP, Inc.",Real Estate,60.883,10856134656,0.6,65.5,0.89,5.46,63.38,55.98,64.08,True,False,False,NO CLEAR ENTRY,False,66.78,POSITIVE,5,Are Wall Street Analysts Bullish on BXP Stock? | Is BXP (BXP) Offering Value After Recent Rebound And Mixed Long Term Returns? | Healthpeak Properties Q1 FFOA Tops Estimates on Steady Leasing Momentum,30.59,28.65,941118656.0,211.994,5.53,10.04,56.49,IGNORE
PEP,https://www.tradingview.com/chart/?symbol=PEP,"PepsiCo, Inc.",Consumer Defensive,146.35,200051818496,8.5,27.8,-11.89,-5.85,31.13,153.82,149.0,False,False,True,NO CLEAR ENTRY,False,56.37,NEUTRAL,5,"The use of AI in food NPD is changing | Zacks Industry Outlook Highlights Coca-Cola, PepsiCo, Monster Beverage, Fomento Economico Mexicano and Vita Coco | New Walmart soda line takes on Coca-Cola and PepsiCo",22.97,16.0,8746250240.0,244.837,43.88,9.15,56.21,IGNORE
ACN,https://www.tradingview.com/chart/?symbol=ACN,Accenture plc,Technology,178.005,109550534656,8.3,4.0,-13.44,-0.2,49.1,185.77,231.1,False,False,False,NO CLEAR ENTRY,False,48.73,NEUTRAL,5,AI Disruption Threat on Accenture (ACN) Overdone? | Top Dividend Stocks To Consider In May 2026 | Accenture (ACN) Invests in Aera Technology to Advance Agentic AI Supply Chain Solutions,14.58,11.94,12164313088.0,25.469,24.76,10.61,55.95,IGNORE
IDXX,https://www.tradingview.com/chart/?symbol=IDXX,"IDEXX Laboratories, Inc.",Healthcare,556.975,43935858688,14.3,17.2,-15.7,-1.58,47.34,565.97,639.65,False,False,False,NO CLEAR ENTRY,False,53.82,NEUTRAL,5,"Should IDEXX’s (IDXX) SDMA-Enhanced Catalyst Panels Prompt Action From Long-Term Diagnostics Investors? | Do You Believe in the Long-Term Growth Potential of IDEXX Laboratories (IDXX)? | BofA Sees Slower InVue Installations as Headwind for IDEXX Laboratories, Inc. (IDXX)",40.98,33.72,786844480.0,71.04,72.91,24.63,55.91,IGNORE
BR,https://www.tradingview.com/chart/?symbol=BR,"Broadridge Financial Solutions, Inc.",Technology,147.32,17038781440,7.8,15.1,-19.17,-5.0,40.04,158.09,205.47,False,False,False,NO CLEAR ENTRY,False,63.33,POSITIVE,5,Did Broadridge's (BR) Dividend Steadiness and New AI Bets Just Reframe Its Capital Allocation Story? | 2 Value Stocks with Exciting Potential and 1 We Question | You will soon be able to vote in Amazon shareholder meetings from a crypto wallet,15.76,14.16,1187662464.0,120.878,42.31,15.03,55.87,IGNORE
MCK,https://www.tradingview.com/chart/?symbol=MCK,McKesson Corporation,Healthcare,758.08,91124285440,6.0,37.2,-22.14,-8.46,38.72,830.49,816.16,False,False,True,NO CLEAR ENTRY,False,59.65,NEUTRAL,5,A Look Back at Healthcare Providers & Services Stocks’ Q1 Earnings: McKesson (NYSE:MCK) Vs The Rest Of The Pack | Here's Why You Should Retain McKesson Stock in Your Portfolio for Now | TBRG Posts Q1 Earnings: How to Play the Stock Amid Pending Sell-off?,19.75,15.06,5657625088.0,,,1.18,55.87,IGNORE
CCEP,https://www.tradingview.com/chart/?symbol=CCEP,Coca-Cola Europacific Partners PLC,Consumer Defensive,93.35,41333235712,0.2,68.3,-12.92,-3.79,52.65,93.63,91.41,False,True,True,NO CLEAR ENTRY,False,62.31,POSITIVE,5,"Wall Street Futures Advance Premarket Tuesday on Mid East Peace Talks Optimism | Coca-Cola Europacific Partners Updates ESG Plan, Adds Philippines and Six 2030 Sustainability Targets | Coca-Cola Europacific Partners Q1 Earnings Call Highlights",18.86,16.42,1747874944.0,130.001,22.89,9.29,55.83,IGNORE
CTSH,https://www.tradingview.com/chart/?symbol=CTSH,Cognizant Technology Solutions Corporation,Technology,52.065,24629110784,5.8,3.6,-19.29,-4.85,51.77,56.14,68.33,False,False,False,NO CLEAR ENTRY,False,68.31,POSITIVE,5,"Why Cognizant (CTSH) is a Top Growth Stock for the Long-Term | As Zscaler Doubles Down on AI Security, ZS Stock Still Needs More to Justify Its Steep Valuation | DXC and Grid Dynamics Stocks Trade Up, What You Need To Know",11.3,8.45,1908875008.0,7.247,14.88,10.41,55.76,IGNORE
AIG,https://www.tradingview.com/chart/?symbol=AIG,"American International Group, Inc.",Financial Services,77.49,41085677568,1.4,21.6,-2.99,3.13,45.11,76.3,77.64,True,False,False,NO CLEAR ENTRY,False,63.32,POSITIVE,5,"A Look At American International Group (AIG) Valuation As Shares Weaken Year To Date | Should Value Investors Buy American International Group (AIG) Stock? | AIG to Acquire Everest Colombia Unit, Expand Latin America Footprint",13.64,8.71,9517249536.0,22.647,7.72,11.84,55.72,IGNORE
EMR,https://www.tradingview.com/chart/?symbol=EMR,Emerson Electric Co.,Industrials,139.29,78016323584,2.9,27.9,-8.43,-1.06,52.0,136.27,136.14,True,True,True,BULLISH TREND,False,57.63,NEUTRAL,5,"Emerson Electric Co. (EMR) Is a Trending Stock: Facts to Know Before Betting on It | Top Analyst Reports for Broadcom, Berkshire Hathaway & Exxon Mobil | Emerson Expands AI Software And Partnership As Valuation Signals Remain Mixed",32.24,19.47,3272250112.0,69.182,12.33,13.35,55.66,IGNORE
ELV,https://www.tradingview.com/chart/?symbol=ELV,"Elevance Health, Inc.",Healthcare,386.44,83920232448,2.6,-16.8,20.36,12.09,61.39,338.89,330.85,True,True,True,BULLISH TREND,False,50.86,NEUTRAL,5,"Sickly Healthcare Stocks Are Perking Up. For Contrarian Investors, Buying Now Could Be Just the Remedy to Protect Your Portfolio. | What Elevance Health (ELV)'s Raised EPS Outlook and Insider Stock Sale Means For Shareholders | Elevance Health (ELV) Up 12.6% Since Last Earnings Report: Can It Continue?",16.37,13.21,4298625024.0,72.299,12.09,2.62,55.62,IGNORE
NOC,https://www.tradingview.com/chart/?symbol=NOC,Northrop Grumman Corporation,Industrials,554.255,78722760704,4.4,84.9,-22.03,-3.63,46.7,626.96,617.07,False,False,True,NO CLEAR ENTRY,False,59.06,NEUTRAL,5,BAESY vs. NOC: Which Defense Stock Offers Better Investment Potential? | Raytheon awarded DARPA contract to advance adaptable rocket motor technology (RTX) | 2 of Wall Street’s Favorite Stocks with Exciting Potential and 1 We Brush Off,17.38,18.38,2071624960.0,102.682,28.51,10.8,55.57,IGNORE
VMC,https://www.tradingview.com/chart/?symbol=VMC,Vulcan Materials Company,Basic Materials,268.41,34827509760,7.4,29.7,-12.8,-7.92,29.57,279.08,290.85,False,False,False,NO CLEAR ENTRY,False,64.5,POSITIVE,5,Do Wall Street Analysts Like Vulcan Materials Company Stock? | 1 of Wall Street’s Favorite Stock with Solid Fundamentals and 2 We Question | Why Vulcan Materials (VMC) Remains Closely Tied to Public Construction Demand,31.76,24.75,239012496.0,61.249,13.46,13.81,55.41,IGNORE
OTIS,https://www.tradingview.com/chart/?symbol=OTIS,Otis Worldwide Corporation,Industrials,72.63,27869296640,6.4,42.6,-20.11,-6.26,37.71,76.89,85.31,False,False,False,NO CLEAR ENTRY,False,53.61,NEUTRAL,5,How Otis Link MOD Escalator Upgrades Could Reshape Otis Worldwide’s (OTIS) Investment Narrative | Otis Worldwide (OTIS) Valuation Check After Mixed Results And Launch Of Otis Link MOD Suite | Otis Worldwide (OTIS) Down 9.9% Since Last Earnings Report: Can It Rebound?,19.32,15.39,1682125056.0,,,10.11,55.39,IGNORE
WSM,https://www.tradingview.com/chart/?symbol=WSM,"Williams-Sonoma, Inc.",Consumer Cyclical,195.87,23063027712,4.4,4.3,-6.97,2.79,64.33,183.95,191.76,True,True,False,BULLISH TREND,False,63.89,POSITIVE,5,"Williams-Sonoma, Inc. Just Beat EPS By 7.3%: Here's What Analysts Think Will Happen Next | 2 S&P 500 Stocks to Research Further and 1 We Question | WSM Q1 Deep Dive: Broad-Based Growth and Supply Chain Efficiencies Support Guidance Amid Tariff Uncertainty",21.98,19.16,885462144.0,79.878,54.01,13.81,55.26,IGNORE
INVH,https://www.tradingview.com/chart/?symbol=INVH,Invitation Homes Inc.,Real Estate,29.415,17473744896,9.2,-3.7,13.21,8.42,60.27,26.88,27.27,True,True,False,BULLISH TREND,False,63.92,POSITIVE,5,Is Invitation Homes (INVH) the Best Residential REIT to Buy in 2026? | INVH Stock Up 11.4% in Three Months: Will the Momentum Last? | The Houe Housing Bill Is a Welcome Turn for Blackstone and Other Institutional Investors,30.96,44.28,1021075392.0,97.038,6.19,20.96,55.11,IGNORE
COO,https://www.tradingview.com/chart/?symbol=COO,"The Cooper Companies, Inc.",Healthcare,62.56,12206357504,6.2,26.9,-25.53,-2.89,57.32,66.42,73.3,False,False,False,NO CLEAR ENTRY,False,60.75,POSITIVE,5,What Are Wall Street Analysts' Target Price for Cooper Companies’ Stock? | 2 Mid-Cap Stocks with Exciting Potential and 1 We Find Risky | Why The Cooper Companies (COO) is a Top Value Stock for the Long-Term,31.12,12.46,367087488.0,33.201,4.87,9.67,55.11,IGNORE
MAR,https://www.tradingview.com/chart/?symbol=MAR,"Marriott International, Inc.",Consumer Cyclical,373.17,98400690176,12.6,1.7,6.66,1.84,72.75,348.88,307.56,True,True,True,WATCH - OVERBOUGHT,False,69.78,POSITIVE,5,"Marriott International (MAR) Valuation Check After Strong One Year Shareholder Returns | How to Invest Now If You Want to Profit from the 2026 World Cup | Brunswick, Figs, Marriott Vacations, WeightWatchers, and PVH Shares Are Soaring, What You Need To Know",39.03,28.52,1796875008.0,,,35.97,55.08,IGNORE
PNC,https://www.tradingview.com/chart/?symbol=PNC,"The PNC Financial Services Group, Inc.",Financial Services,220.51,88549015552,13.8,17.7,-0.28,0.3,47.95,214.63,204.3,True,True,True,BULLISH TREND,False,52.44,NEUTRAL,5,"3 Bank Stocks with Warning Signs | Is It Too Late To Consider PNC Financial (PNC) After Its 107% Three Year Run? | Why The PNC Financial Services Group, Inc (PNC) is a Top Dividend Stock for Your Portfolio",12.81,10.48,,,12.1,31.31,55.0,IGNORE
FDS,https://www.tradingview.com/chart/?symbol=FDS,FactSet Research Systems Inc.,Financial Services,234.21,8532534784,7.1,-4.5,9.87,4.5,58.9,219.8,267.05,True,False,False,NO CLEAR ENTRY,False,57.19,NEUTRAL,5,"S&P 500 Companies' Quarterly Earnings, Revenue Growth Accelerates, Oppenheimer Says | Beat the Market the Zacks Way: ORIX, Starbucks, Alphabet in Focus | 1 Small-Cap Stock for Long-Term Investors and 2 That Underwhelm",15.07,12.06,590249344.0,72.972,28.08,24.48,54.98,IGNORE
PRU,https://www.tradingview.com/chart/?symbol=PRU,"Prudential Financial, Inc.",Financial Services,102.58,35628609536,15.3,-14.3,0.26,8.88,58.33,98.13,102.9,True,False,False,NO CLEAR ENTRY,False,57.43,NEUTRAL,5,Assessing Prudential Financial (PRU) Valuation As Market Price Diverges From Narrative And DCF Estimates | Why Retirees Keep Buying This Dividend ETF After 22 Years of Payments | Prudential Buys 75% of Bharti Life in $365 Million India Expansion,10.56,7.01,10378999808.0,158.972,10.71,5.48,54.89,IGNORE
GE,https://www.tradingview.com/chart/?symbol=GE,GE Aerospace,Industrials,311.7001,325678596096,24.7,-1.8,-8.39,9.55,65.24,294.2,299.83,True,True,False,BULLISH TREND,False,67.17,POSITIVE,5,"Applied Aerospace to raise up to $682.5M in NYSE IPO | Rocket Lab and Redwire Shares Skyrocket, What You Need To Know | AeroVironment and KBR Shares Skyrocket, What You Need To Know",38.67,35.92,5667999744.0,116.527,45.43,17.86,54.57,IGNORE
RF,https://www.tradingview.com/chart/?symbol=RF,Regions Financial Corporation,Financial Services,28.06,23941562368,7.3,21.6,-3.51,1.08,50.23,27.1,26.55,True,True,True,BULLISH TREND,False,67.09,POSITIVE,5,"Regions to pay $4.9M for allegedly forgiving ineligible PPP loan | Regions Financial (RF): Buy, Sell, or Hold Post Q1 Earnings? | A Look At Regions Financial (RF) Valuation After Recent Steady Share Price Performance",11.64,9.83,,,11.89,31.0,54.57,IGNORE
Q,https://www.tradingview.com/chart/?symbol=Q,"Qnity Electronics, Inc.",Technology,162.02,33917138944,17.6,-21.7,29.93,,,,,False,False,False,NO DATA,False,47.44,NEUTRAL,5,Qnity Electronics Stock: Analyst Estimates & Ratings | Jim Cramer on Qnity: “I Think It’s Too Expensive for the Moment” | Qnity Electronics Q1 Earnings Call Highlights,52.1,34.06,702374976.0,60.756,7.48,13.13,54.45,IGNORE
TRGP,https://www.tradingview.com/chart/?symbol=TRGP,Targa Resources Corp.,Energy,271.8331,58347319296,-10.2,142.9,18.16,13.51,59.62,249.01,196.8,True,True,True,BULLISH TREND,False,60.64,POSITIVE,5,AI Energy Infrastructure Stocks Near Buy Points: 'Pep In The Step' | Here's Why Targa Resources (NYSE:TRGP) Has Caught The Eye Of Investors | S&P 500 Ekes Out Seventh Consecutive Weekly Gain as Energy Leads,27.74,22.75,-318550016.0,585.249,74.1,12.87,54.45,IGNORE
TMO,https://www.tradingview.com/chart/?symbol=TMO,Thermo Fisher Scientific Inc.,Healthcare,447.97,166475268096,6.2,11.3,-13.79,-4.63,38.08,479.03,525.97,False,False,False,NO CLEAR ENTRY,False,54.43,NEUTRAL,5,"What Thermo Fisher Scientific (TMO)'s New Gothenburg Lab Expansion Means For Shareholders | 1 S&P 500 Stock with Promising Prospects and 2 We Ignore | Amazon, McDonald Surge Into Jefferies Top Picks Broadcom as Gets Cut",24.61,16.41,5520625152.0,82.903,13.52,15.15,54.4,IGNORE
RJF,https://www.tradingview.com/chart/?symbol=RJF,"Raymond James Financial, Inc.",Financial Services,151.825,29588117504,13.1,15.3,-4.56,-1.04,35.51,150.06,159.28,True,False,False,NO CLEAR ENTRY,False,58.53,NEUTRAL,5,Why The Triumph Financial (TFIN) Story Is Shifting After A Cautious Fair Value Upgrade | What Are Wall Street Analysts' Target Price for Raymond James Stock? | Raymond James Lifts PT on The Walt Disney Company (DIS) on Q2 Results,14.34,11.34,,48.477,17.29,14.58,54.18,IGNORE
ETR,https://www.tradingview.com/chart/?symbol=ETR,Entergy Corporation,Utilities,112.31,51425271808,12.0,1.2,6.8,-0.63,33.87,111.27,98.1,True,True,True,BULLISH TREND,False,55.4,NEUTRAL,5,Good News Is Good News. The Market Has Passed the Earnings Test. | Can OKLO's $1.68B Fuel Recycling Push Turn Into a Growth Lever? | Does Entergy’s Louisiana Steel Mill Power Deal Reshape the Bull Case for Entergy (ETR)?,28.65,22.35,-3913097728.0,192.883,10.75,13.41,54.13,IGNORE
ECL,https://www.tradingview.com/chart/?symbol=ECL,Ecolab Inc.,Basic Materials,252.87,71167098880,10.0,7.8,-17.35,-6.17,43.34,262.39,270.82,False,False,False,NO CLEAR ENTRY,False,46.39,NEUTRAL,5,Here's Why You Should Retain Ecolab Stock in Your Portfolio Now | Ecolab Stock: Analyst Estimates & Ratings | Ecolab’s CEO is betting on an AI payoff,34.17,26.34,1586424960.0,92.369,22.43,12.8,54.11,IGNORE
