ACN,https://www.tradingview.com/chart/?symbol=ACN,Accenture plc,Technology,178.175,109655154688,8.3,4.0,-25.64,-10.75,32.94,194.18,238.08,False,False,False,NO CLEAR ENTRY,False,53.45,NEUTRAL,5,Five Dividend Growers Trading at Double-Digit Discounts Despite Strong Fundamentals | How to Maximize Your Retirement Portfolio with These Top-Ranked Dividend Stocks | Is Accenture plc (NYSE:ACN) Potentially Undervalued?,14.62,11.95,12164313088.0,25.469,24.76,10.61,56.33,IGNORE
LNT,https://www.tradingview.com/chart/?symbol=LNT,Alliant Energy Corporation,Utilities,73.25,18918752256,5.0,4.9,10.56,1.3,58.64,71.41,66.71,True,True,True,BULLISH TREND,False,70.06,POSITIVE,5,"Alliant Energy Corp (LNT) Q1 2026 Earnings Call Highlights: Strong Earnings Amid Mild ... | Alliant Energy Q1 Earnings Match Estimates, Revenues Increase Y/Y | Alliant Energy Q1 Earnings Call Highlights",23.03,19.91,-1202625024.0,159.526,11.31,18.58,56.3,IGNORE
ISRG,https://www.tradingview.com/chart/?symbol=ISRG,"Intuitive Surgical, Inc.",Healthcare,450.04,159387451392,23.0,18.8,-5.95,-0.45,42.91,473.9,499.83,False,False,False,NO CLEAR ENTRY,False,55.19,NEUTRAL,5,"Is Intuitive Surgical, Inc. (ISRG) A Good Stock To Buy Now? | Jim Cramer Believes Competitors Might Hurt Intuitive Surgical | The Real Reason Intuitive Surgical Keeps Winning: A Cash Machine Hiding in Plain Sight",54.62,38.17,2254087424.0,,17.23,28.15,56.27,IGNORE
L,https://www.tradingview.com/chart/?symbol=L,Loews Corporation,Financial Services,103.85,21368975360,4.1,126.0,-5.04,-3.57,34.09,109.09,103.04,False,True,True,NO CLEAR ENTRY,False,55.68,NEUTRAL,5,Loews reports year-over-year drop in profit | CNA Financial (NYSE:CNA) Misses Q1 CY2026 Revenue Estimates | A Look At Loblaw Companies (TSX:L) Valuation As Investors Weigh Modest Share Price Moves,13.01,35.81,1541624960.0,50.221,9.43,9.03,56.25,IGNORE
CFG,https://www.tradingview.com/chart/?symbol=CFG,"Citizens Financial Group, Inc.",Financial Services,63.42,27018414080,13.8,46.8,-4.09,4.73,44.47,60.91,55.56,True,True,True,BULLISH TREND,False,50.22,NEUTRAL,5,Citizens Financial Joins Project Keystone As Valuation Gap And Momentum Stand Out | 3 Bank Stocks We’re Skeptical Of | Strategic Value Bank Partners Opens $11.6 Million Position in OceanFirst Financial Ahead of Merger,15.03,9.93,,,7.74,25.05,56.17,IGNORE
BRK-B,https://www.tradingview.com/chart/?symbol=BRK-B,Berkshire Hathaway Inc.,Financial Services,473.86,1022054825984,4.4,119.6,-5.95,-0.73,44.81,481.99,489.9,False,False,False,NO CLEAR ENTRY,False,50.4,NEUTRAL,5,How Berkshire’s Record Cash and Buybacks Under New CEO Greg Abel Will Impact Berkshire Hathaway (BRK.A) Investors | Berkshire Hathaway reports higher Q1 operating earnings under new CEO Greg Abel | Tech Giants Prop Up Nasdaq Composite as Oil Shock Tests Market Resilience,15.27,21.99,61228249088.0,17.669,10.5,19.3,56.13,IGNORE
REGN,https://www.tradingview.com/chart/?symbol=REGN,"Regeneron Pharmaceuticals, Inc.",Healthcare,710.09,74445152256,19.0,-7.2,-8.27,-6.79,35.08,754.2,683.43,False,True,True,BUY THE DIP,False,58.65,NEUTRAL,5,"How The Regeneron (REGN) Narrative Is Shifting With Dupixent, Eylea And Pipeline Developments | 1 Cash-Producing Stock Worth Investigating and 2 Facing Headwinds | Piper Sandler Rates Regeneron (REGN) Overweight on Oncology Growth",17.34,13.19,3273349888.0,8.612,14.55,29.65,55.99,IGNORE
BR,https://www.tradingview.com/chart/?symbol=BR,"Broadridge Financial Solutions, Inc.",Technology,150.7,17435990016,7.8,15.1,-20.3,-6.36,37.49,168.31,212.83,False,False,False,NO CLEAR ENTRY,False,64.79,POSITIVE,5,"BR Q1 Deep Dive: Delays in Large Sales and Investment Cycle Shape Near-Term Outlook | Will Strong Quarter, Web3 Proxy Voting, and M&A Push Broadridge Financial Solutions' (BR) Narrative Forward? | Broadridge Tops Q3 Estimates as Deal Delays Cloud Near-Term Outlook, RBC Says",16.12,14.52,1187662464.0,120.878,42.31,15.03,55.98,IGNORE
PEP,https://www.tradingview.com/chart/?symbol=PEP,"PepsiCo, Inc.",Consumer Defensive,154.91,211752828928,8.5,27.8,-5.95,-1.34,48.2,157.5,148.04,False,True,True,NO CLEAR ENTRY,False,52.94,NEUTRAL,5,"UTZ Brands Set for In-Line Q1 Amid Noisy Quarter, Tough Environment Persists, RBC Says | 10 Years, Zero Regrets: The Dividend Stocks I Keep Buying | UBS Highlights Strong Earnings Momentum for PepsiCo (PEP)",24.28,16.92,8746250240.0,244.837,43.88,9.15,55.94,IGNORE
OTIS,https://www.tradingview.com/chart/?symbol=OTIS,Otis Worldwide Corporation,Industrials,75.83,29097189376,6.4,42.6,-15.7,-2.61,27.23,81.99,86.93,False,False,False,NO CLEAR ENTRY,False,59.39,NEUTRAL,5,"Generac Tops Q1 Earnings Estimates, Lifts 2026 Revenue Outlook | 3 Industrials Stocks Walking a Fine Line | Looking At The Shifting Narrative For Otis Worldwide (OTIS) As Valuation Assumptions Reset",20.17,16.08,1682125056.0,,,10.11,55.85,IGNORE
PPG,https://www.tradingview.com/chart/?symbol=PPG,"PPG Industries, Inc.",Basic Materials,103.89,23157080064,6.7,4.2,-17.04,0.63,39.28,109.06,106.95,False,False,True,NO CLEAR ENTRY,False,62.52,POSITIVE,5,Is PPG Industries (PPG) Offering A Fresh Opportunity After Multi‑Year Share Price Weakness? | Did PPG’s Reaffirmed 2026 Guidance and CFO Shift Just Recast PPG Industries' (PPG) Investment Narrative? | PPG Industries Q1 Earnings Call Highlights,14.88,12.05,728374976.0,93.736,20.75,9.83,55.8,IGNORE
CCEP,https://www.tradingview.com/chart/?symbol=CCEP,Coca-Cola Europacific Partners PLC,Consumer Defensive,92.25,40852611072,0.2,68.3,-2.74,-0.25,38.14,97.97,92.59,False,False,True,NO CLEAR ENTRY,False,60.89,POSITIVE,5,"Coca-Cola Europacific Partners Updates ESG Plan, Adds Philippines and Six 2030 Sustainability Targets | Coca-Cola Europacific Partners Q1 Earnings Call Highlights | How The Coca-Cola Europacific Partners (ENXTAM:CCEP) Investment Story Is Shifting With New Analyst Targets",18.49,16.11,1747874944.0,130.001,22.89,9.29,55.72,IGNORE
EXPE,https://www.tradingview.com/chart/?symbol=EXPE,"Expedia Group, Inc.",Consumer Cyclical,246.87,29629849600,11.4,-27.3,4.62,9.57,48.99,236.22,235.26,True,True,True,BULLISH TREND,False,50.0,NEUTRAL,5,American Express Global Business Travel Enters $6.3 Billion Take-Private Deal | Uber’s Expedia-Powered Hotel Bookings Could Be A Game Changer For Uber Technologies (UBER) | Uber Technologies (UBER) Launches In-App Hotel Booking Service,25.14,10.78,2934000128.0,254.692,48.67,8.78,55.7,IGNORE
PNC,https://www.tradingview.com/chart/?symbol=PNC,"The PNC Financial Services Group, Inc.",Financial Services,217.2,87612162048,13.8,17.8,-7.75,3.39,43.99,212.7,202.15,True,True,True,BULLISH TREND,False,61.08,POSITIVE,5,"A Look At PNC Financial Services Group’s Valuation Relative To Its Recent Shareholder Returns | The PNC Financial Services Group, Inc (PNC) Just Overtook the 20-Day Moving Average | Solid Q1 Results Assert The PNC Financial Services Group, Inc. (PNC) as Goldman Sach’s Top Bank Stock",12.61,10.36,,,12.1,31.31,55.69,IGNORE
SYF,https://www.tradingview.com/chart/?symbol=SYF,Synchrony Financial,Financial Services,74.475,25051172864,6.1,20.1,-0.59,8.85,46.15,70.6,73.85,True,True,False,BULLISH TREND,False,57.43,NEUTRAL,5,Here's What We Like About Synchrony Financial's (NYSE:SYF) Upcoming Dividend | 5 Revealing Analyst Questions From Synchrony Financial’s Q1 Earnings Call | Is Synchrony’s Earnings Jump and $6.5 Billion Buyback Shaping the Investment Case for SYF?,7.71,7.1,,,21.78,36.39,55.54,IGNORE
TTD,https://www.tradingview.com/chart/?symbol=TTD,"The Trade Desk, Inc.",Communication Services,24.395,11611460608,14.3,7.5,-10.54,10.63,65.69,23.81,41.31,True,False,False,NO CLEAR ENTRY,False,57.83,NEUTRAL,5,"Wedbush Upgrades The Trade Desk From Underperform: Is the Worst Behind the Ad Tech Leader? | AMD downgraded, Airbnb upgraded: Wall Street's top analyst calls | Here Are Monday’s Top Wall Street Analyst Research Calls: Advanced Micro Devices, Airbnb, Alphabet, Check Point Software, GlobalFoundries, Internatioinal Paper, Trade Desk, and More",27.11,10.2,601545856.0,17.563,16.32,15.31,55.53,IGNORE
SNPS,https://www.tradingview.com/chart/?symbol=SNPS,"Synopsys, Inc.",Technology,492.84,94409433088,65.5,-82.0,17.63,24.47,74.03,432.99,479.0,True,True,False,WATCH - OVERBOUGHT,False,60.89,POSITIVE,5,Wall Street Analysts Think Synopsys (SNPS) Is a Good Investment: Is It? | PRGS vs. SNPS: Which Stock Is the Better Value Option? | Microsoft (MSFT) Beats Q3 Earnings and Revenue Estimates,75.82,28.91,3096222464.0,35.579,5.54,13.76,55.52,IGNORE
NOW,https://www.tradingview.com/chart/?symbol=NOW,"ServiceNow, Inc.",Technology,92.59,95478497280,22.1,2.3,-16.65,-9.23,55.25,103.0,149.47,False,False,False,NO CLEAR ENTRY,False,54.28,NEUTRAL,5,"While NVDA Dominates Headlines, Here’s Where the Real AI Economics Are Hiding | 3 Growth Stocks the Market Is Throwing Away and Why You Should Pick Them Up | MongoDB, PubMatic, and Sprinklr Shares Skyrocket, What You Need To Know",55.11,18.51,5108125184.0,20.728,16.07,12.59,55.49,IGNORE
VZ,https://www.tradingview.com/chart/?symbol=VZ,Verizon Communications Inc.,Communication Services,47.355,197754470400,2.9,4.3,2.25,-2.7,60.62,48.4,42.62,False,True,True,NO CLEAR ENTRY,False,51.63,NEUTRAL,5,"Verizon Communications Insiders Sold US$12m Of Shares Suggesting Hesitancy | Verizon Stock: Cheap Multiple, Complicated Story | Warren Buffett Owns 2 of the Small Dogs of the Dow: Here’s Why You Need to Own All 5",11.55,9.0,19608500224.0,192.045,17.2,12.46,55.43,IGNORE
SHOP,https://www.tradingview.com/chart/?symbol=SHOP,Shopify Inc.,Technology,127.28,165257281536,30.6,-42.3,11.63,7.64,60.9,122.7,142.0,True,False,False,NO CLEAR ENTRY,False,55.8,NEUTRAL,5,"Tetra Launches CADD as Canada’s First Bank-Issued CAD-Backed Stablecoin | Analysts See 27% Upside for Shopify After 30% Selloff | Etsy, Amazon, eBay, and Shopify in April: Why E-Commerce Stocks Diverged So Dramatically",135.4,55.45,1286249984.0,1.395,9.84,10.65,55.41,IGNORE
BG,https://www.tradingview.com/chart/?symbol=BG,Bunge Global SA,Consumer Defensive,128.45,24921626624,87.8,-76.4,10.2,-0.75,60.86,123.38,99.65,True,True,True,BULLISH TREND,False,55.11,NEUTRAL,5,How Investors Are Reacting To Bunge (BG) EPS Upgrade After Viterra Synergies And New Buyback | Bunge Global (BG) Upgraded to Strong Buy: What Does It Mean for the Stock? | Is Braskem (BAK) Stock Outpacing Its Basic Materials Peers This Year?,33.8,12.11,-6827500032.0,93.214,4.93,0.85,55.41,IGNORE
JPM,https://www.tradingview.com/chart/?symbol=JPM,JPMorgan Chase & Co.,Financial Services,306.881,822287663104,12.7,17.2,-2.78,4.7,44.84,298.59,302.36,True,True,False,BULLISH TREND,False,45.04,NEUTRAL,5,Why Alphabet Stock Remains J.P. Morgan’s ‘Top Overall Pick’ | Treasury Market on Watch for Shift in Yellen-Era Debt Plan | Blackstone Data Center REIT Seeks to Raise $1.75 Billion in IPO,14.68,13.04,,,16.47,33.94,55.4,IGNORE
LYV,https://www.tradingview.com/chart/?symbol=LYV,"Live Nation Entertainment, Inc.",Communication Services,157.38,37003943936,11.1,,10.47,1.05,38.31,157.23,152.08,True,True,True,BULLISH TREND,False,66.01,POSITIVE,5,"Live Entertainment Poised to Capture Value in AI-Driven Content Surge, Morgan Stanley Says | Countdown to Live Nation (LYV) Q1 Earnings: Wall Street Forecasts for Key Metrics | Live Nation to Report Q1 Earnings: What's in Store for the Stock?",,70.69,1107258368.0,572.032,36.7,1.97,55.38,IGNORE
NOC,https://www.tradingview.com/chart/?symbol=NOC,Northrop Grumman Corporation,Industrials,570.045,80965468160,4.4,84.9,-17.09,-18.85,8.76,682.36,617.86,False,False,True,NO CLEAR ENTRY,False,56.36,NEUTRAL,5,"Boeing's Got a New Drone (Same as the Old Drone) | Germany’s defense minister reacts to Trump’s decision to recall 5,000 US troops | Is Northrop Grumman (NOC) Still Attractive After Recent Share Price Pullback?",17.89,18.86,2071624960.0,102.682,28.51,10.8,55.36,IGNORE
BEN,https://www.tradingview.com/chart/?symbol=BEN,"Franklin Resources, Inc.",Financial Services,29.34,15246153728,8.7,87.2,6.97,25.38,71.81,25.62,24.12,True,True,True,WATCH - OVERBOUGHT,False,60.76,POSITIVE,5,"3 Profitable Stocks That Concern Us | AMG's Q1 Earnings Beat on Higher Revenues & Record AUM, Shares Rise | Goldman Sachs and Barclays Turn More Constructive on Franklin Resources (BEN) after Q2",22.4,9.97,-242137504.0,23.471,6.7,8.12,55.31,IGNORE
FTNT,https://www.tradingview.com/chart/?symbol=FTNT,"Fortinet, Inc.",Technology,88.47,64769064960,14.8,-1.1,9.06,7.2,71.1,82.08,83.04,True,True,False,WATCH - OVERBOUGHT,False,59.0,NEUTRAL,5,A Look At Fortinet (FTNT) Valuation As Growth Cools From Its Longer Term Shareholder Returns | Why Fortinet (FTNT) Outpaced the Stock Market Today | Countdown to Fortinet (FTNT) Q1 Earnings: Wall Street Forecasts for Key Metrics,36.56,26.75,1746974976.0,85.802,135.72,27.26,55.27,IGNORE
SCHW,https://www.tradingview.com/chart/?symbol=SCHW,The Charles Schwab Corporation,Financial Services,91.02,159486181376,15.8,38.6,-12.08,-2.93,30.79,93.76,95.47,False,False,False,NO CLEAR ENTRY,False,55.18,NEUTRAL,5,Crypto Is Now Mainstream. Investors of All Ages Are Diving In. | Is Charles Schwab (SCHW) Pricing Look Attractive After Mixed Recent Returns? | LPLA Q1 Earnings Beat Estimates as Revenues and Advisory Assets Jump,18.1,13.03,,67.073,19.09,37.99,55.26,IGNORE
PEG,https://www.tradingview.com/chart/?symbol=PEG,Public Service Enterprise Group Incorporated,Utilities,80.2,40032149504,18.3,10.5,0.88,-1.98,43.22,82.07,81.37,False,False,True,NO CLEAR ENTRY,False,59.97,NEUTRAL,5,Ahead of PSEG (PEG) Q1 Earnings: Get Ready With Wall Street Estimates for Key Metrics | PEG Stock Starts With $91 Target As Data Center Demand Rises | Public Service Enterprise to Release Q1 Earnings: What to Expect?,19.0,17.08,-105000000.0,142.68,12.76,17.35,55.1,IGNORE
COO,https://www.tradingview.com/chart/?symbol=COO,"The Cooper Companies, Inc.",Healthcare,61.37,11974170624,6.2,26.9,-24.16,-12.54,15.22,71.92,74.11,False,False,False,NO CLEAR ENTRY,False,60.12,POSITIVE,5,Assessing Cooper Companies (COO) Valuation After Activist Pressure And Business Review Shake Up | Cooper Companies Earnings Preview: What to Expect | 1 Oversold Stock Ready to Bounce Back and 2 That Underwhelm,30.53,12.22,367087488.0,33.201,4.87,9.67,55.06,IGNORE
CTSH,https://www.tradingview.com/chart/?symbol=CTSH,Cognizant Technology Solutions Corporation,Technology,51.57,24392609792,5.8,3.6,-32.43,-17.54,15.76,60.41,70.49,False,False,False,NO CLEAR ENTRY,False,58.76,NEUTRAL,5,Why Cognizant (CTSH) is a Top Value Stock for the Long-Term | International Markets and Cognizant (CTSH): A Deep Dive for Investors | Cognizant (CTSH) is a Top-Ranked Growth Stock: Should You Buy?,11.19,8.38,1908875008.0,7.247,14.88,10.41,55.0,IGNORE
AMP,https://www.tradingview.com/chart/?symbol=AMP,"Ameriprise Financial, Inc.",Financial Services,465.95,41982095360,9.0,66.0,-14.35,7.35,52.77,455.58,481.49,True,False,False,NO CLEAR ENTRY,False,53.12,NEUTRAL,5,Ameriprise Financial touts record 2025 results at annual meeting; shareholders back all proposals | Ameriprise Financial (NYSE:AMP) Could Be A Buy For Its Upcoming Dividend | Massachusetts Says Fidelity Was Lax With Customer Data. Now the Firm Must Pay $1.25 Million.,11.61,9.81,,52.785,66.94,20.17,54.8,IGNORE
DDOG,https://www.tradingview.com/chart/?symbol=DDOG,"Datadog, Inc.",Technology,145.09,51643654144,29.2,-3.3,25.39,20.55,84.67,122.29,138.09,True,True,False,WATCH - OVERBOUGHT,False,62.5,POSITIVE,5,"Datadog Stock Crosses Over Key Trendline Before Earnings | Down 30% from Highs, Wall Street Sees 26% Upside for Datadog | Datadog And Two Other Stocks That Could Be Trading Below Fair Value Estimates",468.03,54.9,879646720.0,34.269,3.34,3.14,54.75,IGNORE
ACGL,https://www.tradingview.com/chart/?symbol=ACGL,Arch Capital Group Ltd.,Financial Services,93.63,33070114816,-3.3,94.6,-6.49,-3.21,42.27,96.22,92.93,False,True,True,NO CLEAR ENTRY,False,57.84,NEUTRAL,5,How Strong Q1 Results and Bigger Buyback Plan Could Impact Arch Capital Group (ACGL) Investors | Bill Ackman to create the next-gen Berkshire Hathaway | Arch Capital Group Q1 Earnings Call Highlights,7.2,9.36,6259125248.0,11.282,21.31,24.64,54.68,IGNORE
FDS,https://www.tradingview.com/chart/?symbol=FDS,FactSet Research Systems Inc.,Financial Services,227.56,8290267648,7.1,-4.5,1.47,-0.05,53.95,217.92,280.87,True,False,False,NO CLEAR ENTRY,False,60.51,POSITIVE,5,"Fund Fees Are Creeping Higher as Active-Management Booms | S&P 500 Companies' Quarterly Profit, Revenue Growth Accelerates, Oppenheimer Says | Should FactSet’s Whole Portfolio Distribution Launch and Guidance Hike Require Action From FactSet Research Systems (FDS) Investors?",14.64,11.72,590249344.0,72.972,28.08,24.48,54.64,IGNORE
VMC,https://www.tradingview.com/chart/?symbol=VMC,Vulcan Materials Company,Basic Materials,288.86,37480996864,7.4,29.7,-7.09,3.21,42.31,284.33,291.27,True,False,False,NO CLEAR ENTRY,False,54.46,NEUTRAL,5,3 High-Flying Stocks to Target This Week | Vulcan Materials Q1 Earnings Call Highlights | Vulcan Materials Company Just Beat Earnings Expectations: Here's What Analysts Think Will Happen Next,34.23,26.64,239012496.0,61.249,13.46,13.81,54.61,IGNORE
ADP,https://www.tradingview.com/chart/?symbol=ADP,"Automatic Data Processing, Inc.",Technology,211.57,84571783168,7.0,10.5,-9.1,3.71,70.26,206.32,253.29,True,False,False,WATCH - OVERBOUGHT,False,55.22,NEUTRAL,5,"At US$214, Is Automatic Data Processing, Inc. (NASDAQ:ADP) Worth Looking At Closely? | US Dollar Rises Early Monday, Focus This Week on April Employment Data | Stock Futures Are Rising, Oil Falls Ahead of Jobs Week",19.75,17.43,4749387264.0,69.259,71.21,20.12,54.57,IGNORE
LITE,https://www.tradingview.com/chart/?symbol=LITE,Lumentum Holdings Inc.,Technology,977.955,69825986560,65.5,,110.07,18.27,61.74,768.8,383.38,True,True,True,BULLISH TREND,False,60.12,POSITIVE,5,These Eight S&P 500 Stocks Have Doubled In 2026. No. 3 Reports On Tuesday. | Datadog And Two Other Stocks That Could Be Trading Below Fair Value Estimates | Dow Jones Futures: Trump Says U.S. To 'Guide' Ships Through Hormuz,285.95,59.78,-21325000.0,392.476,29.28,11.95,54.26,IGNORE
PRU,https://www.tradingview.com/chart/?symbol=PRU,"Prudential Financial, Inc.",Financial Services,97.37,33884760064,31.2,,-3.41,-0.22,46.32,96.87,102.68,True,False,False,NO CLEAR ENTRY,False,60.02,POSITIVE,5,"Prudential Downgraded Again. Stock Faces ‘Continued Valuation Pressure’ From Japan Probe. | AMD downgraded, Airbnb upgraded: Wall Street's top analyst calls | Here Are Monday’s Top Wall Street Analyst Research Calls: Advanced Micro Devices, Airbnb, Alphabet, Check Point Software, GlobalFoundries, Internatioinal Paper, Trade Desk, and More",9.75,6.61,12618874880.0,124.482,11.36,5.84,54.1,IGNORE
BLK,https://www.tradingview.com/chart/?symbol=BLK,"BlackRock, Inc.",Financial Services,1052.09,163457908736,27.0,45.9,-1.69,8.85,49.28,1007.92,1073.23,True,False,False,NO CLEAR ENTRY,False,58.57,NEUTRAL,5,"What is Jevons Paradox and why does more AI mean more labor? | Is It Time To Reassess BlackRock (BLK) After Its Recent Share Price Climb? | Not So Fast, Texas. This City Manages Just as Much Money—and It’s Not New York.",26.49,17.34,,24.367,,24.4,54.09,IGNORE
BMY,https://www.tradingview.com/chart/?symbol=BMY,Bristol-Myers Squibb Company,Healthcare,57.16,116705599488,2.6,9.2,0.22,-4.09,46.57,59.11,51.1,False,True,True,NO CLEAR ENTRY,False,62.13,POSITIVE,5,"Are These 5 Biotech Stocks Set to Beat Q1 Earnings Estimates? | Bristol-Myers Squibb Company Just Beat Earnings Expectations: Here's What Analysts Think Will Happen Next | BMY Q1 Deep Dive: Growth Portfolio, Pipeline Milestones, and Anticipated Late-Stage Readouts",16.01,9.32,9851750400.0,230.967,38.73,15.01,54.07,IGNORE
BBY,https://www.tradingview.com/chart/?symbol=BBY,"Best Buy Co., Inc.",Consumer Cyclical,58.21,12197038080,-1.0,372.5,-13.73,-9.75,38.76,62.69,68.73,False,False,False,NO CLEAR ENTRY,False,77.88,POSITIVE,5,What GameStop’s $55B Bid For eBay Means For Investors | Has Recent Share Price Weakness Created An Opportunity In Best Buy (BBY)? | Earnings Preview: What to Expect From Best Buy's Report,11.55,8.3,842499968.0,139.474,37.04,2.56,54.03,IGNORE
OMC,https://www.tradingview.com/chart/?symbol=OMC,Omnicom Group Inc.,Communication Services,76.42,21780174848,69.2,-6.9,11.63,2.15,49.64,78.09,75.58,False,True,True,NO CLEAR ENTRY,False,61.72,POSITIVE,5,"Deciphering Omnicom (OMC) International Revenue Trends | Omnicom credits Q1 wins to core operations, reaffirms ongoing cost cuts | Omnicom Group Inc. Just Recorded A 5.6% Revenue Beat: Here's What Analysts Think",,6.14,5066650112.0,110.574,2.02,0.32,53.99,IGNORE
GS,https://www.tradingview.com/chart/?symbol=GS,"The Goldman Sachs Group, Inc.",Financial Services,903.055,267984207872,14.5,24.2,-0.6,4.64,48.02,869.71,826.54,True,True,True,BULLISH TREND,False,62.09,POSITIVE,5,"Best CD rates today, May 4, 2026 (Lock in up to 4.1% APY) | “If a 2% Market Move Makes You Question Your Retirement Plan, You Don’t Have One” | Trump Administration Targets Dismantling of Already-Weakened DEI",16.49,13.82,,678.596,14.55,29.36,53.97,IGNORE
TRMB,https://www.tradingview.com/chart/?symbol=TRMB,Trimble Inc.,Technology,68.12,15809885184,-1.4,80.5,4.74,4.61,58.46,66.95,75.73,True,False,False,NO CLEAR ENTRY,False,53.83,NEUTRAL,5,Could This Under-the-Radar AI Stock Be Your Ticket to Millionaire Status? | KeyBanc Finds Trimble Inc (TRMB)’s AI Position Stronger Than Expected | How The Trimble (TRMB) Story Is Shifting As Analysts Rework Price Targets And Risks,38.7,16.85,522812512.0,26.749,7.32,11.82,53.96,IGNORE
DAL,https://www.tradingview.com/chart/?symbol=DAL,"Delta Air Lines, Inc.",Industrials,68.435,44961406976,12.9,,-3.16,2.51,37.52,66.11,63.28,True,True,True,BULLISH TREND,False,51.21,NEUTRAL,5,"Spirit Airlines is no more ... and now the blame game begins | Jet Fuel Prices Are Soaring. Airlines and Travelers Will Feel It. | Update: American Airlines, United, Delta Offer Relief Options for Disrupted Spirit Customers",9.99,8.56,3093374976.0,105.021,24.99,6.87,53.95,IGNORE
ALB,https://www.tradingview.com/chart/?symbol=ALB,Albemarle Corporation,Basic Materials,190.07,22406762496,15.9,,12.97,6.73,50.1,179.21,130.06,True,True,True,BULLISH TREND,False,54.22,NEUTRAL,5,Dow Jones Futures: Trump Says U.S. To 'Guide' Ships Through Hormuz | Albemarle (ALB) Stock Declines While Market Improves: Some Information for Investors | B2Gold Set to Report Q1 Earnings: What's in Store for the Stock?,,21.06,453286368.0,33.954,-4.66,-9.93,53.94,IGNORE
PG,https://www.tradingview.com/chart/?symbol=PG,The Procter & Gamble Company,Consumer Defensive,143.97,335248392192,7.4,5.8,-7.53,1.34,51.35,148.23,148.49,False,False,False,NO CLEAR ENTRY,False,56.18,NEUTRAL,5,Amazon Supply Chain Services opens logistics to all businesses | Warren Buffett Owns 2 of the Small Dogs of the Dow: Here’s Why You Need to Own All 5 | Rechecking Procter & Gamble (PG) Valuation After Mixed Recent Shareholder Returns,21.08,20.31,12733750272.0,67.651,31.11,19.16,53.84,IGNORE
BRO,https://www.tradingview.com/chart/?symbol=BRO,"Brown & Brown, Inc.",Financial Services,57.475,19481026560,35.7,-7.9,-22.36,-12.85,22.57,67.18,80.74,False,False,False,NO CLEAR ENTRY,False,62.27,POSITIVE,5,"Is Brown & Brown, Inc. (BRO) A Good Stock To Buy Now? | 2 Cash-Producing Stocks to Target This Week and 1 Facing Challenges | Arthur J. Gallagher Q1 Earnings Beat, Commissions and Fees Rise Y/Y",18.72,11.76,1522499968.0,64.37,11.93,18.36,53.83,IGNORE
RF,https://www.tradingview.com/chart/?symbol=RF,Regions Financial Corporation,Financial Services,27.625,23600488448,7.3,21.6,-8.38,4.36,48.41,27.09,26.36,True,True,True,BULLISH TREND,False,57.46,NEUTRAL,5,How Investors May Respond To Regions Financial (RF) Q1 Results And New ReimbursePro Digital Fee Push | The 5 Most Interesting Analyst Questions From Regions Financial’s Q1 Earnings Call | Northern Trust Q1 Earnings Beat Estimates on Higher NII & AUM Growth,11.46,9.66,,,11.89,31.0,53.8,IGNORE
BAC,https://www.tradingview.com/chart/?symbol=BAC,Bank of America Corporation,Financial Services,52.155,371860340736,8.1,24.4,-5.29,5.62,41.26,50.35,51.05,True,True,False,BULLISH TREND,False,57.08,NEUTRAL,5,Blackstone Data Center REIT Seeks to Raise $1.75 Billion in IPO | Bank of America drops stunning take on the economy | Traders Grapple With Two-Sided Tail Risk as Stocks Regain Highs,12.97,10.34,,,10.64,28.96,53.77,IGNORE
HSIC,https://www.tradingview.com/chart/?symbol=HSIC,"Henry Schein, Inc.",Healthcare,72.675,8339314688,7.7,13.6,-3.43,-1.71,28.75,76.45,72.6,False,True,True,NO CLEAR ENTRY,False,60.91,POSITIVE,5,Henry Schein (HSIC) Q1 Earnings Report Preview: What To Look For | Can Strong Growth Aid INNV's Q3 Earnings Amid Margin Seasonality? | Henry Schein Inc. (HSIC): David Einhorn Is Buying This Health Stock,22.22,12.35,383000000.0,71.736,8.7,3.02,53.67,IGNORE
MTB,https://www.tradingview.com/chart/?symbol=MTB,M&T Bank Corporation,Financial Services,213.59,31719098368,5.7,24.4,-7.4,1.63,37.99,211.93,200.55,True,True,True,BULLISH TREND,False,54.94,NEUTRAL,5,"Here's Why We Think M&T Bank (NYSE:MTB) Might Deserve Your Attention Today | Ex-M&T employee alleges discrimination over gender, sexual orientation | M&T Bank Insiders Sell US$20m Of Stock, Possibly Signalling Caution",11.99,10.24,,,10.29,31.48,53.6,IGNORE
IBM,https://www.tradingview.com/chart/?symbol=IBM,International Business Machines Corporation,Technology,228.99,215224336384,9.5,14.2,-20.33,-7.72,41.2,242.62,270.66,False,False,False,NO CLEAR ENTRY,False,53.37,NEUTRAL,5,Trump Administration Targets Dismantling of Already-Weakened DEI | Morgan Stanley Lifts IonQ Price Target to $47: Is the Quantum Computing Stock Finally Ready to Deliver? | Assessing IBM (IBM) Shares After Recent Weakness And A 23.1% Undervaluation Signal,20.25,17.04,13080750080.0,211.169,35.77,15.61,53.57,IGNORE
