DIS,https://www.tradingview.com/chart/?symbol=DIS,The Walt Disney Company,Communication Services,101.905,180526727168,5.2,-4.3,-4.81,5.48,47.56,100.91,109.16,True,False,False,NO CLEAR ENTRY,False,57.33,NEUTRAL,5,"Earnings live updates: Palantir to kick off busy week as S&P 500 earnings growth trend impresses | S&P 500 Companies' Quarterly Profit, Revenue Growth Accelerates, Oppenheimer Says | Trump Administration Targets Dismantling of Already-Weakened DEI",15.01,13.9,3174500096.0,40.909,12.02,12.8,44.69,IGNORE
SO,https://www.tradingview.com/chart/?symbol=SO,The Southern Company,Utilities,96.025,108249374720,8.0,-0.8,7.19,-1.46,50.25,95.89,91.8,True,True,True,BULLISH TREND,False,59.34,NEUTRAL,5,Is Southern (SO) Pricing In Too Much Growth After Recent Utility Sector Rate Debates? | Data Center Expert Warns Gigawatt-Scale AI Buildouts Could Trigger Rolling Blackouts | Southern Q1 Earnings Call Highlights,24.56,19.52,-3950000128.0,190.431,10.99,14.46,44.65,IGNORE
AXON,https://www.tradingview.com/chart/?symbol=AXON,"Axon Enterprise, Inc.",Industrials,395.85,31894505472,38.5,-98.0,-8.08,-4.11,59.12,453.08,599.23,False,False,False,NO CLEAR ENTRY,False,58.22,NEUTRAL,5,"Seeking Clues to Axon (AXON) Q1 Earnings? A Peek Into Wall Street Projections for Key Metrics | Is Axon Enterprise, Inc. (AXON) A Good Stock To Buy Now? | Dear AppLovin Stock Fans, Mark Your Calendars for May 6",258.73,37.84,230031120.0,59.107,4.48,4.49,44.56,IGNORE
EA,https://www.tradingview.com/chart/?symbol=EA,Electronic Arts Inc.,Communication Services,202.08,50571272192,1.0,-68.5,2.76,-0.75,40.05,201.84,193.09,True,True,True,BULLISH TREND,False,54.51,NEUTRAL,5,"Why RBLX Stock’s Selloff Creates A Rare Entry Point | Electronic Arts (EA) Q1 Earnings: What To Expect | Jobs Report, Tech Earnings: What to Watch This Week",75.69,22.0,2209874944.0,36.443,10.03,9.31,44.56,IGNORE
RSG,https://www.tradingview.com/chart/?symbol=RSG,"Republic Services, Inc.",Industrials,206.41,63771648000,2.2,7.4,-5.13,-7.52,41.31,217.85,219.65,False,False,False,NO CLEAR ENTRY,False,58.08,NEUTRAL,5,Is Republic Services (RSG) Price Weakness Creating A Long Term Opportunity? | Republic Services (RSG) Earnings Expected to Grow: Should You Buy? | FTC clears Republic’s purchase of Robinson Waste in Utah,30.09,25.65,1770125056.0,115.348,18.3,12.89,44.55,IGNORE
BXP,https://www.tradingview.com/chart/?symbol=BXP,"BXP, Inc.",Real Estate,58.635,10381072384,5.6,65.5,-6.73,13.24,65.0,54.68,64.58,True,False,False,NO CLEAR ENTRY,False,66.45,POSITIVE,5,"CUZ Q1 FFO Beats Estimates on Strong Leasing, Revenues Top | BXP Q1 Earnings Call Highlights | BXP (BXP) Q1 2026 Earnings Call Transcript",29.46,28.12,,211.944,5.53,9.92,44.47,IGNORE
FOXA,https://www.tradingview.com/chart/?symbol=FOXA,Fox Corporation,Communication Services,62.655,26653190144,2.0,-35.8,-7.04,6.88,46.11,59.95,62.46,True,True,False,BULLISH TREND,False,47.04,NEUTRAL,5,Sirius XM (SIRI) Beats Q1 Earnings and Revenue Estimates | 3 Reasons to Avoid FOXA and 1 Stock to Buy Instead | Fox (FOX) Upgraded to Buy: Here's What You Should Know,15.03,12.15,1765500032.0,67.389,16.82,11.41,44.41,IGNORE
A,https://www.tradingview.com/chart/?symbol=A,"Agilent Technologies, Inc.",Healthcare,111.86,31611893760,7.0,-3.6,-15.69,-3.13,35.26,115.99,129.1,False,False,False,NO CLEAR ENTRY,False,56.67,NEUTRAL,5,"Is Agilent Technologies, Inc. (A) A Good Stock To Buy Now? | At US$116, Is It Time To Put Agilent Technologies, Inc. (NYSE:A) On Your Watch List? | Here's What to Expect From Agilent Technologies’ Next Earnings Report",24.69,16.99,855875008.0,51.39,19.95,18.26,44.38,IGNORE
DOC,https://www.tradingview.com/chart/?symbol=DOC,"Healthpeak Properties, Inc.",Real Estate,16.29,11325730816,3.1,2448.4,-1.14,-0.8,41.37,16.82,16.93,False,False,False,NO CLEAR ENTRY,False,52.87,NEUTRAL,5,A Look At Healthpeak Properties (DOC) Valuation After Mixed Long Term Shareholder Returns | FinWise Bancorp (FINW) Lags Q1 Earnings and Revenue Estimates | 3 Healthcare Stocks Paying the Highest Dividends in the Sector Right Now,162.9,120.67,1162534400.0,122.183,1.16,2.53,44.38,IGNORE
PSX,https://www.tradingview.com/chart/?symbol=PSX,Phillips 66,Energy,177.92,71334354944,6.9,-56.8,15.96,0.97,72.55,168.15,141.89,True,True,True,WATCH - OVERBOUGHT,False,62.89,POSITIVE,5,"Phillips 66 Q1 Earnings Call Highlights | Big Oil Stays the Course Despite Historic Dislocation in Energy Markets | S&P 500 Marks Fifth Weekly Gain, Reaches New Records on Earnings Strength",17.6,11.4,-1134499968.0,91.385,14.55,3.07,44.38,IGNORE
CARR,https://www.tradingview.com/chart/?symbol=CARR,Carrier Global Corporation,Industrials,65.64,54519296000,2.4,-40.7,3.29,17.82,52.34,59.99,59.83,True,True,True,BULLISH TREND,False,47.04,NEUTRAL,5,"Carrier Global (CARR) Hit it Out of the Park, Says Jim Cramer | Jim Cramer on Carrier Global: “This Quarter May Be the Beginning of a Multi-Year Move” | CARR Q1 Deep Dive: Data Center Momentum and Pricing Actions Offset Margin Pressure",43.76,20.54,849750016.0,91.102,9.91,5.99,44.21,IGNORE
HOOD,https://www.tradingview.com/chart/?symbol=HOOD,"Robinhood Markets, Inc.",Financial Services,76.828,69184004096,15.1,2.7,-4.7,11.51,47.5,76.33,106.44,True,False,False,NO CLEAR ENTRY,False,56.8,NEUTRAL,5,"Jim Cramer Discusses “Gunslingers” & Robinhood (HOOD) | Is Robinhood's Business Too Dependent on Crypto? | Coinbase Stock, Strategy Gain. It’s Not Just Rising Bitcoin Lifting Crypto Companies.",37.3,30.06,,140.483,21.46,41.12,44.19,IGNORE
HBAN,https://www.tradingview.com/chart/?symbol=HBAN,Huntington Bancshares Incorporated,Financial Services,16.185,32809107456,33.6,-26.5,-14.04,2.5,42.68,16.15,16.54,True,False,False,NO CLEAR ENTRY,False,56.07,NEUTRAL,5,Huntington (HBAN) Q1 2026 Earnings Transcript | Top Dividend Stocks To Consider In May 2026 | Are Wall Street Analysts Predicting Huntington Bancshares Stock Will Climb or Sink?,12.45,8.54,,,8.39,26.6,44.04,IGNORE
BA,https://www.tradingview.com/chart/?symbol=BA,The Boeing Company,Industrials,223.13,175893905408,14.0,,-5.43,7.16,49.4,217.29,219.6,True,True,False,BULLISH TREND,False,59.32,NEUTRAL,5,Bank of America makes fresh call on Boeing stock price | Boeing Wins New Orders And Advances Climate Moves As Valuation Lags | Trump Casts Doubts on Iran Peace Proposal as Details Emerge,88.54,52.03,2554249984.0,828.696,169.95,2.46,43.95,IGNORE
J,https://www.tradingview.com/chart/?symbol=J,Jacobs Solutions Inc.,Industrials,130.54,15331492864,12.3,,-8.69,1.97,64.6,129.9,140.48,True,False,False,NO CLEAR ENTRY,False,56.68,NEUTRAL,5,Evaluating Jacobs Solutions (J) Valuation After Recent Mixed Share Price Performance | Jacobs to Report Q2 Earnings: Here's What to Expect This Season | Jacobs Solutions (J) Earnings Expected to Grow: Should You Buy?,34.44,16.27,1088866688.0,65.173,9.73,3.5,43.93,IGNORE
ALLE,https://www.tradingview.com/chart/?symbol=ALLE,Allegion plc,Industrials,132.615,11396384768,9.7,-7.0,-23.07,-5.99,29.02,146.37,161.78,False,False,False,NO CLEAR ENTRY,False,53.89,NEUTRAL,5,Allegion plc Earnings Missed Analyst Estimates: Here's What Analysts Are Forecasting Now | Allegion Weighs DCI Acquisition Benefits Against ERP Execution Risks | Allegion PLC (ALLE) Q1 2026 Earnings Call Highlights: Strong Revenue Growth Amid Margin Pressures,18.12,13.89,494362496.0,105.863,34.18,15.24,43.91,IGNORE
CCL,https://www.tradingview.com/chart/?symbol=CCL,Carnival Corporation & plc,Consumer Cyclical,25.555,35397242880,6.1,,-20.0,-0.33,34.95,26.91,28.75,False,False,False,NO CLEAR ENTRY,False,52.93,NEUTRAL,5,"Norwegian Cruise Line Stock Sinks. How the War in Iran Is Hitting Its Earnings Forecast. | Norwegian Cruise Line (NCLH) Stock Trades Up, Here Is Why | Why Carnival (CCL) Stock Is Trading Up Today",11.26,9.84,2174000128.0,203.901,27.85,11.48,43.78,IGNORE
DLTR,https://www.tradingview.com/chart/?symbol=DLTR,"Dollar Tree, Inc.",Consumer Defensive,93.8,18506573824,9.0,,-23.01,-13.5,38.41,108.8,111.2,False,False,False,NO CLEAR ENTRY,False,51.27,NEUTRAL,5,Dollar Tree Hits 5-Month Lows: Why Analysts Still See 27% Upside | Stocks Inch to New Records as Nvidia Strength Overcomes Consumer Weakness | Earnings Preview: What to Expect From Dollar Tree’s Report,15.79,12.69,1284562560.0,187.904,31.69,6.61,43.7,IGNORE
ABT,https://www.tradingview.com/chart/?symbol=ABT,Abbott Laboratories,Healthcare,87.88,153070534656,7.8,-19.7,-18.27,-14.04,24.43,103.09,119.1,False,False,False,NO CLEAR ENTRY,False,60.21,POSITIVE,5,1 Magnificent Dividend Stock Down 30% to Buy and Hold Forever | Abbott Laboratories (ABT) Receives FDA Clearance and CE Mark for Next-Generation Ultreon™ 3.0 Software | Dexcom reaffirms full-year forecast after topping quarterly estimates,24.62,14.49,6341125120.0,64.773,12.33,13.9,43.67,IGNORE
WAT,https://www.tradingview.com/chart/?symbol=WAT,Waters Corporation,Healthcare,300.75,29523269632,6.8,-3.1,-21.75,-1.15,34.8,308.98,334.89,False,False,False,NO CLEAR ENTRY,False,65.81,POSITIVE,5,Waters Corporation (WAT) Reports Q1: Everything You Need To Know Ahead Of Earnings | A Look At Waters (WAT) Valuation As Earnings Optimism And Positive Earnings ESP Build | 3 of Wall Street’s Favorite Stocks with Promising Prospects,27.98,18.4,427162368.0,60.282,29.28,20.3,43.66,IGNORE
MRSH,https://www.tradingview.com/chart/?symbol=MRSH,"Marsh & McLennan Companies, Inc.",Financial Services,167.31,80609034240,7.6,-15.4,-11.37,-3.69,42.62,174.56,185.76,False,False,False,NO CLEAR ENTRY,False,58.96,NEUTRAL,5,"How The Investment Story For Marsh And McLennan Companies (MRSH) Is Quietly Being Rewritten | Arthur J. Gallagher Q1 Earnings Beat, Commissions and Fees Rise Y/Y | Euronet Q1 Earnings Beat Estimates on EFT Processing Unit's Strength",20.94,14.79,4965374976.0,151.634,27.57,14.26,43.57,IGNORE
CRH,https://www.tradingview.com/chart/?symbol=CRH,CRH plc,Basic Materials,110.965,74146848768,9.1,,-9.44,6.05,38.74,110.99,114.89,False,False,False,NO CLEAR ENTRY,False,45.29,NEUTRAL,5,"How Investors Are Reacting To CRH (CRH) Q1 Loss, Reaffirmed 2026 Guidance, And Portfolio Shake-Up | CRH (CRH) Q1 2026 Earnings Call Transcript | CRH plc Q1 2026 Earnings Call Summary",20.59,16.69,786124992.0,83.227,15.81,9.64,43.47,IGNORE
FANG,https://www.tradingview.com/chart/?symbol=FANG,"Diamondback Energy, Inc.",Energy,212.85,59877208064,-9.4,,26.71,9.78,81.37,188.27,157.17,True,True,True,WATCH - OVERBOUGHT,False,64.32,POSITIVE,5,"The Zacks Analyst Blog Highlights Diamondback Energy, Permian Resources and APA Corporation | Earnings To Watch: Diamondback Energy (FANG) Reports Q1 Results Tomorrow | Better Oil Stock: Diamondback Energy vs. Chevron",37.15,12.4,497624992.0,33.784,3.74,11.64,43.4,IGNORE
XOM,https://www.tradingview.com/chart/?symbol=XOM,Exxon Mobil Corporation,Energy,153.965,639964676096,2.6,-43.4,5.01,-4.19,59.53,154.96,126.97,False,True,True,NO CLEAR ENTRY,False,45.37,NEUTRAL,5,"Big Oil Has Transformed Into Shareholder-Friendly Cash Machines, Says CNBC’s Halftime Report | ExxonMobil Crushes Q1 2026 EPS Estimates by 15% — Here’s What Investors Need to Know | Stock Market News for May 4, 2026",25.92,15.22,11630499840.0,18.261,9.87,7.76,43.28,IGNORE
CNP,https://www.tradingview.com/chart/?symbol=CNP,"CenterPoint Energy, Inc.",Utilities,43.21,28266661888,1.9,6.7,7.68,-1.14,52.48,43.09,39.66,True,True,True,BULLISH TREND,False,53.93,NEUTRAL,5,"National Fuel Gas Q2 Earnings Call Highlights | DTE Energy's Q1 Earnings Miss Estimates, Decrease Year Over Year | A Look At CenterPoint Energy (CNP) Valuation As Steady Returns Contrast With Premium P/E Multiple",26.51,20.75,-4945375232.0,215.591,9.56,11.38,43.26,IGNORE
MGM,https://www.tradingview.com/chart/?symbol=MGM,MGM Resorts International,Consumer Cyclical,37.93,9704262656,4.2,-5.9,2.71,3.41,57.87,37.21,35.61,True,True,True,BULLISH TREND,False,58.33,NEUTRAL,5,"How The MGM Resorts International (MGM) Investment Narrative Is Shifting With Mixed Analyst Signals | Roblox downgraded, Hershey upgraded: Wall Street's top analyst calls | Here Are Friday’s Top Wall Street Analyst Research Calls: Avis Budget, Caterpillar, Celestica, Commvault Systems, Ciena, Dutch Bros. e.l.f. Beauty, Hershey, Roblox, and More",51.96,16.48,528360256.0,951.186,13.49,1.03,43.12,IGNORE
LYB,https://www.tradingview.com/chart/?symbol=LYB,LyondellBasell Industries N.V.,Basic Materials,75.73,24443318272,-6.3,-29.5,34.24,-4.86,54.96,70.87,54.02,True,True,True,BULLISH TREND,False,79.0,POSITIVE,5,"LyondellBasell Set to Benefit From Rising Polyethylene, Polypropylene Prices in Q2, RBC Says | Best Income Stocks to Buy for May 4th | LyondellBasell Industries NV (LYB) Q1 2026 Earnings Call Highlights: Strong EBITDA Growth Amid ...",,11.67,987000000.0,141.24,-6.01,-2.69,43.12,IGNORE
HON,https://www.tradingview.com/chart/?symbol=HON,Honeywell International Inc.,Industrials,210.175,133178048512,2.4,-41.9,-10.25,-8.4,22.03,229.34,210.01,False,True,True,BUY THE DIP,False,56.83,NEUTRAL,5,"Is Now An Opportune Moment To Examine Honeywell International Inc. (NASDAQ:HON)? | 2 Stocks to Watch as the Quantum Space Gets More Crowded | Jefferies, Barclays Cut Honeywell (HON) Targets After Q1, Flag Aerospace Concerns",33.52,18.31,2936875008.0,257.387,24.26,10.89,42.9,IGNORE
EMR,https://www.tradingview.com/chart/?symbol=EMR,Emerson Electric Co.,Industrials,137.47,77258137600,4.1,4.9,-12.28,4.38,37.31,138.74,137.03,False,True,True,NO CLEAR ENTRY,False,43.44,NEUTRAL,5,3 Industrial Dividend Stocks That Keep Paying No Matter What the Market Does | Is Now The Time To Look At Buying Emerson Electric Co. (NYSE:EMR)? | Emerson Electric Co. (EMR) Is a Trending Stock: Facts to Know Before Betting on It,33.69,19.23,2879375104.0,69.283,9.65,12.72,42.88,IGNORE
CSGP,https://www.tradingview.com/chart/?symbol=CSGP,"CoStar Group, Inc.",Real Estate,35.05,14312867840,22.5,,-33.03,-12.27,37.16,41.38,66.14,False,False,False,NO CLEAR ENTRY,False,58.56,NEUTRAL,5,1 Oversold Stock Ready to Bounce Back and 2 We Find Risky | A Look At CoStar Group (CSGP) Valuation After Raised 2026 Guidance And Homes.com Growth | CoStar Group Inc. (CSGP): Bares Capital Is Bullish on This Stock,500.71,19.75,202200000.0,14.526,0.3,0.73,42.83,IGNORE
LOW,https://www.tradingview.com/chart/?symbol=LOW,"Lowe's Companies, Inc.",Consumer Cyclical,226.335,126761844736,10.9,-11.0,-17.56,-1.56,31.27,243.36,247.12,False,False,False,NO CLEAR ENTRY,False,45.62,NEUTRAL,5,"Lowe’s New Pro Card Targets Contractors As Shares Lag Analyst Targets | Hershey, Wayfair, Molson Coors: Earnings roundup | Ethan Allen (ETD) Q3 Earnings and Revenues Top Estimates",19.1,16.59,4987375104.0,,,7.71,42.75,IGNORE
CHRW,https://www.tradingview.com/chart/?symbol=CHRW,"C.H. Robinson Worldwide, Inc.",Industrials,161.275,19130574848,-0.8,9.9,-18.57,-3.91,43.11,175.32,152.93,False,True,True,NO CLEAR ENTRY,False,67.07,POSITIVE,5,"1 Profitable Stock Worth Your Attention and 2 We Ignore | Here's Why C.H. Robinson Worldwide (CHRW) is a Strong Growth Stock | Barclays Sees Upside in C.H. Robinson (CHRW), Lifts PT on Efficiency Momentum",32.58,22.16,642142272.0,96.501,34.84,3.7,42.52,IGNORE
DRI,https://www.tradingview.com/chart/?symbol=DRI,"Darden Restaurants, Inc.",Consumer Cyclical,190.6248,21833211904,5.9,-3.3,-9.48,-2.16,40.91,199.75,193.95,False,False,True,NO CLEAR ENTRY,False,54.82,NEUTRAL,5,A Look At Darden Restaurants (DRI) Valuation After Recent Pullback And 12% Undervaluation Narrative | Why Is Dave & Buster's (PLAY) Down 11.4% Since Last Earnings Report? | Smokey Bones closes all locations nationwide amid bankruptcy,20.11,16.77,678150016.0,387.681,51.54,8.66,42.49,IGNORE
APD,https://www.tradingview.com/chart/?symbol=APD,"Air Products and Chemicals, Inc.",Basic Materials,296.71,66066489344,8.8,,4.18,1.08,50.13,288.22,271.5,True,True,True,BULLISH TREND,False,56.81,NEUTRAL,5,"Air Products Deepens Samsung Ties With Pyeongtaek Semiconductor Gas Megaproject | Here Are Friday’s Top Wall Street Analyst Research Calls: Avis Budget, Caterpillar, Celestica, Commvault Systems, Ciena, Dutch Bros. e.l.f. Beauty, Hershey, Roblox, and More | Air Products and Chemicals Q2 Earnings Call Highlights",31.3,20.87,-3519237376.0,101.611,12.35,16.91,42.24,IGNORE
PAYX,https://www.tradingview.com/chart/?symbol=PAYX,"Paychex, Inc.",Technology,92.44,33120409600,19.9,9.1,-6.13,0.81,61.47,92.32,112.47,True,False,False,NO CLEAR ENTRY,False,57.54,NEUTRAL,5,"Assessing Paychex (PAYX) Valuation After Dividend Hike And AI Focused HCM Expansion | Is Paychex, Inc. (PAYX) A Good Stock To Buy Now? | 3 Cash-Producing Stocks with Warning Signs",20.41,15.67,,124.91,,26.63,42.2,IGNORE
ZS,https://www.tradingview.com/chart/?symbol=ZS,"Zscaler, Inc.",Technology,141.43,22740627456,25.9,,-23.88,2.07,68.14,143.29,232.98,False,False,False,NO CLEAR ENTRY,False,67.94,POSITIVE,5,High Growth Tech Stocks In US With Promising Potential | Why Zscaler (ZS) Stock Is Up Today | Exploring High Growth Tech Stocks in the US Market,,30.83,1020966656.0,84.995,-3.56,-2.25,42.19,IGNORE
VRSK,https://www.tradingview.com/chart/?symbol=VRSK,"Verisk Analytics, Inc.",Industrials,176.49,23124045824,3.9,4.8,-6.63,-4.64,56.51,189.84,223.34,False,False,False,NO CLEAR ENTRY,False,65.17,POSITIVE,5,"Is Verisk Analytics, Inc. (VRSK) A Good Stock To Buy Now? | AI Push, Buybacks and Steady Guidance Could Be A Game Changer For Verisk Analytics (VRSK) | A Look At Verisk Analytics (VRSK) Valuation After Earnings Beat Buybacks And Dividend Increase",26.9,20.41,944362496.0,,,29.34,42.11,IGNORE
APO,https://www.tradingview.com/chart/?symbol=APO,"Apollo Global Management, Inc.",Financial Services,129.55,74688045056,87.7,-57.3,-2.05,21.03,73.97,113.62,129.76,True,False,False,WATCH - OVERBOUGHT,False,56.57,NEUTRAL,5,"Anthropic and OpenAI are both launching joint ventures for enterprise AI services | Top Midday Stories: GameStop Submits $55.5 Billion Bid to Acquire eBay; Amazon Launches Supply Chain Services | ADT Prices Secondary Public Offering of Common Stock, Concurrent Share Repurchase",23.38,12.2,,99.468,14.7,10.98,41.98,IGNORE
MDT,https://www.tradingview.com/chart/?symbol=MDT,Medtronic plc,Healthcare,78.7,101054578688,8.7,-11.8,-22.08,-9.15,22.74,87.58,92.88,False,False,False,NO CLEAR ENTRY,False,50.96,NEUTRAL,5,Jim Cramer Believes Competitors Might Hurt Intuitive Surgical | Masimo SET Shows Accurate Pulse Oximetry in Newborns of All Skin Tones | Medtronic plc (MDT) Receives the CE Mark for the Stealth AXiS™ Surgical System,21.99,12.99,4073125120.0,57.06,9.39,13.0,41.68,IGNORE
BX,https://www.tradingview.com/chart/?symbol=BX,Blackstone Inc.,Financial Services,123.7,151193812992,5.7,3.9,-6.99,9.42,45.62,116.3,145.68,True,False,False,NO CLEAR ENTRY,False,53.18,NEUTRAL,5,Blackstone's AI Data Center Bet Tests Investor Appetite | OpenAI Finalizes $10 Billion Joint Venture With PE Firms to Deploy AI | Blackstone data center REIT IPO seeks $1.75 billion,31.72,16.38,,66.125,29.53,21.21,41.65,IGNORE
GIS,https://www.tradingview.com/chart/?symbol=GIS,"General Mills, Inc.",Consumer Defensive,34.345,18329282560,2.2,-14.5,-27.99,-6.67,46.42,37.87,44.2,False,False,False,NO CLEAR ENTRY,False,72.13,POSITIVE,5,Buy These 3 Dividend Stocks Today and Thank Yourself in 20 Years | Jim Cramer Shares Key Insight About General Mills (GIS) | 5 Quality Passive Income Blue-Chips That All Yield 5% and More Safely,8.4,10.45,2263375104.0,217.629,23.59,12.05,41.32,IGNORE
IT,https://www.tradingview.com/chart/?symbol=IT,"Gartner, Inc.",Technology,144.72,9770075136,2.2,-34.2,-8.31,-8.32,43.31,155.56,220.81,False,False,False,NO CLEAR ENTRY,False,62.79,POSITIVE,5,Earnings To Watch: Gartner (IT) Reports Q1 Results Tomorrow | AI adoption is accelerating faster than its security layer | Is Gartner (IT) Now Offering Value After A 64.6% One Year Share Price Slump?,15.0,9.83,922793728.0,1046.535,86.86,11.22,41.32,IGNORE
CHTR,https://www.tradingview.com/chart/?symbol=CHTR,"Charter Communications, Inc.",Communication Services,170.81,24114675712,-1.0,8.9,-23.81,-22.28,32.82,216.98,234.92,False,False,False,NO CLEAR ENTRY,False,45.43,NEUTRAL,5,Spectrum suffers heavy loss as customers ditch service | These Insiders Are Quietly Loading Up on Charter After the Post-Earnings Plunge | Charter Communications President Acquires 3.2% More Stock,4.62,3.86,2403624960.0,459.525,27.5,9.03,41.18,IGNORE
HAS,https://www.tradingview.com/chart/?symbol=HAS,"Hasbro, Inc.",Consumer Cyclical,93.87,13284627456,31.3,,-2.15,4.11,52.14,94.03,83.74,False,True,True,NO CLEAR ENTRY,False,57.61,NEUTRAL,5,"Jakks Pacific (JAKK) Reports Q1 Loss, Tops Revenue Estimates | Why Hasbro (HAS) Dipped More Than Broader Market Today | Is Flexsteel Industries (FLXS) Stock Outpacing Its Consumer Discretionary Peers This Year?",,14.81,434350016.0,600.584,-36.35,-6.86,41.11,IGNORE
T,https://www.tradingview.com/chart/?symbol=T,AT&T Inc.,Communication Services,25.875,179788267520,2.9,-11.3,-3.95,-7.71,52.48,27.24,26.19,False,False,True,NO CLEAR ENTRY,False,55.71,NEUTRAL,5,"Verizon Stock: Cheap Multiple, Complicated Story | Assessing AT&T (T) Valuation After Mixed Short Term Returns And Long Term Shareholder Gains | Q1 2026 Telecom Wars: Analyst Eye 30% Gains in T-Mobile Post-Earnings",8.51,10.13,8849000448.0,125.175,18.37,16.94,40.76,IGNORE
MELI,https://www.tradingview.com/chart/?symbol=MELI,"MercadoLibre, Inc.",Consumer Cyclical,1833.02,92928950272,44.6,-12.5,-10.71,6.85,49.06,1760.31,2090.14,True,False,False,NO CLEAR ENTRY,False,63.18,POSITIVE,5,"Is MercadoLibre, Inc. (MELI) A Good Stock To Buy Now? | BTIG, Jefferies Bullish on MercadoLibre (MELI) Despite Margin Pressures | Barclays Adjusts MercadoLibre (MELI) PT Preceding the Release of First Quarter Results",46.51,27.03,-2455375104.0,169.235,35.99,6.91,40.7,IGNORE
SWKS,https://www.tradingview.com/chart/?symbol=SWKS,"Skyworks Solutions, Inc.",Technology,68.98,10375004160,-3.1,-47.0,18.32,24.99,79.46,57.8,65.23,True,True,False,WATCH - OVERBOUGHT,False,53.71,NEUTRAL,5,Skyworks Solutions Earnings: What To Look For From SWKS | Is Skyworks (SWKS) Using Integrated Isolators To Quietly Redefine Its Edge Computing Strategy? | Broadcom Shares Trade Near 52-Week High: Can the Rally Continue?,26.43,13.82,1099687552.0,20.714,6.49,9.73,40.45,IGNORE
COIN,https://www.tradingview.com/chart/?symbol=COIN,"Coinbase Global, Inc.",Financial Services,204.5,54003372032,-22.2,,21.28,19.27,59.64,188.2,263.07,True,False,False,NO CLEAR ENTRY,False,56.33,NEUTRAL,5,"Circle, Coinbase surge after lawmakers unveil revised stablecoin rule | Stablecoin legislative breakthrough ignites 16% rally in Circle shares | Coinbase Has 26% Upside to Price Targets After 57% Selloff",45.85,41.08,1298361984.0,53.119,10.05,18.31,40.31,IGNORE
SWK,https://www.tradingview.com/chart/?symbol=SWK,"Stanley Black & Decker, Inc.",Industrials,75.725,11771872256,2.7,-34.8,-9.53,10.32,56.27,74.4,73.5,True,True,True,BULLISH TREND,False,51.3,NEUTRAL,5,Stanley Black & Decker Q1 Earnings Call Highlights | 3 Industrial Dividend Stocks That Keep Paying No Matter What the Market Does | Stanley Black & Decker (SWK) Valuation Check After Earnings Beat Guidance Upgrade And Debt Reduction,31.03,12.23,842187520.0,77.606,4.17,2.44,40.3,IGNORE
ITW,https://www.tradingview.com/chart/?symbol=ITW,Illinois Tool Works Inc.,Industrials,251.38,72447721472,4.6,11.8,-12.41,-2.65,29.31,269.17,258.45,False,False,True,NO CLEAR ENTRY,False,49.74,NEUTRAL,5,"Illinois Tool Works Inc. (NYSE:ITW) First-Quarter Results: Here's What Analysts Are Forecasting For This Year | ITW Q1 Deep Dive: CapEx Segments Strengthen as Consumer Markets Lag, Guidance Maintained | Illinois Tool Works Q1 Earnings Call Highlights",23.32,20.67,,283.22,96.85,19.32,40.28,IGNORE
CMG,https://www.tradingview.com/chart/?symbol=CMG,"Chipotle Mexican Grill, Inc.",Consumer Cyclical,32.4498,41710911488,7.4,-17.9,-18.73,-2.14,34.43,34.28,37.85,False,False,False,NO CLEAR ENTRY,False,53.82,NEUTRAL,5,"Chipotle CEO on affordable prices, portion size, and desserts | Chipotle Stock Is Just Getting Started As Sales Rebound In Q1 | Ditch Starbucks and DoorDash, George Kamel Says. How Cheap Appliances Can Replace Your Takeout Budget",29.77,23.9,1087909760.0,217.885,49.23,11.96,40.21,IGNORE
PNW,https://www.tradingview.com/chart/?symbol=PNW,Pinnacle West Capital Corporation,Utilities,101.675,12305283072,3.0,,8.16,-1.0,46.62,101.52,92.28,True,True,True,BULLISH TREND,False,50.0,NEUTRAL,5,Pinnacle West (PNW) Surpasses Q1 Earnings and Revenue Estimates | Pinnacle West Capital to Post Q1 Earnings: What's in the Cards? | Jim Cramer on Pinnacle West: “Buy Some Here and Then Buy Some a Little Bit Lower”,20.13,18.24,-601883904.0,201.771,9.06,11.55,39.95,IGNORE
TKO,https://www.tradingview.com/chart/?symbol=TKO,"TKO Group Holdings, Inc.",Communication Services,185.66,13918497792,11.9,,-9.74,-8.88,30.59,197.36,193.41,False,False,True,NO CLEAR ENTRY,False,59.37,NEUTRAL,5,"What TKO Group Holdings (TKO)'s UFC Expansion into Azerbaijan Means For Shareholders | Live Entertainment Poised to Capture Value in AI-Driven Content Surge, Morgan Stanley Says | Roblox downgraded, Hershey upgraded: Wall Street's top analyst calls",81.79,46.71,759956096.0,43.924,5.63,4.13,39.9,IGNORE
CAG,https://www.tradingview.com/chart/?symbol=CAG,"Conagra Brands, Inc.",Consumer Defensive,13.875,6638315520,-1.9,39.0,-28.16,-9.51,49.04,15.65,16.89,False,False,False,NO CLEAR ENTRY,False,49.24,NEUTRAL,5,1 Small-Cap Stock for Long-Term Investors and 2 Facing Challenges | Jim Cramer Shares Key Insight About Conagra (CAG) | Conagra Brands (CAG) Down 8.7% Since Last Earnings Report: Can It Rebound?,,8.17,654675008.0,89.813,-0.51,-0.39,39.69,IGNORE
VTRS,https://www.tradingview.com/chart/?symbol=VTRS,Viatris Inc.,Healthcare,15.1299,17617571840,5.0,,6.26,12.57,75.42,14.18,11.78,True,True,True,WATCH - OVERBOUGHT,False,66.03,POSITIVE,5,Is It Too Late To Consider Viatris (VTRS) After Its Strong One Year Share Price Run | Is Viatris (VTRS) One of the Best Medical Stocks to Buy Under $30? | Viatris (VTRS) Earnings Expected to Grow: Should You Buy?,,5.68,2431462400.0,99.91,-21.08,-24.58,39.63,IGNORE
