MNST,https://www.tradingview.com/chart/?symbol=MNST,Monster Beverage Corporation,Consumer Defensive,87.43,85507252224,26.9,28.9,0.89,11.76,77.84,77.86,73.86,True,True,True,WATCH - OVERBOUGHT,False,56.03,NEUTRAL,5,"Zacks Industry Outlook Highlights Coca-Cola, PepsiCo, Monster Beverage, Fomento Economico Mexicano and Vita Coco | See How Institutions Drive Monster Beverage Shares Higher | 5 Soft Drinks Stocks to Track Amid Margin & Tariff Pressures",42.24,33.84,1684340480.0,1.082,26.65,23.11,66.58,WATCHLIST
REG,https://www.tradingview.com/chart/?symbol=REG,Regency Centers Corporation,Real Estate,78.85,14739822592,10.0,17.2,1.53,-1.67,49.7,77.76,72.41,True,True,True,BULLISH TREND,False,49.19,NEUTRAL,5,"Federal Realty vs. Regency Centers: Which Retail REIT to Buy Now? | For Now at Least, Retail Property Owners Remain on Steady Ground Despite Global Economic and Political Turmoil | Regency Centers Holds Virtual 2026 Annual Meeting, Shareholders Back Directors, Pay and KPMG",27.1,31.12,574623104.0,73.218,8.0,33.11,66.34,WATCHLIST
AVB,https://www.tradingview.com/chart/?symbol=AVB,"AvalonBay Communities, Inc.",Real Estate,185.58,26328616960,2.5,40.3,4.44,7.66,50.7,174.3,177.96,True,True,False,BULLISH TREND,False,60.9,POSITIVE,5,Equity Residential (EQR): The Best Residential REIT to Buy in 2026 | AvalonBay (AVB) and Equity Residential Near Merger Agreement | Do Wall Street Analysts Like AvalonBay Communities Stock?,22.97,38.09,1392035584.0,81.307,9.72,37.27,66.27,WATCHLIST
ORCL,https://www.tradingview.com/chart/?symbol=ORCL,Oracle Corporation,Technology,191.31,550460850176,21.7,24.5,27.78,10.45,55.6,167.76,206.63,True,False,False,NO CLEAR ENTRY,False,59.31,NEUTRAL,5,Why Dan Ives added these 2 tech stocks to his AI ETF | Market Uncertainty? This High-Yield Energy Infrastructure Toll Booth Under $30 Is Best Buy Now | Forget ServiceNow: 2 High-Growth Software Bargains to Buy on the Dip With Safer AI Exposure,34.36,23.83,-22298499072.0,415.265,57.57,25.3,66.24,WATCHLIST
HLT,https://www.tradingview.com/chart/?symbol=HLT,Hilton Worldwide Holdings Inc.,Consumer Cyclical,322.57,73432539136,11.0,35.0,1.59,-3.85,61.95,315.97,290.44,True,True,True,BULLISH TREND,False,53.61,NEUTRAL,5,"How to Invest Now If You Want to Profit from the 2026 World Cup | 3 Reasons HLT is Risky and 1 Stock to Buy Instead | Landmark Investment Partners Cuts Howard Hughes Holdings Stake, According to Recent SEC Filing",49.25,30.97,1684499968.0,,,30.41,66.24,WATCHLIST
TRV,https://www.tradingview.com/chart/?symbol=TRV,"The Travelers Companies, Inc.",Financial Services,305.03,64863010816,1.0,357.6,-0.03,0.76,57.53,299.73,285.85,True,True,True,BULLISH TREND,False,66.23,POSITIVE,5,"Intel downgraded, Marvell upgraded: Wall Street's top analyst calls | Here Are Tuesday’s Top Wall Street Analyst Research Calls: Albemarle, Booz Allen Hamilton, Cigna, DT Midstream, GE Vernova, Intel, Okta, Travelers, Occidental Petroleum, and More | 2 Dow Jones Stocks to Research Further and 1 We Turn Down",9.11,10.7,13304375296.0,28.975,25.27,15.54,66.15,WATCHLIST
EXPD,https://www.tradingview.com/chart/?symbol=EXPD,"Expeditors International of Washington, Inc.",Industrials,160.98,21054756864,4.4,16.3,11.24,9.09,67.22,148.45,140.59,True,True,True,BULLISH TREND,False,48.22,NEUTRAL,5,Here's Why Investors Should Give Ryanair Stock a Miss Now | Expeditors International Stock: Is Wall Street Bullish or Bearish? | Here's Why Investors Should Give Greenbrier Stock a Miss Now,25.96,23.6,783248512.0,24.708,36.64,7.47,66.06,WATCHLIST
BIIB,https://www.tradingview.com/chart/?symbol=BIIB,Biogen Inc.,Healthcare,193.87,28622407680,1.9,31.1,3.11,5.15,55.73,185.97,169.55,True,True,True,BULLISH TREND,False,42.28,NEUTRAL,5,"Ionis Pharmaceuticals Eyes Big Year With TRYNGOLZA Decision, 5 Phase 3 Readouts | MarketBeat Week in Review – 05/18 - 05/22 | Biogen Faces Trial Setbacks And Probes That Reframe Neuro Pipeline Risks",20.85,11.68,1915987456.0,35.181,7.7,13.8,66.03,WATCHLIST
HUBB,https://www.tradingview.com/chart/?symbol=HUBB,Hubbell Incorporated,Industrials,477.86,25250969600,11.1,12.5,-8.59,-13.6,27.77,504.71,466.01,False,True,True,BUY THE DIP,False,63.94,POSITIVE,5,"Do Wall Street Analysts Like Hubbell Incorporated Stock? | Hubbell Incorporated (NYSE:HUBB) Looks Like A Good Stock, And It's Going Ex-Dividend Soon | Hubbell, Rockwell Automation, and First Solar Shares Skyrocket, What You Need To Know",28.26,21.94,541449984.0,72.468,25.82,15.1,65.92,WATCHLIST
HAL,https://www.tradingview.com/chart/?symbol=HAL,Halliburton Company,Energy,41.2,34418388992,-0.3,133.5,15.93,2.08,47.29,39.37,30.55,True,True,True,BULLISH TREND,False,54.4,NEUTRAL,5,Halliburton ESOP Shelf Filing Raises Questions On Valuation And Dilution | Oceaneering International (OII) Up 1.2% Since Last Earnings Report: Can It Continue? | 3 S&P 500 Stocks We Think Twice About,22.76,14.19,2027000064.0,74.651,14.63,6.95,65.9,WATCHLIST
ICE,https://www.tradingview.com/chart/?symbol=ICE,"Intercontinental Exchange, Inc.",Financial Services,150.91,85341495296,20.4,79.7,-7.06,-4.76,40.0,157.96,161.68,False,False,False,NO CLEAR ENTRY,False,50.0,NEUTRAL,5,House Panel to Probe Insider Trading on Prediction Markets | NYSE Owner and OKX to Launch Perpetual Futures Tied to Oil | Sector Update: Financial Stocks Edge Higher Pre-Bell Friday,21.97,17.18,3743124992.0,70.986,13.85,37.67,65.85,WATCHLIST
LVS,https://www.tradingview.com/chart/?symbol=LVS,Las Vegas Sands Corp.,Consumer Cyclical,50.04,33158371328,25.3,73.0,-10.04,-4.69,35.2,53.16,56.57,False,False,False,NO CLEAR ENTRY,False,57.88,NEUTRAL,5,Is Las Vegas Sands (LVS) One of the Cheap NYSE Stocks to Buy According to Analysts? | Why Is Las Vegas Sands (LVS) Down 4.8% Since Last Earnings Report? | Why Investors Need to Take Advantage of These 2 Consumer Discretionary Stocks Now,18.46,13.6,1622625024.0,981.405,90.45,13.41,65.73,WATCHLIST
EQIX,https://www.tradingview.com/chart/?symbol=EQIX,"Equinix, Inc.",Real Estate,1083.33,106842603520,12.1,20.0,14.84,-1.81,53.67,1039.29,860.45,True,True,True,BULLISH TREND,False,50.0,NEUTRAL,5,Oklo Moves One Step Closer to Commercialization | Deutsche Bank Raises its Price Target on Equinix (EQIX) | SpaceX’s $2 Trillion Pitch: Is Elon Musk Quietly Building a Backup Internet for Civilization?,74.87,56.35,2725125120.0,162.961,10.06,14.93,65.6,WATCHLIST
MS,https://www.tradingview.com/chart/?symbol=MS,Morgan Stanley,Financial Services,200.135,315669905408,16.3,31.9,13.36,6.99,66.36,180.59,168.28,True,True,True,BULLISH TREND,False,41.35,NEUTRAL,5,"Update: Morgan Stanley Cuts Price Target on Royal Caribbean Group to $280 From $310, Keeps Equalweight Rating | Honeywell-Backed Quantinuum Seeks $1.05 Billion in US IPO | Morgan Stanley Cuts PT on Equinor ASA (EQNR) Following Q1 Results",18.13,15.76,,502.246,16.39,24.75,65.51,WATCHLIST
KEY,https://www.tradingview.com/chart/?symbol=KEY,KeyCorp,Financial Services,21.675,23500591104,11.8,33.3,0.14,0.21,46.9,21.02,19.67,True,True,True,BULLISH TREND,False,50.95,NEUTRAL,5,1 Stock Under $50 on Our Buy List and 2 We Ignore | How The Investment Narrative For KeyCorp (KEY) Is Shifting With New Targets And Assumptions | 3 Bank Stocks with Warning Signs,13.3,10.05,,,9.98,27.02,65.43,WATCHLIST
CSX,https://www.tradingview.com/chart/?symbol=CSX,CSX Corporation,Industrials,46.23,85901762560,1.7,26.5,8.75,1.81,59.65,43.05,37.92,True,True,True,BULLISH TREND,False,56.71,NEUTRAL,5,CSX Corporation (NASDAQ:CSX) Pays A US$0.14 Dividend In Just Two Days | Unusual Options Activity in CSX Stock Could Signal More Upside Ahead | Why Is CSX (CSX) Down 0.6% Since Last Earnings Report?,28.36,21.37,1129874944.0,143.06,23.68,21.55,65.39,WATCHLIST
VTR,https://www.tradingview.com/chart/?symbol=VTR,"Ventas, Inc.",Real Estate,87.67,42622500864,21.9,10.0,2.07,4.84,54.75,85.36,77.38,True,True,True,BULLISH TREND,False,68.19,POSITIVE,5,"GRS Advisors Opens $49 Million Broadstone Net Lease Position, According to Recent SEC Filing | Here is Why Ventas (VTR) is One of the Best Large Cap Stocks to Buy Under $100 | Ventas (VTR) Could Be a Great Choice",159.4,103.55,1483115264.0,93.736,2.14,4.26,65.36,WATCHLIST
CNC,https://www.tradingview.com/chart/?symbol=CNC,Centene Corporation,Healthcare,57.685,28484679680,5.1,18.3,34.37,37.94,67.77,44.29,39.17,True,True,True,BULLISH TREND,False,69.96,POSITIVE,5,"Best Growth Stocks to Buy for May 26th | The Bull Case For Centene (CNC) Could Change Following BofA’s Medicaid Margin Rebound Projections – Learn Why | Centene, Molina Have 'Compelling' EPS Upside Potential as Medicaid Margins Likely Improve 2027 Onwards, BofA Says",,12.95,6847499776.0,76.049,-26.04,-3.61,65.35,WATCHLIST
LIN,https://www.tradingview.com/chart/?symbol=LIN,Linde plc,Basic Materials,515.4,238293811200,8.2,13.4,3.74,1.0,62.22,500.38,462.93,True,True,True,BULLISH TREND,False,52.8,NEUTRAL,5,"The Zacks Analyst Blog Highlights Texas Instruments, Linde, BHP Group, Landmark Bancorp and Global Self Storage | Linde’s New €1.6 Billion Eurobond Raise Might Change The Case For Investing In Linde (LIN) | Top Research Reports for Texas Instruments, Linde & BHP",34.22,26.15,4694499840.0,65.642,18.23,20.44,64.87,WATCHLIST
HIG,https://www.tradingview.com/chart/?symbol=HIG,"The Hartford Insurance Group, Inc.",Financial Services,134.85,36966543360,6.1,41.4,-4.0,0.3,52.62,135.7,133.44,False,True,True,NO CLEAR ENTRY,False,59.94,NEUTRAL,5,Is Wall Street Bullish or Bearish on Hartford Insurance Group Stock? | Reflecting On Multi-Line Insurance Stocks’ Q1 Earnings: Hartford (NYSE:HIG) | How Hartford’s AI Benefits Push Connects With Valuation And Earnings Outlook,9.49,9.36,5603250176.0,23.151,22.74,14.11,64.85,WATCHLIST
BSX,https://www.tradingview.com/chart/?symbol=BSX,Boston Scientific Corporation,Healthcare,57.55,85539741696,11.6,100.0,-24.03,-7.28,56.26,61.38,86.02,False,False,False,NO CLEAR ENTRY,False,58.54,NEUTRAL,5,Boston Scientific Bets on WATCHMAN to Drive Structural Heart Growth | BofA Cuts PT on Boston Scientific Corporation (BSX) Over Worries for Medtech | Boston Scientific Recalls Test Cardiac Device Quality And Investor Confidence,24.08,15.29,2807124992.0,42.25,14.66,17.29,64.78,WATCHLIST
PSA,https://www.tradingview.com/chart/?symbol=PSA,Public Storage,Real Estate,304.97,53536186368,3.2,32.8,1.36,-1.08,56.85,293.64,283.23,True,True,True,BULLISH TREND,False,53.61,NEUTRAL,5,"Public Storage Stock Outlook: Is Wall Street Bullish or Bearish? | How Much Do You Really Need Invested to Replace a $50,000 Salary If Half Your Income Comes From REITs? | Healthcare REITs and Storage Units Prop Up REZ While Residential Faces Headwinds",31.51,30.17,2337331968.0,107.646,20.18,39.06,64.74,WATCHLIST
UNH,https://www.tradingview.com/chart/?symbol=UNH,UnitedHealth Group Incorporated,Healthcare,377.5,342824517632,2.0,0.7,32.71,6.36,59.34,332.55,321.73,True,True,True,BULLISH TREND,False,64.02,POSITIVE,5,Optum Rx Transparency Shift And What It May Mean For UNH Valuation | Dow Gives Back Early Gains. Healthcare Stocks Are a Drag. | SCHD’s Dividend Quality Filter Now Concentrates 42 Percent of Your Money in Just Ten Stocks,28.4,18.14,17687500800.0,73.982,12.18,2.68,64.57,WATCHLIST
TXT,https://www.tradingview.com/chart/?symbol=TXT,Textron Inc.,Industrials,92.44,16074297344,11.8,10.6,-6.26,5.09,52.38,90.36,87.5,True,True,True,BULLISH TREND,False,70.87,POSITIVE,5,Strength in Defense Aerospace Drives RBC Bearings: Can the Momentum Sustain? | What Are Wall Street Analysts' Target Price for Textron Stock? | How Investors May Respond To Textron (TXT) Expanding Asia-Pacific Aircraft Support And Specialized Mission Contracts,17.64,12.67,622374976.0,52.674,12.25,6.15,64.52,WATCHLIST
ADP,https://www.tradingview.com/chart/?symbol=ADP,"Automatic Data Processing, Inc.",Technology,220.7,88221351936,7.0,10.5,1.91,12.3,60.51,206.95,247.06,True,False,False,NO CLEAR ENTRY,False,61.91,POSITIVE,5,"Morgan Stanley Revises Automatic Data Processing (ADP) Target Lower Following Earnings Re-Rating | 5 Strong Buy Passive Income Giants Have Raised Their Dividends by Double Digits for Years | Analyst Upgrades Automatic Data Processing (ADP) to ‘Equal Weight’, Assigns $214 Price Target",20.59,18.1,4749387264.0,69.259,71.21,20.12,64.5,WATCHLIST
FCX,https://www.tradingview.com/chart/?symbol=FCX,Freeport-McMoRan Inc.,Basic Materials,63.865,91809759232,8.8,153.1,-6.4,4.61,62.72,61.35,52.07,True,True,True,BULLISH TREND,False,59.66,NEUTRAL,5,FCX Leads Metal And Mining Stocks Near Buy Points On Peace Hopes | Barclays Initiates Coverage of Freeport-McMoRan (FCX) with Overweight Rating | How The Freeport-McMoRan (FCX) Story Is Shifting With New Copper Views And Targets,33.79,17.13,1709874944.0,33.008,15.63,10.34,64.47,WATCHLIST
DAL,https://www.tradingview.com/chart/?symbol=DAL,"Delta Air Lines, Inc.",Industrials,78.61,51646328832,12.9,,11.78,15.15,68.7,68.72,64.51,True,True,True,BULLISH TREND,False,59.9,NEUTRAL,5,"Americans pick a new favorite airline for 2026 | Major airline cancels more flights until March, travelers will get refunds | Delta’s Flight Cancellations Have Mounted, and It’s Staffing Up to Improve",11.48,9.78,3093374976.0,105.021,24.99,6.87,64.44,WATCHLIST
AMP,https://www.tradingview.com/chart/?symbol=AMP,"Ameriprise Financial, Inc.",Financial Services,452.89,40713494528,9.0,66.0,-6.66,-2.06,32.25,454.8,476.14,False,False,False,NO CLEAR ENTRY,False,59.71,NEUTRAL,5,AI Could Kill the Brokerage Industry’s Cash Cow | 3 Large-Cap Stocks to Consider Right Now | 2 Value Stocks with Exciting Potential and 1 We Question,11.29,9.51,3355624960.0,56.246,66.94,20.17,64.33,WATCHLIST
LITE,https://www.tradingview.com/chart/?symbol=LITE,Lumentum Holdings Inc.,Technology,916.9999,71342587904,90.1,,35.45,4.01,44.28,852.76,446.65,True,True,True,BULLISH TREND,False,51.86,NEUTRAL,5,"Google, Meta, Amazon, and 6 other tech stocks powering the stock market's profit excitement | Nokia’s 140% Rally Turns AI Comeback Into Valuation Puzzle | Thinking of Riding on Lumentum Stock? Don't -- Until You Consider This Red Flag",161.44,50.66,93350000.0,111.445,22.83,17.68,64.1,WATCHLIST
ABNB,https://www.tradingview.com/chart/?symbol=ABNB,"Airbnb, Inc.",Consumer Cyclical,133.24,79078596608,17.9,6.0,-2.72,-6.71,36.95,134.23,128.4,False,True,True,BUY THE DIP,False,55.09,NEUTRAL,5,Booking Holdings vs. Airbnb: What Their Revenue Trends Tell Investors | Airbnb moves toward ‘one-stop-shop’ travel platform in latest update | What These 3 ‘Accidental’ Startup Stories Reveal About Where the Best Business Ideas Really Come From,32.9,22.04,3191000064.0,33.185,32.32,19.9,64.01,WATCHLIST
SNPS,https://www.tradingview.com/chart/?symbol=SNPS,"Synopsys, Inc.",Technology,533.0,102102564864,65.5,-82.0,25.12,6.43,69.75,456.85,470.92,True,True,False,BULLISH TREND,False,50.0,NEUTRAL,5,"PCE Inflation Data, Retail Earnings: What to Watch This Week | Meta, Broadcom And Others Launch $125 Million UCLA AI Chip Hub | Applied Materials Taps UCLA AI Chip Hub As Valuation Debate Grows",81.87,31.25,3096222464.0,35.579,5.54,13.76,63.95,WATCHLIST
EW,https://www.tradingview.com/chart/?symbol=EW,Edwards Lifesciences Corporation,Healthcare,87.31,50273095680,16.7,8.2,1.64,3.76,62.93,81.57,81.38,True,True,True,BULLISH TREND,False,62.19,POSITIVE,5,Boston Scientific Bets on WATCHMAN to Drive Structural Heart Growth | Are Wall Street Analysts Bullish on Edwards Lifesciences Stock? | Edwards Lifesciences' (NYSE:EW) Conservative Accounting Might Explain Soft Earnings,47.19,25.95,902137472.0,6.806,10.46,17.39,63.93,WATCHLIST
MAS,https://www.tradingview.com/chart/?symbol=MAS,Masco Corporation,Industrials,67.95,13707853824,6.5,20.0,-5.7,-7.96,42.96,65.45,67.07,True,True,False,BUY THE DIP,False,62.61,POSITIVE,5,FGI Industries vs. Masco: Which Stock Is the Better Buy Now? | Masco (MAS) Down 10.9% Since Last Earnings Report: Can It Rebound? | 3 Mid-Cap Stocks We Steer Clear Of,16.82,14.45,738499968.0,12229.63,8457.14,10.9,63.91,WATCHLIST
MCHP,https://www.tradingview.com/chart/?symbol=MCHP,Microchip Technology Incorporated,Technology,97.54,52874416128,35.1,,30.76,9.6,49.2,80.36,69.25,True,True,True,BULLISH TREND,False,63.57,POSITIVE,5,"Universal Display and Microchip Technology Shares Are Soaring, What You Need To Know | Is Microchip Technology Incorporated (MCHP) One of the Top Must-Buy Semiconductor Stocks to Invest in Now? | Is It Too Late To Consider Microchip Technology (MCHP) After A 71% One-Year Surge?",443.36,23.84,1139912448.0,87.715,3.4,4.88,63.79,WATCHLIST
CVS,https://www.tradingview.com/chart/?symbol=CVS,CVS Health Corporation,Healthcare,91.05,116173185024,6.1,63.1,17.73,16.81,70.89,80.62,76.89,True,True,True,WATCH - OVERBOUGHT,False,55.54,NEUTRAL,5,Here’s What Analysts Are Saying About CVS Health Corporation (CVS) | 3 Overrated  Stocks We’re Skeptical Of | CVS Health (CVS) Price Target Boosted by $8 at Mizuho,39.93,10.89,5201625088.0,100.912,3.75,0.72,63.59,WATCHLIST
UDR,https://www.tradingview.com/chart/?symbol=UDR,"UDR, Inc.",Real Estate,38.165,14140730368,4.2,151.6,1.45,9.76,67.38,35.47,35.78,True,True,False,BULLISH TREND,False,58.37,NEUTRAL,5,Here’s Why UDR is Among the 10 Best Residential REITs to Buy in 2026 | Gasoline Prices Aren’t the Only Inflation Threat. Watch Housing Costs. | UDR becomes first REIT to go to a monthly dividend,25.96,63.61,1007130496.0,142.368,12.35,27.78,63.37,WATCHLIST
IBKR,https://www.tradingview.com/chart/?symbol=IBKR,"Interactive Brokers Group, Inc.",Financial Services,82.44,140152799232,16.8,22.9,10.69,7.6,46.41,76.36,69.99,True,True,True,BULLISH TREND,False,43.5,NEUTRAL,5,COIN vs. IBKR: Which High-Growth Trading Stock Has an Edge? | Is It Worth Investing in Interactive Brokers (IBKR) Based on Wall Street's Bullish Views? | AI Could Kill the Brokerage Industry’s Cash Cow,35.38,28.87,,152.192,23.56,16.11,63.33,WATCHLIST
CME,https://www.tradingview.com/chart/?symbol=CME,CME Group Inc.,Financial Services,284.79,102901112832,14.4,21.3,-7.85,-0.09,48.21,295.12,277.31,False,True,True,NO CLEAR ENTRY,False,57.5,NEUTRAL,5,"Move Over, AST SpaceMobile: Alphabet Has a Surprising New No. 1 Holding... and It's From the Financial Sector | Place Your Bets – Futures Traders Are About To See The Launch Of AI Semiconductor Contracts | Nasdaq Gets Approval From SEC to List Bitcoin Index Options",24.32,22.07,3030237440.0,14.059,15.92,63.32,63.3,WATCHLIST
DXCM,https://www.tradingview.com/chart/?symbol=DXCM,"DexCom, Inc.",Healthcare,72.83,28103131136,15.0,92.2,-2.08,18.29,78.83,63.63,67.94,True,True,False,WATCH - OVERBOUGHT,False,65.01,POSITIVE,5,"Live Longer and Better. Does ’Biohacking’ Really Work? | S&P 500 Posts Eighth Consecutive Weekly Gain Led by Health Care, Utilities | DexCom Flex Launch Targets Wider Type 2 Market With Valuation Upside",31.26,23.8,1056637504.0,46.833,35.62,19.31,63.2,WATCHLIST
AME,https://www.tradingview.com/chart/?symbol=AME,"AMETEK, Inc.",Industrials,228.495,52371738624,11.3,14.5,-3.42,-1.91,42.27,225.81,207.79,True,True,True,BULLISH TREND,False,64.17,POSITIVE,5,Q1 Earnings Highs And Lows: AMETEK (NYSE:AME) Vs The Rest Of The Internet of Things Stocks | 2 Industrials Stocks with Exciting Potential and 1 We Turn Down | Is AMETEK (AME) Pricing Too Rich After Strong Multi Year Share Price Gains,34.52,25.93,1385356544.0,22.489,14.63,20.11,63.03,WATCHLIST
ALGN,https://www.tradingview.com/chart/?symbol=ALGN,"Align Technology, Inc.",Healthcare,163.975,11743583232,6.2,23.9,-13.33,-13.52,44.04,174.22,157.61,False,True,True,BUY THE DIP,False,53.61,NEUTRAL,5,Align Technology to establish $200m manufacturing facility in India | Will Align’s US$200 Million India Plant Shift Align Technology's (ALGN) Global Expansion and Efficiency Narrative? | Is Align Technology (ALGN) Stock Outpacing Its Medical Peers This Year?,27.51,13.25,538981504.0,2.797,10.82,10.5,62.99,WATCHLIST
HST,https://www.tradingview.com/chart/?symbol=HST,"Host Hotels & Resorts, Inc.",Real Estate,22.91,15894184960,2.8,105.3,14.06,9.62,72.1,20.52,18.13,True,True,True,WATCH - OVERBOUGHT,False,58.33,NEUTRAL,5,Top Dividend Stocks To Consider In May 2026 | 3 Dividend Stocks To Consider With Yields Up To 5.7% | Why Host Hotels (HST) is a Top Momentum Stock for the Long-Term,15.59,22.91,1190875008.0,80.482,14.87,16.37,62.92,WATCHLIST
TSN,https://www.tradingview.com/chart/?symbol=TSN,"Tyson Foods, Inc.",Consumer Defensive,65.26,22979964928,4.4,3602.2,3.42,1.92,29.46,64.54,58.72,True,True,True,BULLISH TREND,False,64.72,POSITIVE,5,Buy 3 AgriTech & Food Innovation Stocks to Lift Your Portfolio Returns | Is Darling Ingredients Entering a New Strategic Growth Phase? | Should Value Investors Buy Tyson Foods (TSN) Stock?,51.39,14.33,1029000000.0,44.41,2.62,0.81,62.88,WATCHLIST
BNY,https://www.tradingview.com/chart/?symbol=BNY,BNY,Financial Services,141.37,97033396224,13.4,41.8,16.71,5.88,75.41,128.47,115.54,True,True,True,WATCH - OVERBOUGHT,False,58.34,NEUTRAL,5,Q1 Earnings Highlights: BNY (NYSE:BK) Vs The Rest Of The Custody Bank Stocks | Evaluating Bank of New York Mellon Corporation (BNY) As Recent Returns Highlight A Valuation Debate | Should You Be Adding Bank of New York Mellon (NYSE:BNY) To Your Watchlist Today?,17.54,14.63,,,13.47,28.72,62.77,WATCHLIST
IRM,https://www.tradingview.com/chart/?symbol=IRM,Iron Mountain Incorporated,Real Estate,128.07,38106959872,21.6,860.0,18.07,10.38,42.67,115.19,99.46,True,True,True,BULLISH TREND,False,57.1,NEUTRAL,5,"Record AI-Fueled Data Center Leasing Could Be A Game Changer For Iron Mountain (IRM) | A Look At Iron Mountain (IRM) Valuation After Strong Q1 Growth And Raised AI Driven Data Center Guidance | Zacks Investment Ideas feature highlights: Iron Mountain, Cisco and nVent Electric",139.22,47.9,-499464512.0,,,3.76,62.67,WATCHLIST
ADBE,https://www.tradingview.com/chart/?symbol=ADBE,Adobe Inc.,Technology,241.695,97693122560,12.0,11.1,-6.7,-1.53,39.62,244.74,305.31,False,False,False,NO CLEAR ENTRY,False,47.89,NEUTRAL,5,"Mutual funds still hate battered software stocks: By the numbers | AI Disruption Concerns Weighed on Adobe’s (ADBE) Performance | Zacks Investment Ideas feature highlights: Intuit, iShares Expanded Tech-Software Sector ETF, Salesforce, Adobe, ServiceNow",14.08,9.16,9321374720.0,58.34,58.77,29.48,62.58,WATCHLIST
JPM,https://www.tradingview.com/chart/?symbol=JPM,JPMorgan Chase & Co.,Financial Services,306.67,821725757440,12.7,17.2,0.69,-0.52,47.34,301.71,303.38,True,True,False,BULLISH TREND,False,47.21,NEUTRAL,5,JPMorgan Expands AI Push as Banking Jobs Enter Transition Phase | Honeywell-Backed Quantinuum Seeks $1.05 Billion in US IPO | Jeff Bezos Says Bottom 50% of Americans Should Pay No Taxes. The Real Culprit Is Federal Spending,14.67,13.02,,,16.47,33.94,62.58,WATCHLIST
ADM,https://www.tradingview.com/chart/?symbol=ADM,Archer-Daniels-Midland Company,Consumer Defensive,78.33,37751656448,1.6,0.9,16.95,13.89,48.82,73.0,64.23,True,True,True,BULLISH TREND,False,63.18,POSITIVE,5,Buy 3 AgriTech & Food Innovation Stocks to Lift Your Portfolio Returns | Is Archer-Daniels-Midland (ADM) Attractive After Its 66% One-Year Share Price Surge? | Here's Why Archer Daniels Midland (ADM) is a Strong Momentum Stock,34.97,15.09,1578499968.0,46.128,4.77,1.34,62.4,WATCHLIST
VLO,https://www.tradingview.com/chart/?symbol=VLO,Valero Energy Corporation,Energy,245.8,72986075136,6.6,,21.19,4.71,45.89,241.57,189.76,True,True,True,BULLISH TREND,False,56.32,NEUTRAL,5,5 Low-Leverage Stocks to Buy as US Strikes Iran in Self-Defense | Valero Energy Gains From Favorable Refining Fundamentals | Is It Too Late To Consider Valero Energy (VLO) After Its 97% One Year Surge?,17.97,12.54,4786625024.0,42.664,15.85,3.57,62.31,WATCHLIST
MPC,https://www.tradingview.com/chart/?symbol=MPC,Marathon Petroleum Corporation,Energy,254.67,74347503616,8.8,,27.14,14.05,46.33,238.58,198.06,True,True,True,BULLISH TREND,False,56.22,NEUTRAL,5,May-Sept. is Peak Driving Season in the U.S. Can Road Trips Move the Needle for These 3 Energy Stocks? | IEO’s $0.55 quarterly dividend faces a critical test as oil prices hover near 12-month highs | Marathon Petroleum Expands Kazarian Role As Treasurer Over MPC And MPLX,16.75,11.33,3518749952.0,146.523,27.46,3.41,62.15,WATCHLIST
SPGI,https://www.tradingview.com/chart/?symbol=SPGI,S&P Global Inc.,Financial Services,410.6,121537601536,10.4,32.5,-6.15,-6.0,41.39,425.03,478.96,False,False,False,NO CLEAR ENTRY,False,50.7,NEUTRAL,5,Is S&P Global (SPGI) One of the Top Picks for a Dividend Stock Portfolio For Retirement? | Kevin Warsh Sworn In as Fed Chair With Lowest Senate Votes Ever Amid Independence Concerns | Will S&P Global’s (SPGI) Mobility Spin-Off and Dividend Steadiness Redefine Its Core Narrative?,25.94,18.49,5298874880.0,38.392,13.94,30.36,61.96,WATCHLIST
KIM,https://www.tradingview.com/chart/?symbol=KIM,Kimco Realty Corporation,Real Estate,24.38,16441621504,4.0,29.4,4.28,2.91,63.82,23.27,21.58,True,True,True,BULLISH TREND,False,63.51,POSITIVE,5,Realty Income's Occupancy Edge: Can 98.9% Stability Hold? | Kimco Realty Sued by Coffee Drip Over Allegations of Fraudulent Business Practices | Why Kimco Realty (KIM) is a Great Dividend Stock Right Now,28.02,28.51,838712128.0,78.788,5.86,28.54,61.88,WATCHLIST
CI,https://www.tradingview.com/chart/?symbol=CI,The Cigna Group,Healthcare,280.515,74205306880,4.6,29.1,-2.34,1.77,53.69,277.47,280.31,True,True,False,BULLISH TREND,False,67.4,POSITIVE,5,"Intel downgraded, Marvell upgraded: Wall Street's top analyst calls | Here Are Tuesday’s Top Wall Street Analyst Research Calls: Albemarle, Booz Allen Hamilton, Cigna, DT Midstream, GE Vernova, Intel, Okta, Travelers, Occidental Petroleum, and More | Is The Cigna Group (CI) One of the Best Dividend Growth Stocks to Buy and Hold for 3 Years?",2.47,8.38,6923375104.0,72.805,16.27,2.26,61.84,WATCHLIST
