CPAY,https://www.tradingview.com/chart/?symbol=CPAY,"Corpay, Inc.",Technology,304.445,20133554176,20.7,9.0,-14.46,0.17,19.41,310.65,308.27,False,False,True,NO CLEAR ENTRY,False,52.02,NEUTRAL,5,Corpay Set to Report Q1 Earnings: Here's What Investors Should Know | Charles River Gears Up to Report Q1 Earnings: What's in the Cards? | Corpay’s New AI Spend-Automation Suite Could Be A Game Changer For Corpay (CPAY),20.26,10.2,1888911360.0,243.348,29.07,23.62,56.51,IGNORE
DIS,https://www.tradingview.com/chart/?symbol=DIS,The Walt Disney Company,Communication Services,109.195,189618372608,6.5,-29.8,1.93,10.1,57.08,100.94,108.94,True,True,False,BULLISH TREND,False,55.54,NEUTRAL,5,"Disney-Heavy ETFs to Watch After Impressive Q2 Earnings | Disney Just Got a Wall Street Pile-On: Three Firms Hike Price Targets After Q2 Crusher | Company News for May 7, 2026",17.47,14.65,3696375040.0,41.069,11.01,11.54,56.34,IGNORE
EXPE,https://www.tradingview.com/chart/?symbol=EXPE,"Expedia Group, Inc.",Consumer Cyclical,245.77,29497827328,11.4,-27.3,4.17,3.74,34.83,239.25,236.18,True,True,True,BULLISH TREND,False,58.02,NEUTRAL,5,"Jobs Report, Earnings: What to Watch for the Rest of the Week | How Investors Are Reacting To Expedia Group (EXPE) Hiring Snap Veteran Derek Andersen As CFO | Zillow (NASDAQ:ZG) Reports Q1 CY2026 In Line With Expectations",25.03,10.73,2934000128.0,254.692,48.67,8.78,56.34,IGNORE
ACN,https://www.tradingview.com/chart/?symbol=ACN,Accenture plc,Technology,178.625,109932101632,8.3,4.0,-23.91,-7.07,24.08,193.17,236.53,False,False,False,NO CLEAR ENTRY,False,53.4,NEUTRAL,5,"Top Dividend Stocks To Consider In May 2026 | ServiceNow, Accenture partner to deliver agentic AI at enterprise scale | Time to Buy: This Cheap High-Yield Dividend Stock Is Trading Near Multi-Year Lows",14.64,11.98,12164313088.0,25.469,24.76,10.61,56.32,IGNORE
ALB,https://www.tradingview.com/chart/?symbol=ALB,Albemarle Corporation,Basic Materials,204.55,24113762304,15.9,,23.71,15.28,54.56,179.88,131.85,True,True,True,BULLISH TREND,False,57.62,NEUTRAL,5,"Lithium Play Albemarle, IBD Stock Of The Day, Breaks Out On Blowout Earnings | Albemarle Stock Surges on Earnings. Lithium Is Back. | ALB's Q1 Earnings and Sales Beat on Higher Lithium Pricing and Volumes",,22.66,453286368.0,33.954,-4.66,-9.93,56.31,IGNORE
LNT,https://www.tradingview.com/chart/?symbol=LNT,Alliant Energy Corporation,Utilities,71.89,18567495680,5.0,4.9,8.26,-0.77,47.83,71.5,66.85,True,True,True,BULLISH TREND,False,70.06,POSITIVE,5,"Alliant Energy Corp (LNT) Q1 2026 Earnings Call Highlights: Strong Earnings Amid Mild ... | Alliant Energy Q1 Earnings Match Estimates, Revenues Increase Y/Y | Alliant Energy Q1 Earnings Call Highlights",22.61,19.54,-1202625024.0,159.526,11.31,18.58,56.3,IGNORE
DOC,https://www.tradingview.com/chart/?symbol=DOC,"Healthpeak Properties, Inc.",Real Estate,19.265,13394244608,7.1,363.9,16.49,16.19,66.97,16.89,16.94,True,True,False,BULLISH TREND,False,55.11,NEUTRAL,5,"Healthpeak Properties Q1 FFOA Tops Estimates on Steady Leasing Momentum | Healthpeak Properties, Inc. Q1 2026 Earnings Call Summary | Healthpeak (DOC) Q1 FFO and Revenues Surpass Estimates",60.2,142.7,,118.243,2.8,7.73,56.26,IGNORE
CFG,https://www.tradingview.com/chart/?symbol=CFG,"Citizens Financial Group, Inc.",Financial Services,64.82,27411208192,13.8,46.8,-3.57,2.36,53.95,61.09,55.82,True,True,True,BULLISH TREND,False,50.22,NEUTRAL,5,Citizens Bank customers pull money over lender’s ICE ties | Citizens Financial Joins Project Keystone As Valuation Gap And Momentum Stand Out | 3 Bank Stocks We’re Skeptical Of,15.36,10.14,,,7.74,25.05,56.17,IGNORE
ALGN,https://www.tradingview.com/chart/?symbol=ALGN,"Align Technology, Inc.",Healthcare,169.2,12117642240,6.2,23.9,-12.1,-4.31,29.67,177.96,158.12,False,True,True,NO CLEAR ENTRY,False,56.37,NEUTRAL,5,"What Makes Align Technology (ALGN) a New Buy Stock | Is Agenus (AGEN) Stock Outpacing Its Medical Peers This Year? | Earnings Beat: Align Technology, Inc. Just Beat Analyst Forecasts, And Analysts Have Been Updating Their Models",28.44,13.68,584216384.0,2.01,10.82,10.5,56.01,IGNORE
BR,https://www.tradingview.com/chart/?symbol=BR,"Broadridge Financial Solutions, Inc.",Technology,152.27,17611288576,7.8,15.1,-15.43,-5.4,30.36,166.95,211.55,False,False,False,NO CLEAR ENTRY,False,64.79,POSITIVE,5,"BR Q1 Deep Dive: Delays in Large Sales and Investment Cycle Shape Near-Term Outlook | Will Strong Quarter, Web3 Proxy Voting, and M&A Push Broadridge Financial Solutions' (BR) Narrative Forward? | Broadridge Tops Q3 Estimates as Deal Delays Cloud Near-Term Outlook, RBC Says",16.29,14.67,1187662464.0,120.878,42.31,15.03,55.98,IGNORE
NOW,https://www.tradingview.com/chart/?symbol=NOW,"ServiceNow, Inc.",Technology,93.77,96705748992,22.1,2.3,-9.72,-3.8,46.71,102.34,147.96,False,False,False,NO CLEAR ENTRY,False,59.98,NEUTRAL,5,"Snowflake Is Up 9% Today: Is It Outperforming Other Cloud Stocks Like ServiceNow? | Despite The Downturn, ServiceNow (NOW) Is Still One Of The Best Cloud Computing Companies To Buy | ServiceNow, Accenture partner to deliver agentic AI at enterprise scale",55.82,18.71,5108125184.0,20.728,16.07,12.59,55.95,IGNORE
TJX,https://www.tradingview.com/chart/?symbol=TJX,"The TJX Companies, Inc.",Consumer Cyclical,154.35,170682433536,8.5,27.9,-0.93,-4.51,19.48,158.22,148.18,False,True,True,NO CLEAR ENTRY,False,59.29,NEUTRAL,5,"Investors Heavily Search The TJX Companies, Inc. (TJX): Here is What You Need to Know | A Look At TJX Companies (TJX) Valuation After Earnings Beat And Cautious Growth Guidance | 3 Dividend Stocks That Have Announced Double-Digit Increases to Their Payouts This Year",31.69,27.23,3892000000.0,132.375,59.13,9.1,55.74,IGNORE
CCEP,https://www.tradingview.com/chart/?symbol=CCEP,Coca-Cola Europacific Partners PLC,Consumer Defensive,94.04,41638756352,0.2,68.3,-2.7,-3.47,37.18,97.16,92.56,False,True,True,NO CLEAR ENTRY,False,60.89,POSITIVE,5,"Coca-Cola Europacific Partners Updates ESG Plan, Adds Philippines and Six 2030 Sustainability Targets | Coca-Cola Europacific Partners Q1 Earnings Call Highlights | How The Coca-Cola Europacific Partners (ENXTAM:CCEP) Investment Story Is Shifting With New Analyst Targets",18.85,16.44,1747874944.0,130.001,22.89,9.29,55.72,IGNORE
OTIS,https://www.tradingview.com/chart/?symbol=OTIS,Otis Worldwide Corporation,Industrials,78.3175,30051682304,6.4,42.6,-11.9,-1.55,39.11,81.21,86.61,False,False,False,NO CLEAR ENTRY,False,57.39,NEUTRAL,5,"2 Cash-Producing Stocks Worth Investigating and 1 We Find Risky | 3 Reasons to Sell OTIS and 1 Stock to Buy Instead | Generac Tops Q1 Earnings Estimates, Lifts 2026 Revenue Outlook",20.83,16.6,1682125056.0,,,10.11,55.69,IGNORE
CEG,https://www.tradingview.com/chart/?symbol=CEG,Constellation Energy Corporation,Utilities,315.195,114193465344,12.9,-48.9,15.97,10.88,57.97,302.36,326.61,True,False,False,NO CLEAR ENTRY,False,60.45,POSITIVE,5,"Oklo Advances 12% on NRC Aurora Approval: Is This the AI Infrastructure Nuclear Play? | This Boring Utility ETF Just Became a Stealth AI Play, and It’s Up 20% | AI Data Center Power Deals and Nuclear Expansion Could Be A Game Changer For Constellation Energy (CEG)",42.65,23.2,1258000000.0,63.94,16.36,9.08,55.64,IGNORE
REGN,https://www.tradingview.com/chart/?symbol=REGN,"Regeneron Pharmaceuticals, Inc.",Healthcare,711.42,74584580096,19.0,-7.2,-8.72,-8.27,38.66,750.01,685.89,False,True,True,BUY THE DIP,False,53.85,NEUTRAL,5,"Trump’s Affordability Push Stalls Ahead of Midterm Elections | RARE Q1 Loss Wider Than Expected, Sales Down Y/Y on Seasonal Effect | Regeneron (REGN) Dupixent Phase 4 Trial Results Show Improved Esophageal Function in EoE",17.37,13.22,3273349888.0,8.612,14.55,29.65,55.61,IGNORE
CMI,https://www.tradingview.com/chart/?symbol=CMI,Cummins Inc.,Industrials,693.86,95745097728,2.7,-21.0,15.77,16.29,68.25,590.68,499.01,True,True,True,BULLISH TREND,False,56.32,NEUTRAL,5,"Cummins Inc. (CMI) Soars to 52-Week High, Time to Cash Out? | How The Cummins (CMI) Investment Story Is Shifting As Analysts Rework Targets And Assumptions | Bet on These 5 Dividend Growth Stocks Amid Falling Oil Prices",36.04,21.06,1688625024.0,61.621,21.99,7.89,55.61,IGNORE
IDXX,https://www.tradingview.com/chart/?symbol=IDXX,"IDEXX Laboratories, Inc.",Healthcare,571.53,45084004352,14.3,17.2,-10.67,-3.43,42.89,583.73,642.17,False,False,False,NO CLEAR ENTRY,False,50.0,NEUTRAL,5,"How Fluffy's Testing Service Outplayed Slow Vet Visits — Again | IDEXX Laboratories Q1 Earnings Call Highlights | IDEXX Laboratories, Inc. Q1 2026 Earnings Call Summary",41.99,34.65,786844480.0,71.04,72.91,24.63,55.6,IGNORE
NOC,https://www.tradingview.com/chart/?symbol=NOC,Northrop Grumman Corporation,Industrials,550.6,78203625472,4.4,84.9,-20.87,-19.91,7.91,672.54,618.29,False,False,True,NO CLEAR ENTRY,False,59.2,NEUTRAL,5,Why Palantir Stock Popped Today | Howmet's Q1 Earnings Beat Estimates on Commercial Aerospace Growth | A Look At Northrop Grumman (NOC) Valuation After Recent Share Price Weakness,17.26,18.22,2071624960.0,102.682,28.51,10.8,55.59,IGNORE
PNC,https://www.tradingview.com/chart/?symbol=PNC,"The PNC Financial Services Group, Inc.",Financial Services,219.9,88304058368,13.8,17.7,-8.04,0.38,42.26,212.89,202.6,True,True,True,BULLISH TREND,False,59.65,NEUTRAL,5,"The PNC Financial Services Group, Inc (PNC) Could Be a Great Choice | Qfin Holdings And 2 Other Dividend Stocks To Enhance Your Portfolio | A Look At PNC Financial Services Group’s Valuation Relative To Its Recent Shareholder Returns",12.77,10.47,,,12.1,31.31,55.57,IGNORE
AKAM,https://www.tradingview.com/chart/?symbol=AKAM,"Akamai Technologies, Inc.",Technology,111.765,16454382592,7.4,-37.4,18.0,-3.65,68.47,105.19,89.08,True,True,True,BULLISH TREND,False,64.03,POSITIVE,5,"Unlocking Q1 Potential of Akamai Technologies (AKAM): Exploring Wall Street Estimates for Key Metrics | Should You Buy, Sell, or Hold FSLY Stock Before Q1 Earnings Release? | Can Healthy Top-Line Growth Boost Q1 Earnings of Akamai?",36.41,14.7,578661888.0,114.024,9.17,10.74,55.47,IGNORE
KVUE,https://www.tradingview.com/chart/?symbol=KVUE,Kenvue Inc.,Consumer Defensive,17.7613,34100207616,3.2,11.2,-1.18,2.43,53.52,17.62,17.6,True,True,True,BULLISH TREND,False,57.72,NEUTRAL,5,"Kenvue (KVUE) Q1 Earnings and Revenues Beat Estimates | $100,000 in Our Dividend Kings Portfolio Will Generate $5,400 in Passive Income Each Year | Kenvue beats first-quarter estimates amid pending acquisition by Kimberly-Clark",23.37,14.81,1807874944.0,80.576,14.39,9.72,55.47,IGNORE
HPE,https://www.tradingview.com/chart/?symbol=HPE,Hewlett Packard Enterprise Company,Technology,29.52,39168733184,18.4,-30.3,24.26,18.17,68.83,24.65,23.1,True,True,True,BULLISH TREND,False,61.24,POSITIVE,5,"Hewlett Packard (HPE) Expands ProLiant Edge Portfolio for AI Inferencing, Rugged Workloads | Stock Market Today, May 6: Super Micro Computer Surges After Earnings Beat and Strong AI Data Center Demand | Should QCOM Stock Be Part of Your Portfolio Post Modest Q2 Earnings?",,10.86,2551500032.0,87.223,-0.47,-0.33,55.35,IGNORE
JPM,https://www.tradingview.com/chart/?symbol=JPM,JPMorgan Chase & Co.,Financial Services,308.69,827138375680,12.7,17.2,-3.67,0.23,48.19,299.39,302.72,True,True,False,BULLISH TREND,False,44.23,NEUTRAL,5,Citi's new profit target underwhelms at bank's investor day | JPMorgan Weighs Tokenized Treasury Pilot Against Sanctions Lawsuit Risks | It Takes Meta Almost 9 Minutes to Make $1 Million in Profits. Google Does It in Under 4,14.78,13.12,,,16.47,33.94,55.34,IGNORE
EMR,https://www.tradingview.com/chart/?symbol=EMR,Emerson Electric Co.,Industrials,143.175,80192315392,2.9,27.9,-10.18,0.36,45.72,138.39,137.03,True,True,True,BULLISH TREND,False,53.43,NEUTRAL,5,"Earnings Update: Emerson Electric Co. (NYSE:EMR) Just Reported Its Second-Quarter Results And Analysts Are Updating Their Forecasts | Emerson Electric Growth Verticals, Backlog to Support Outlook, RBC Says | Emerson Q2 Earnings in Line, Sales Miss on Middle East Disruptions",33.14,20.01,3272250112.0,69.182,12.33,13.35,55.32,IGNORE
TT,https://www.tradingview.com/chart/?symbol=TT,Trane Technologies plc,Industrials,471.34,104192286720,6.0,-2.1,2.76,4.87,46.91,449.82,425.72,True,True,True,BULLISH TREND,False,54.02,NEUTRAL,5,Is Palantir Technologies a Buy After Its Explosive Q1 2026 Earnings? | Trane Technologies Q1 Earnings Call Highlights | TT Q1 Deep Dive: Data Center Momentum and Record Backlog Support Upbeat Outlook,36.04,27.71,2662362624.0,53.597,36.63,13.41,55.27,IGNORE
MCO,https://www.tradingview.com/chart/?symbol=MCO,Moody's Corporation,Financial Services,454.22,79341527040,8.1,7.8,1.28,1.47,49.19,448.47,481.34,True,False,False,NO CLEAR ENTRY,False,54.27,NEUTRAL,5,Hybrid Bond Sales At Record as Companies Pounce on Low Costs | Moody's sees South Africa debt stabilizing as reforms boost outlook | FUTU vs. MCO: Which Stock Is the Better Value Option?,32.56,24.46,2266125056.0,235.539,71.36,31.69,55.24,IGNORE
SNPS,https://www.tradingview.com/chart/?symbol=SNPS,"Synopsys, Inc.",Technology,510.7201,97834582016,65.5,-82.0,16.36,24.52,71.66,437.22,477.66,True,True,False,WATCH - OVERBOUGHT,False,54.77,NEUTRAL,5,"How The Synopsys (SNPS) Story Is Shifting Through The Ansys Integration And Transition Year | Synopsys, Inc. (SNPS) is Attracting Investor Attention: Here is What You Should Know | Atomera Q1 Earnings Call Highlights",78.45,29.96,3096222464.0,35.579,5.54,13.76,55.03,IGNORE
PEP,https://www.tradingview.com/chart/?symbol=PEP,"PepsiCo, Inc.",Consumer Defensive,156.563,214012379136,8.5,27.8,-5.11,1.14,47.18,156.79,148.29,False,True,True,NO CLEAR ENTRY,False,40.96,NEUTRAL,5,"PepsiCo Stock Rises 9.4% in 6 Months: Buy Now or Stay Focused? | Coke Keeps Beating Pepsi. Warren Buffett’s Bet Has Paid Off. | PepsiCo AGM: Shareholders Re-Elect 13 Directors, Back Pay, Reject Governance & ESG Proposals",24.62,17.11,8746250240.0,244.837,43.88,9.15,54.98,IGNORE
ADM,https://www.tradingview.com/chart/?symbol=ADM,Archer-Daniels-Midland Company,Consumer Defensive,77.92,37554049024,1.6,0.9,16.57,8.64,84.39,70.94,63.12,True,True,True,WATCH - OVERBOUGHT,False,59.15,NEUTRAL,5,"Stock Market News for May 6, 2026 | Archer Daniels Midland Q1 Earnings Call Highlights | Archer-Daniels-Midland Company Q1 2026 Earnings Call Summary",34.79,15.01,1578499968.0,46.128,4.77,1.34,54.88,IGNORE
CTSH,https://www.tradingview.com/chart/?symbol=CTSH,Cognizant Technology Solutions Corporation,Technology,52.17,24676409344,5.8,3.6,-29.71,-14.48,12.61,59.85,70.14,False,False,False,NO CLEAR ENTRY,False,57.16,NEUTRAL,5,"Cognizant weighs up to 15,000 job cuts, most in India | CrowdStrike Gartner Leader Status And QuiltWorks Expansion Deepen AI Security Role | A Look At Cognizant Technology Solutions (CTSH) Valuation After Its Q1 Earnings Beat And Expanded AI Partnerships",11.32,8.47,1908875008.0,7.247,14.88,10.41,54.87,IGNORE
TTD,https://www.tradingview.com/chart/?symbol=TTD,"The Trade Desk, Inc.",Communication Services,24.19,11511504896,14.3,7.5,-10.56,19.43,58.58,23.77,40.46,True,False,False,NO CLEAR ENTRY,False,49.59,NEUTRAL,5,Saga Partners’ Analysis on The Trade Desk (TTD) | How New Commerce Media Integrations and DramaBox Partnership Could Shape Trade Desk’s (TTD) Omnichannel Edge | Wedbush upgrades The Trade Desk to ‘Neutral’ amid mixed growth outlook,26.87,10.12,601545856.0,17.563,16.32,15.31,54.87,IGNORE
SCHW,https://www.tradingview.com/chart/?symbol=SCHW,The Charles Schwab Corporation,Financial Services,89.5,156822831104,15.8,38.6,-16.24,-7.45,39.0,93.63,95.42,False,False,False,NO CLEAR ENTRY,False,49.59,NEUTRAL,5,"Dividends vs. the 4% Rule: What Happens to a $500,000 Portfolio Over 20 Years | Charles Schwab Adds Generative AI Tool As SCHW Valuation Draws Attention | Comfort Systems USA and Builders FirstSource have been highlighted as Zacks Bull and Bear of the Day",17.79,12.81,,67.073,19.09,37.99,54.82,IGNORE
DDOG,https://www.tradingview.com/chart/?symbol=DDOG,"Datadog, Inc.",Technology,181.305,64534097920,29.2,-3.3,59.03,55.63,86.02,125.39,138.27,True,True,False,WATCH - OVERBOUGHT,False,62.54,POSITIVE,5,"Stock Market Today: Nasdaq Tops 26,000, Then Falls; Arm Tanks 10% As Datadog, Fortinet Lead Upside (Live Coverage) | Top Midday Stories: Citi CEO Fraser Gives New ROTCE Targets; Datadog Shares Soar After Strong Earnings, Bullish Guidance | 3 Stocks up 30% Today: HiMax, Fluence, DataDog All Soar",566.58,68.61,879646720.0,34.269,3.34,3.14,54.75,IGNORE
VZ,https://www.tradingview.com/chart/?symbol=VZ,Verizon Communications Inc.,Communication Services,47.435,198088572928,2.9,4.3,2.4,0.23,56.79,48.31,42.73,False,True,True,NO CLEAR ENTRY,False,42.95,NEUTRAL,5,"Hybrid Bond Sales At Record as Companies Pounce on Low Costs | Dividends vs. the 4% Rule: What Happens to a $500,000 Portfolio Over 20 Years | Verizon Communications (VZ) Surged from Excellent Execution",11.57,8.99,19608500224.0,192.045,17.2,12.46,54.74,IGNORE
ACGL,https://www.tradingview.com/chart/?symbol=ACGL,Arch Capital Group Ltd.,Financial Services,94.54,33031292928,-3.3,94.6,-1.58,-4.12,40.28,95.94,93.02,False,True,True,NO CLEAR ENTRY,False,57.84,NEUTRAL,5,Here is What to Know Beyond Why Arch Capital Group Ltd. (ACGL) is a Trending Stock | What Makes Arch Capital Group Ltd. (ACGL) a Resilient Stock? | How Strong Q1 Results and Bigger Buyback Plan Could Impact Arch Capital Group (ACGL) Investors,7.27,9.47,5276125184.0,11.282,21.31,24.64,54.68,IGNORE
AMP,https://www.tradingview.com/chart/?symbol=AMP,"Ameriprise Financial, Inc.",Financial Services,460.1575,41460191232,9.0,66.0,-14.33,1.93,53.75,454.35,478.84,True,False,False,NO CLEAR ENTRY,False,49.39,NEUTRAL,5,"Judge Halts Review of Advisors' Devices in LPL/Ameriprise Dispute | Zacks Industry Outlook Highlights BlackRock, Ameriprise and SEI Investments | 3 Investment Management Stocks to Watch Despite Industry Woes",11.47,9.67,,52.785,66.94,20.17,54.5,IGNORE
VMC,https://www.tradingview.com/chart/?symbol=VMC,Vulcan Materials Company,Basic Materials,291.44,37815762944,7.4,29.7,-10.79,-0.39,49.72,283.23,291.68,True,False,False,NO CLEAR ENTRY,False,52.02,NEUTRAL,5,"Jacobs Q2 Earnings & Revenues Top Estimates, Up Y/Y, FY26 View Raised | Sterling Q1 Earnings & Revenues Beat Estimates, Rise Y/Y | 3 High-Flying Stocks to Target This Week",34.57,26.88,239012496.0,61.249,13.46,13.81,54.41,IGNORE
EW,https://www.tradingview.com/chart/?symbol=EW,Edwards Lifesciences Corporation,Healthcare,83.115,47919263744,16.7,8.2,8.22,1.72,56.12,82.22,81.19,True,True,True,BULLISH TREND,False,52.02,NEUTRAL,5,"Edwards names Theodora Mistras as CFO | Possible Bearish Signals With Edwards Lifesciences Insiders Disposing Stock | Top Research Reports for Philip Morris, Honeywell & Starbucks",44.93,24.71,,6.824,,17.39,54.41,IGNORE
PCG,https://www.tradingview.com/chart/?symbol=PCG,PG&E Corporation,Utilities,16.105,35466825728,15.0,39.8,-1.22,-12.43,24.84,17.56,16.11,False,False,True,NO CLEAR ENTRY,False,66.08,POSITIVE,5,"Evergy's Q1 Earnings Beat Estimates, Revenues Increase Y/Y | NRG Energy Q1 Earnings Lag Estimates, Revenues Increase Y/Y | 4 Value Stocks to Buy Now as Earnings Fuel Market Rally",12.48,8.94,-5572125184.0,187.872,8.83,11.01,54.34,IGNORE
IBM,https://www.tradingview.com/chart/?symbol=IBM,International Business Machines Corporation,Technology,229.22,215440506880,9.5,14.2,-22.21,-5.18,28.95,242.5,269.9,False,False,False,NO CLEAR ENTRY,False,62.74,POSITIVE,5,Billion-Dollar Company With One Employee? How Agentic AI Is Changing Who Gets Hired | The Next Phase of the AI Boom Could Be Even Kinder to the Pick-and-Shovel Plays | Quantum Motion raises $160 million to build quantum computers from standard silicon transistors,20.27,17.04,13080750080.0,211.169,35.77,15.61,54.32,IGNORE
FOX,https://www.tradingview.com/chart/?symbol=FOX,Fox Corporation,Communication Services,56.71,24124211200,2.0,-35.8,0.47,4.09,38.74,54.5,56.38,True,True,False,BULLISH TREND,False,55.39,NEUTRAL,5,"FOXA Gears Up to Report Q3 Earnings: What's in Store for the Stock? | James Murdoch Eyes $300 Million Vox Media Asset Deal | Electronic Arts Q4 Earnings Miss Estimates, Revenues Increase Y/Y",13.6,11.41,1765500032.0,67.389,16.82,11.41,54.28,IGNORE
PH,https://www.tradingview.com/chart/?symbol=PH,Parker-Hannifin Corporation,Industrials,893.215,112622256128,10.6,-4.2,-8.75,-7.54,28.35,937.3,854.11,False,True,True,BUY THE DIP,False,58.18,NEUTRAL,5,"As American Water Works Hikes Its Dividend, Consider Buying AWK Stock in May | 3 Market-Beating Stocks Worth Your Attention | Parker-Hannifin Corporation (NYSE:PH) Looks Interesting, And It's About To Pay A Dividend",32.98,26.23,2774481920.0,65.554,24.84,16.58,54.25,IGNORE
BBY,https://www.tradingview.com/chart/?symbol=BBY,"Best Buy Co., Inc.",Consumer Cyclical,58.1801,12258267136,-1.0,372.5,-11.95,-9.77,26.88,62.46,68.62,False,False,False,NO CLEAR ENTRY,False,78.61,POSITIVE,5,Samsung market cap crosses $1 trillion amid memory chip rally | Ahold Delhaize & Uber Eats Expand Partnership: Upside Ahead? | How Investors Are Reacting To Best Buy (BBY) Tweaking Membership Fees And Rewards To Boost Loyalty,11.54,8.3,842499968.0,139.474,37.04,2.56,54.09,IGNORE
DAL,https://www.tradingview.com/chart/?symbol=DAL,"Delta Air Lines, Inc.",Industrials,73.22,48105127936,12.9,,-2.11,7.55,55.45,66.36,63.53,True,True,True,BULLISH TREND,False,51.9,NEUTRAL,5,Summer airfares set to surge as jet fuel shortage grips market | Herc Holdings Stock Rises 1.5% Since Q1 Earnings Release | UBS Just Hiked Delta Air Lines Price Target to $95: Premium Cabin Strategy Targets $13 EPS,10.69,9.16,3093374976.0,105.021,24.99,6.87,54.0,IGNORE
PG,https://www.tradingview.com/chart/?symbol=PG,The Procter & Gamble Company,Consumer Defensive,147.04,342397190144,7.4,5.8,-5.84,2.24,52.4,147.22,148.39,False,False,False,NO CLEAR ENTRY,False,57.91,NEUTRAL,5,Want Passive Income for Life? Buy These 3 Dividend Stocks Now. | Did Amazon Just Give This Logisitcs Stock a No-Brainer Buying Opportunity? | Amazon Opens Logistics Network To Clients What It Means For Investors,21.53,20.74,12733750272.0,67.651,31.11,19.16,53.98,IGNORE
STE,https://www.tradingview.com/chart/?symbol=STE,STERIS plc,Healthcare,214.145,21017692160,9.2,12.1,-12.51,-4.84,33.24,223.44,242.36,False,False,False,NO CLEAR ENTRY,False,60.19,POSITIVE,5,"NeuroPace (NPCE) Moves 6.3% Higher: Will This Strength Last? | Veracyte (VCYT) Beats Q1 Earnings and Revenue Estimates | STERIS (STE): Buy, Sell, or Hold Post Q4 Earnings?",29.91,19.33,870695744.0,28.651,10.47,12.14,53.92,IGNORE
COO,https://www.tradingview.com/chart/?symbol=COO,"The Cooper Companies, Inc.",Healthcare,60.98,11898076160,6.2,26.9,-25.16,-14.99,12.79,70.59,73.95,False,False,False,NO CLEAR ENTRY,False,45.6,NEUTRAL,5,Dentsply International (XRAY) Lags Q1 Earnings Estimates | 1 Cash-Producing Stock for Long-Term Investors and 2 We Turn Down | Assessing Cooper Companies (COO) Valuation After Activist Pressure And Business Review Shake Up,30.34,12.15,367087488.0,33.201,4.87,9.67,53.9,IGNORE
DGX,https://www.tradingview.com/chart/?symbol=DGX,Quest Diagnostics Incorporated,Healthcare,189.42,20968118272,9.2,15.5,-0.52,-4.72,42.37,197.32,185.42,False,True,True,NO CLEAR ENTRY,False,47.68,NEUTRAL,5,"2 Things Matter Most in Picking Winning Stocks, Says This Market Pro | Quest Diagnostics Debt Raise And ctDNA Alliance Spark Valuation Questions | 5 Must-Read Analyst Questions From Quest’s Q1 Earnings Call",20.91,16.23,947875008.0,82.737,14.54,9.08,53.86,IGNORE
BLK,https://www.tradingview.com/chart/?symbol=BLK,"BlackRock, Inc.",Financial Services,1064.27,165350277120,27.0,45.9,-0.9,6.26,53.97,1007.1,1072.93,True,False,False,NO CLEAR ENTRY,False,55.7,NEUTRAL,5,"BlackRock (BLK) Valuation Check As New Aladdin Private Credit Features With Preqin Draw Focus | Zacks Industry Outlook Highlights BlackRock, Ameriprise and SEI Investments | BlackRock Fund Faces Test in Recovering Defaulted China Loan",26.79,17.55,,24.367,,24.4,53.86,IGNORE
AEP,https://www.tradingview.com/chart/?symbol=AEP,"American Electric Power Company, Inc.",Utilities,132.35,72012292096,10.2,6.7,10.15,-1.75,46.73,132.84,119.49,False,True,True,NO CLEAR ENTRY,False,48.2,NEUTRAL,5,"How Investors Are Reacting To American Electric Power (AEP) Data Center Demand And US$78 Billion Grid Plan | Biggest US Grid Must Redesign to Cope With AI Boom, CEO Says | Company News for May 6, 2026",19.58,19.22,-6953449984.0,157.099,12.58,16.29,53.76,IGNORE
OMC,https://www.tradingview.com/chart/?symbol=OMC,Omnicom Group Inc.,Communication Services,76.94,21928378368,69.2,-6.9,9.83,0.09,39.64,77.85,75.68,False,True,True,NO CLEAR ENTRY,False,58.89,NEUTRAL,5,Omnicom Group's (NYSE:OMC) Soft Earnings Are Actually Better Than They Appear | OpenAI opens ChatGPT self-serve ad platform to U.S. businesses | How The Omnicom Group (OMC) Investment Story Is Shifting As Analyst Targets Diverge,,6.15,5066650112.0,110.574,2.02,0.32,53.76,IGNORE
TRGP,https://www.tradingview.com/chart/?symbol=TRGP,Targa Resources Corp.,Energy,253.93,54582706176,-7.9,74.5,17.23,4.59,66.45,241.8,190.56,True,True,True,BULLISH TREND,False,51.28,NEUTRAL,5,Watch These 4 Energy Stocks for Q1 Earnings: Beat or Miss? | Seeking Clues to Targa Resources (TRGP) Q1 Earnings? A Peek Into Wall Street Projections for Key Metrics | What's in Store for Permian Resources Stock in Q1 Earnings?,29.94,21.77,-264400000.0,548.63,51.38,11.29,53.7,IGNORE
EVRG,https://www.tradingview.com/chart/?symbol=EVRG,"Evergy, Inc.",Utilities,82.77,19060617216,6.6,4.7,8.19,-0.8,51.66,81.94,75.83,True,True,True,BULLISH TREND,False,50.92,NEUTRAL,5,"Evergy (EVRG) Q1 2026 Earnings Transcript | Evergy's Q1 Earnings Beat Estimates, Revenues Increase Y/Y | Evergy Inc (EVRG) Surpasses Q1 Earnings and Revenue Estimates",22.61,18.23,-862124992.0,149.917,8.57,14.35,53.52,IGNORE
