BA,https://www.tradingview.com/chart/?symbol=BA,The Boeing Company,Industrials,231.3654,182385885184,14.0,,-5.45,6.23,57.21,217.08,219.59,True,True,False,BULLISH TREND,False,64.96,POSITIVE,5,Why Palantir Stock Popped Today | Airbus Lands $19 Bil Order; Boeing Wins Air Force One Contract | Howmet's Q1 Earnings Beat Estimates on Commercial Aerospace Growth,91.45,53.95,2554249984.0,828.696,169.95,2.46,44.4,IGNORE
PM,https://www.tradingview.com/chart/?symbol=PM,Philip Morris International Inc.,Consumer Defensive,170.4,265578414080,9.1,-9.3,-5.45,5.88,64.05,165.96,161.75,True,True,True,BULLISH TREND,False,55.92,NEUTRAL,5,Philip Morris Stock: Is Wall Street Bullish or Bearish? | Want Passive Income For Life? 2 Dividend Stocks to Buy and Never Sell | Vaping industry shares jump as Trump reportedly demands FDA approve flavored vapes,23.97,18.63,8575249920.0,,,26.74,44.37,IGNORE
BXP,https://www.tradingview.com/chart/?symbol=BXP,"BXP, Inc.",Real Estate,59.98,10619198464,5.6,65.5,-6.47,14.16,59.15,54.71,64.46,True,False,False,NO CLEAR ENTRY,False,63.38,POSITIVE,5,"Healthpeak Properties Q1 FFOA Tops Estimates on Steady Leasing Momentum | VNO Q1 FFO Meets Estimates, Revenues Top, Same-Store NOI Grows | CUZ Q1 FFO Beats Estimates on Strong Leasing, Revenues Top",30.14,28.77,,211.944,5.53,9.92,44.22,IGNORE
CL,https://www.tradingview.com/chart/?symbol=CL,Colgate-Palmolive Company,Consumer Defensive,87.69,70168600576,8.4,-5.9,-6.29,3.14,56.93,86.84,82.9,True,True,True,BULLISH TREND,False,44.04,NEUTRAL,5,Stronger Q1 Sales and Steady Outlook Might Change The Case For Investing In Colgate-Palmolive (CL) | 7 reasons why the Hormuz shock hasn’t tipped the world into recession: BCA | Barclays’ Cau warns upside in stocks is limited unless energy risks fade,33.99,21.66,3319500032.0,1640.535,363.58,10.04,44.22,IGNORE
IT,https://www.tradingview.com/chart/?symbol=IT,"Gartner, Inc.",Technology,156.9,10504751104,-1.5,17.3,-1.78,5.02,53.33,155.93,217.79,True,False,False,NO CLEAR ENTRY,False,61.19,POSITIVE,5,"Gartner Needs to Deliver Contract Value Growth to Alleviate Concerns on Generative AI Disintermediation, RBC Says | CAR Q1 Earnings Miss on Higher Fleet Charges, Revenues Beat | The next phase of AI spending is already underway",15.5,10.26,1064192896.0,5293.41,94.88,11.44,44.2,IGNORE
ALLE,https://www.tradingview.com/chart/?symbol=ALLE,Allegion plc,Industrials,135.67,11658918912,9.7,-7.0,-23.47,-6.1,35.45,145.01,161.53,False,False,False,NO CLEAR ENTRY,False,55.92,NEUTRAL,5,"2 of Wall Street’s Favorite Stocks for Long-Term Investors and 1 We Avoid | Stock Market Today, May 4: ADT Falls as Apollo Exits Stake Through 102 Million-Share Offering | Allegion plc Earnings Missed Analyst Estimates: Here's What Analysts Are Forecasting Now",18.53,14.21,494362496.0,105.863,34.18,15.24,44.07,IGNORE
HBAN,https://www.tradingview.com/chart/?symbol=HBAN,Huntington Bancshares Incorporated,Financial Services,16.255,32951007232,33.6,-26.5,-13.58,-0.58,40.69,16.12,16.55,True,False,False,NO CLEAR ENTRY,False,56.07,NEUTRAL,5,Top Dividend Stocks To Consider In May 2026 | 3 Dividend Stocks Yielding Over 3.2% To Enhance Your Portfolio | Qfin Holdings And 2 Other Dividend Stocks To Enhance Your Portfolio,12.5,8.55,,,8.39,26.6,44.04,IGNORE
MSTR,https://www.tradingview.com/chart/?symbol=MSTR,Strategy Inc,Technology,177.97,62358347776,11.9,,28.55,38.71,56.71,146.28,224.58,True,False,False,NO CLEAR ENTRY,False,50.0,NEUTRAL,5,Strategy Inc (MSTR) Announces Financial Results for Q1 2026 | Canaccord Hikes Strategy Price Target to $224 as Bitcoin Roars Back Above $80K | TD Cowen Lifts Strategy Price Target to $395 on STRC Funding Shift,,4.89,,18.094,-30.76,0.0,44.0,IGNORE
XYZ,https://www.tradingview.com/chart/?symbol=XYZ,"Block, Inc.",Technology,70.89,42226008064,3.6,-93.9,24.85,12.83,48.81,64.65,68.13,True,True,False,BULLISH TREND,False,43.46,NEUTRAL,5,NCR Voyix Q1 Sees EPS Improvement on Strong Customer Engagement | Analyst predicts 35% upside for Dorsey's Block ahead of earnings | AI Layoffs Hit Crypto And Payments As Block Cuts 50%,33.76,14.75,-1034290624.0,40.444,6.01,5.4,43.83,IGNORE
LYB,https://www.tradingview.com/chart/?symbol=LYB,LyondellBasell Industries N.V.,Basic Materials,72.12,23279239168,-6.3,-29.5,31.59,-2.83,63.67,71.95,54.24,True,True,True,BULLISH TREND,False,87.73,POSITIVE,5,"Is LyondellBasell (LYB) the Best European Stock That Beat Earnings Estimates to Buy? | LyondellBasell Set to Benefit From Rising Polyethylene, Polypropylene Prices in Q2, RBC Says | Best Income Stocks to Buy for May 4th",,9.76,987000000.0,141.24,-6.01,-2.69,43.82,IGNORE
DLTR,https://www.tradingview.com/chart/?symbol=DLTR,"Dollar Tree, Inc.",Consumer Defensive,97.14,18915627008,9.0,,-21.13,-8.03,32.52,106.75,110.95,False,False,False,NO CLEAR ENTRY,False,52.19,NEUTRAL,5,How Dollar Tree’s NASCAR Dollar Tree 301 Deal and Fan Promotions Could Shape Dollar Tree (DLTR) Investors | How The Dollar Tree (DLTR) Story Is Shifting As Analysts Split On Traffic And Valuation | Dollar Tree Hits 5-Month Lows: Why Analysts Still See 27% Upside,16.35,13.14,1284562560.0,187.904,31.69,6.61,43.78,IGNORE
ON,https://www.tradingview.com/chart/?symbol=ON,ON Semiconductor Corporation,Technology,101.07,39609655296,4.7,,55.25,47.81,72.78,73.2,59.01,True,True,True,WATCH - OVERBOUGHT,False,61.94,POSITIVE,5,"Can ON Sustain Its AI-Driven Revenue Rebound Through 2026? | ON Semi (ON) Expands Partnership With Geely, B. Riley Upgrades to Buy | Power Integrations (POWI) Names Michael Balow SVP of Worldwide Sales",74.32,23.7,1418674944.0,44.337,7.49,9.46,43.71,IGNORE
CRH,https://www.tradingview.com/chart/?symbol=CRH,CRH plc,Basic Materials,113.005,75509964800,9.1,,-10.59,-0.72,43.04,110.53,115.17,True,False,False,NO CLEAR ENTRY,False,46.82,NEUTRAL,5,"Construction Partners to Report Q2 Earnings: What to Expect? | How Investors Are Reacting To CRH (CRH) Q1 Loss, Reaffirmed 2026 Guidance, And Portfolio Shake-Up | CRH (CRH) Q1 2026 Earnings Call Transcript",20.97,16.93,786124992.0,83.227,15.81,9.64,43.6,IGNORE
MRSH,https://www.tradingview.com/chart/?symbol=MRSH,"Marsh & McLennan Companies, Inc.",Financial Services,167.005,80462094336,7.6,-15.4,-1.91,-4.52,34.66,173.86,185.15,False,False,False,NO CLEAR ENTRY,False,58.96,NEUTRAL,5,"Global Payments Q1 Earnings Beat Estimates on Worldpay Momentum | How The Investment Story For Marsh And McLennan Companies (MRSH) Is Quietly Being Rewritten | Arthur J. Gallagher Q1 Earnings Beat, Commissions and Fees Rise Y/Y",20.88,14.76,4965374976.0,151.634,27.57,14.26,43.57,IGNORE
HOOD,https://www.tradingview.com/chart/?symbol=HOOD,"Robinhood Markets, Inc.",Financial Services,76.29,68699533312,15.1,2.7,-11.86,6.21,30.75,76.52,106.02,False,False,False,NO CLEAR ENTRY,False,48.07,NEUTRAL,5,"Coinbase to face earnings test after job cuts announcement, rough crypto market stretch | Robinhood Is Down 30% in 2026 While Interactive Brokers Is Up 35%: Here’s Why | Robinhood Faces Cheaper Crypto Rival As Retail Venture Fund Expands Access",37.03,29.83,,140.483,21.46,41.12,43.5,IGNORE
ABT,https://www.tradingview.com/chart/?symbol=ABT,Abbott Laboratories,Healthcare,87.35,152147378176,7.8,-19.7,-20.86,-15.12,24.54,101.45,118.56,False,False,False,NO CLEAR ENTRY,False,57.75,NEUTRAL,5,"Abbott Cardiac Data Sheds Light On Heart Rhythm Pipeline And Earnings Story | Got $5,000? These 3 High-Yielding Stocks Are Trading Near Their 52-Week Lows | Abbott Stock Is Trading at 52-Week Lows but Insiders Are Gobbling Up Shares of This Blue-Chip Dividend Payer",24.47,14.4,6341125120.0,64.773,12.33,13.9,43.47,IGNORE
MGM,https://www.tradingview.com/chart/?symbol=MGM,MGM Resorts International,Consumer Cyclical,38.065,9738977280,4.2,-5.9,0.01,2.6,45.78,37.4,35.62,True,True,True,BULLISH TREND,False,58.83,NEUTRAL,5,MGM Resorts Stock: Is Wall Street Bullish or Bearish? | IAC InterActive Corp. Q1 2026 Earnings Call Summary | How The MGM Resorts International (MGM) Investment Narrative Is Shifting With Mixed Analyst Signals,52.14,16.48,528360256.0,951.186,13.49,1.03,43.16,IGNORE
SWKS,https://www.tradingview.com/chart/?symbol=SWKS,"Skyworks Solutions, Inc.",Technology,65.32,9824518144,-1.0,-44.9,7.4,15.53,60.57,58.28,65.19,True,True,False,BULLISH TREND,False,58.89,NEUTRAL,5,"Skyworks Solutions, Inc. Just Beat EPS By 6.2%: Here's What Analysts Think Will Happen Next | Nvidia Shares Are Having a Great Day. It’s Still One of the Year’s Worst in Chip Stocks. | Semi Stocks Are Flying. Why Skyworks Solutions Is Getting Crushed.",27.22,12.7,687837504.0,20.632,6.17,8.93,43.16,IGNORE
XEL,https://www.tradingview.com/chart/?symbol=XEL,Xcel Energy Inc.,Utilities,79.99,49935323136,2.9,6.0,5.43,-1.8,45.91,80.42,76.71,False,True,True,NO CLEAR ENTRY,False,65.33,POSITIVE,5,Xcel Energy's (NASDAQ:XEL) Profits May Not Reveal Underlying Issues | Xcel Energy: Google deal sets template for large load tariff strategy | The Xcel Energy Inc. (NASDAQ:XEL) First-Quarter Results Are Out And Analysts Have Published New Forecasts,23.05,17.66,-7471625216.0,164.845,9.59,14.14,43.08,IGNORE
A,https://www.tradingview.com/chart/?symbol=A,"Agilent Technologies, Inc.",Healthcare,117.75,33276422144,7.0,-3.6,-7.44,0.71,42.75,115.61,129.17,True,False,False,NO CLEAR ENTRY,False,67.25,POSITIVE,5,"Apyx Medical (APYX) Reports Q1 Loss, Tops Revenue Estimates | Assessing Agilent Technologies (A) Valuation After FDA Approval Of PD L1 Assay For KEYTRUDA | The Bull Case For Agilent Technologies (A) Could Change Following Exclusive FDA Approval Of Its KEYTRUDA Test",25.99,17.89,855875008.0,51.39,19.95,18.26,43.03,IGNORE
LOW,https://www.tradingview.com/chart/?symbol=LOW,"Lowe's Companies, Inc.",Consumer Cyclical,231.04,129396932608,10.9,-11.0,-16.16,-4.72,32.35,240.86,247.28,False,False,False,NO CLEAR ENTRY,False,48.83,NEUTRAL,5,Why Investors Need to Take Advantage of These 2 Retail-Wholesale Stocks Now | Somnigroup International (SGI) Surpasses Q1 Earnings Estimates | Silicon Valley’s ‘player‑coach’ fantasy misses the point of good managers,19.48,16.96,4987375104.0,,,7.71,43.01,IGNORE
MRK,https://www.tradingview.com/chart/?symbol=MRK,"Merck & Co., Inc.",Healthcare,111.405,275150798848,4.9,,-4.61,-9.56,32.88,116.5,99.44,False,True,True,BUY THE DIP,False,47.74,NEUTRAL,5,"Salesforce AI Win With Merck Highlights Real World Platform Adoption | Analyst Raises Merck (MRK) Price Target by $1 After Beating Q1 Estimates | EXEL Q1 Earnings Top Estimates, Colorectal Cancer Drug in Focus",31.38,11.51,14049250304.0,106.936,18.94,13.59,42.92,IGNORE
CSGP,https://www.tradingview.com/chart/?symbol=CSGP,"CoStar Group, Inc.",Real Estate,34.8,14210778112,22.5,,-31.68,-10.36,24.21,40.63,65.39,False,False,False,NO CLEAR ENTRY,False,58.78,NEUTRAL,5,CoStar CEO boosts stake after activist exit and earnings beat | 1 Oversold Stock Ready to Bounce Back and 2 We Find Risky | A Look At CoStar Group (CSGP) Valuation After Raised 2026 Guidance And Homes.com Growth,497.14,19.57,202200000.0,14.526,0.3,0.73,42.85,IGNORE
FER,https://www.tradingview.com/chart/?symbol=FER,Ferrovial N.V.,Industrials,70.305,50418159616,5.7,-87.6,-4.4,0.11,43.06,67.75,63.47,True,True,True,BULLISH TREND,False,71.94,POSITIVE,5,"Ferrovial AGM: 2025 Revenue Jumps 9%, EBITDA Up 12%, €1B Scrip Dividend Plan Backed by Votes | Ferrovial (FER) 2025 Revenue Rises 8.6% to €9.6B With Adjusted EBITDA Reaching €1.5B | Ferrovial and Budimex win $699m rail tunnel contract in Poland",49.51,47.84,321375008.0,140.013,14.32,9.22,42.71,IGNORE
DRI,https://www.tradingview.com/chart/?symbol=DRI,"Darden Restaurants, Inc.",Consumer Cyclical,193.38,22148777984,5.9,-3.3,-10.61,-0.4,39.26,198.74,193.82,False,False,True,NO CLEAR ENTRY,False,54.82,NEUTRAL,5,A Look At Darden Restaurants (DRI) Valuation After Recent Pullback And 12% Undervaluation Narrative | Why Is Dave & Buster's (PLAY) Down 11.4% Since Last Earnings Report? | Smokey Bones closes all locations nationwide amid bankruptcy,20.38,17.01,678150016.0,387.681,51.54,8.66,42.49,IGNORE
APD,https://www.tradingview.com/chart/?symbol=APD,"Air Products and Chemicals, Inc.",Basic Materials,293.22,65294430208,8.8,,3.03,-1.14,51.7,289.44,271.64,True,True,True,BULLISH TREND,False,58.02,NEUTRAL,5,Is It Too Late To Reconsider Air Products And Chemicals (APD) After Recent Share Price Gains | Air Products and Chemicals (APD) Could Be a Great Choice | Assessing Air Products and Chemicals (APD) Valuation After Recent Share Price Momentum,30.9,20.59,-3519237376.0,101.611,12.35,16.91,42.34,IGNORE
PFE,https://www.tradingview.com/chart/?symbol=PFE,Pfizer Inc.,Healthcare,26.225,149467922432,5.4,-10.1,-3.05,-4.53,29.99,27.08,25.3,False,True,True,NO CLEAR ENTRY,False,58.79,NEUTRAL,5,"NVAX Q1 Earnings Beat, Stock Jumps 16% on Matrix-M Deal Momentum | Pfizer's 6.5% Dividend Yield Looked Too Good to Be True -- but Management Just Silenced the Skeptics | How Pfizer’s Q1 Beat, Oncology Wins and Patent Deals At Pfizer (PFE) Has Changed Its Investment Story",20.02,9.2,12376625152.0,71.602,8.31,11.83,42.3,IGNORE
LDOS,https://www.tradingview.com/chart/?symbol=LDOS,"Leidos Holdings, Inc.",Technology,131.28,16513115136,3.7,-7.6,-32.36,-18.28,15.23,159.47,177.89,False,False,False,NO CLEAR ENTRY,False,55.72,NEUTRAL,5,"Why Palantir Stock Popped Today | Is Leidos Holdings (LDOS) Pricing Overreacting To Recent Volatility In Light Of Cash Flow Outlook | Leidos Holdings, Inc. Q1 2026 Earnings Call Summary",12.01,9.98,1194749952.0,137.125,30.58,8.15,42.26,IGNORE
MDT,https://www.tradingview.com/chart/?symbol=MDT,Medtronic plc,Healthcare,77.98,100117348352,8.7,-11.8,-22.66,-12.04,23.94,86.45,92.72,False,False,False,NO CLEAR ENTRY,False,57.59,NEUTRAL,5,"Is It Worth Investing in Medtronic (MDT) Based on Wall Street's Bullish Views? | Medtronic Expands Neuromodulation Reach With Adaptive DBS Launch In India | InfuSystems Holdings, Inc. (INFU) Q1 Earnings Top Estimates",21.78,12.87,4073125120.0,57.06,9.39,13.0,42.21,IGNORE
PAYX,https://www.tradingview.com/chart/?symbol=PAYX,"Paychex, Inc.",Technology,94.33,33797578752,19.9,9.1,-3.83,4.94,56.99,92.55,111.76,True,False,False,NO CLEAR ENTRY,False,57.54,NEUTRAL,5,"Assessing Paychex (PAYX) Valuation After Dividend Hike And AI Focused HCM Expansion | Is Paychex, Inc. (PAYX) A Good Stock To Buy Now? | 3 Cash-Producing Stocks with Warning Signs",20.82,15.99,,124.91,,26.63,42.2,IGNORE
CCI,https://www.tradingview.com/chart/?symbol=CCI,Crown Castle Inc.,Real Estate,90.295,39401791488,-4.8,,10.04,5.58,53.95,85.85,89.86,True,True,False,BULLISH TREND,False,57.95,NEUTRAL,5,"Crown Castle (CCI) Completes sale of Fiber Solution Business | Crown Castle Closes $8.5B Divestiture, Raises 2026 AFFO View | How Investors May Respond To Crown Castle (CCI) Profit Swing, Asset Sales And Reaffirmed 2026 Net Loss Guidance",38.1,30.49,1202875008.0,,,25.14,42.14,IGNORE
HON,https://www.tradingview.com/chart/?symbol=HON,Honeywell International Inc.,Industrials,215.57,136596611072,2.4,-41.9,-9.67,-7.27,29.29,227.66,209.93,False,True,True,BUY THE DIP,False,45.29,NEUTRAL,5,This Nuclear AI Stock Is Dropping. Here’s Why. | 3 Reasons HON is Risky and 1 Stock to Buy Instead | How China Killed Every Rare Earth Competitor Before It Could Get Started,34.38,18.78,2936875008.0,257.387,24.26,10.89,41.97,IGNORE
BX,https://www.tradingview.com/chart/?symbol=BX,Blackstone Inc.,Financial Services,122.4,149665972224,5.7,3.9,-5.96,5.03,39.92,115.74,143.76,True,False,False,NO CLEAR ENTRY,False,56.7,NEUTRAL,5,Blue Owl Prepares First Fund to Buy Secondhand Private Credit | Ken Burns on What He Will and Won’t Allow When Financing His Films | Blackstone’s US$1.5b Anthropic JV Tests AI Across Its Portfolio,31.4,16.21,,66.125,29.53,21.21,41.94,IGNORE
CHRW,https://www.tradingview.com/chart/?symbol=CHRW,"C.H. Robinson Worldwide, Inc.",Industrials,171.255,20186347520,-0.8,9.9,-14.21,-0.68,38.56,174.89,154.01,False,True,True,NO CLEAR ENTRY,False,59.72,NEUTRAL,5,C.H. Robinson (CHRW) Is Down 9.6% After Earnings And Major Buybacks Completed Has The Bull Case Changed? | Why C.H. Robinson Worldwide (CHRW) is a Top Momentum Stock for the Long-Term | Amazon Expands Logistics Offering to External Shippers; Transport Stocks Slide,34.67,23.53,642142272.0,96.501,34.84,3.7,41.93,IGNORE
ZS,https://www.tradingview.com/chart/?symbol=ZS,"Zscaler, Inc.",Technology,151.02,24282613760,25.9,,-11.26,9.55,64.58,142.97,230.83,True,False,False,NO CLEAR ENTRY,False,62.02,POSITIVE,5,Citizens Lowers Price Target On Zscaler Inc (ZS) Amid Stock Recovery | High Growth Tech Stocks to Watch in the US May 2026 | May 2026's Top Insider Picks For Growth Companies,,32.92,1020966656.0,84.995,-3.56,-2.25,41.71,IGNORE
VRSK,https://www.tradingview.com/chart/?symbol=VRSK,"Verisk Analytics, Inc.",Industrials,175.065,22937337856,3.9,4.8,-1.51,-0.21,47.01,189.07,221.52,False,False,False,NO CLEAR ENTRY,False,59.31,NEUTRAL,5,"The DOJ just charged 324 defendants in the largest Medicare fraud takedown ever — $14.6   billion that’s now reaching retirees’ statements | Is Verisk Analytics, Inc. (VRSK) A Good Stock To Buy Now? | AI Push, Buybacks and Steady Guidance Could Be A Game Changer For Verisk Analytics (VRSK)",26.69,20.25,944362496.0,,,29.34,41.64,IGNORE
TECH,https://www.tradingview.com/chart/?symbol=TECH,Bio-Techne Corporation,Healthcare,49.55,7752260608,-1.5,128.6,-24.23,-10.25,35.38,54.36,58.04,False,False,False,NO CLEAR ENTRY,False,55.53,NEUTRAL,5,Bio-Techne Q3 Earnings Call Highlights | Why Bio-Techne (TECH) Is Up 5.9% After Profits Rose Despite Slightly Lower Sales – And What's Next | Bio-Techne Corporation Q3 2026 Earnings Call Summary,70.79,23.64,300826112.0,13.922,5.34,9.05,41.59,IGNORE
L,https://www.tradingview.com/chart/?symbol=L,Loews Corporation,Financial Services,105.09,21624250368,1.4,-6.3,-5.18,-4.28,33.61,108.9,103.25,False,True,True,NO CLEAR ENTRY,False,55.9,NEUTRAL,5,"A Look At Loews (L) Valuation As Recent Price Swings Cool Longer Term Momentum | Loews reports year-over-year drop in profit | Dow drops further, dragging S&P 500 and Nasdaq into the red",13.35,36.24,2084000000.0,45.603,9.22,8.82,41.52,IGNORE
CHTR,https://www.tradingview.com/chart/?symbol=CHTR,"Charter Communications, Inc.",Communication Services,161.03,22735364096,-1.0,8.9,-32.41,-27.34,20.48,212.69,231.44,False,False,False,NO CLEAR ENTRY,False,48.83,NEUTRAL,5,"Why Charter Communications, Inc. (CHTR) is One of the Top Cheap Stocks to Buy With the Biggest Upside Potential | Charter Reshapes Connectivity Leadership As Investors Weigh Subscriber And Value Story | GameStop Is Smaller Than eBay. Little Fish Have Gobbled Up Big Ones Before.",4.36,3.64,2403624960.0,459.525,27.5,9.03,41.46,IGNORE
LHX,https://www.tradingview.com/chart/?symbol=LHX,"L3Harris Technologies, Inc.",Industrials,301.235,56118554624,190.0,-6.1,-13.78,-16.78,11.54,347.35,309.35,False,False,True,NO CLEAR ENTRY,False,58.07,NEUTRAL,5,Why Palantir Stock Popped Today | CGNT Stock Up 38% in the Past 3 Months: Is There More Upside Ahead? | A Look At L3Harris Technologies (LHX) Valuation After Recent Share Price Pullback,32.67,22.13,,34.574,,10.37,41.05,IGNORE
KHC,https://www.tradingview.com/chart/?symbol=KHC,The Kraft Heinz Company,Consumer Defensive,23.39,27734978560,0.8,13.6,-3.24,1.92,66.67,22.68,24.16,True,False,False,NO CLEAR ENTRY,False,50.22,NEUTRAL,5,"Kraft Heinz CEO Steve Cahillane sparks questions over future of frozen | Stock Market News for May 7, 2026 | Kraft Heinz hikes marketing spend 37% as turnaround takes shape",,10.93,3180375040.0,50.258,-12.58,-23.05,40.97,IGNORE
PNW,https://www.tradingview.com/chart/?symbol=PNW,Pinnacle West Capital Corporation,Utilities,99.65,12076301312,11.4,,7.97,-2.51,37.95,100.74,91.64,False,True,True,NO CLEAR ENTRY,False,56.58,NEUTRAL,5,Pinnacle West Capital Corporation Q1 2026 Earnings Call Summary | Pinnacle West (PNW) Q1 2026 Earnings Transcript | Pinnacle West Capital Q1 Earnings Call Highlights,18.59,17.87,-831102848.0,212.957,9.56,11.99,40.88,IGNORE
LUV,https://www.tradingview.com/chart/?symbol=LUV,Southwest Airlines Co.,Industrials,41.21,20142364672,12.8,,-22.44,2.0,44.78,40.66,37.63,True,True,True,BULLISH TREND,False,54.32,NEUTRAL,5,U.S. airlines spent over $5 billion on jet ⁠fuel in March as Iran war bites | Airline shares jump as optimism grows over possible U.S.-Iran agreement | Why The Narrative Around Southwest Airlines (LUV) Is Shifting With Fuel Risks And New Initiatives,27.47,9.11,-372375008.0,93.033,10.06,2.83,40.8,IGNORE
CAH,https://www.tradingview.com/chart/?symbol=CAH,"Cardinal Health, Inc.",Healthcare,187.24,43852705792,11.0,-19.5,-16.86,-12.96,25.67,210.56,189.22,False,False,True,NO CLEAR ENTRY,False,48.46,NEUTRAL,5,"Brokers Suggest Investing in Cardinal (CAH): Read This Before Placing a Bet | Cardinal Health (CAH) Price Target Upped by $4 After Beating Q1 Profit Estimates | COR Stock Falls on Q2 Earnings & Revenue Miss, FY26 EPS View Raised",28.59,15.63,4849999872.0,,,0.62,40.78,IGNORE
T,https://www.tradingview.com/chart/?symbol=T,AT&T Inc.,Communication Services,25.27,175584526336,2.9,-11.3,-5.81,-6.64,36.34,27.11,26.18,False,False,True,NO CLEAR ENTRY,False,55.8,NEUTRAL,5,Should Investors Buy EMCOR Stock After Impressive Q1 Earnings? | T-Mobile US (TMUS) Executive Buys $1.0M in Shares | Sezzle Q1 Earnings Call Highlights,8.31,9.88,8849000448.0,125.175,18.37,16.94,40.76,IGNORE
ITW,https://www.tradingview.com/chart/?symbol=ITW,Illinois Tool Works Inc.,Industrials,257.46,74199965696,4.6,11.8,-10.84,-4.47,34.04,267.19,258.54,False,False,True,NO CLEAR ENTRY,False,54.85,NEUTRAL,5,"The Middleby Sees Strong Q1 Sales, Raises 2026 Outlook | Illinois Tool Works Inc. (NYSE:ITW) First-Quarter Results: Here's What Analysts Are Forecasting For This Year | ITW Q1 Deep Dive: CapEx Segments Strengthen as Consumer Markets Lag, Guidance Maintained",23.93,21.17,,283.22,96.85,19.32,40.69,IGNORE
EQR,https://www.tradingview.com/chart/?symbol=EQR,Equity Residential,Real Estate,66.22,25583142912,2.5,-64.6,3.64,8.91,70.87,61.36,61.31,True,True,True,WATCH - OVERBOUGHT,False,57.34,NEUTRAL,5,"CPT Q1 FFO Beats Estimates Despite Lower Property Revenues | Sector Update: Financial Stocks Advance Late Afternoon | AvalonBay, Equity Residential reportedly mull merger: Bloomberg",26.49,43.57,1416540928.0,78.42,8.67,30.63,40.59,IGNORE
MELI,https://www.tradingview.com/chart/?symbol=MELI,"MercadoLibre, Inc.",Consumer Cyclical,1843.7,93437444096,44.6,-12.5,-9.46,3.79,48.12,1758.85,2081.66,True,False,False,NO CLEAR ENTRY,False,58.9,NEUTRAL,5,"MercadoLibre Set to Report Q1 Earnings: Hold or Fold the Stock? | Everyone’s Talking About Uber. Smart Money Is Watching Grab’s Profitability Inflection Instead | MercadoLibre Is the Amazon’s Amazon, and It’s Growing Fast",46.78,27.18,-2455375104.0,169.235,35.99,6.91,40.36,IGNORE
CMG,https://www.tradingview.com/chart/?symbol=CMG,"Chipotle Mexican Grill, Inc.",Consumer Cyclical,32.795,42067259392,7.4,-17.9,-17.16,-2.94,30.95,34.02,37.54,False,False,False,NO CLEAR ENTRY,False,49.34,NEUTRAL,5,"Shake Shack Q1 Revenue Up 14%, Appoints New CFO | Top Research Reports for Eli Lilly, Western Digital & Vertiv | Shake Shack, Cava Stocks Bounce Back. But Not All Fast-Casual Restaurants Are Equal.",30.09,24.15,1087909760.0,217.885,49.23,11.96,39.85,IGNORE
XOM,https://www.tradingview.com/chart/?symbol=XOM,Exxon Mobil Corporation,Energy,146.24,606157078528,2.6,-43.4,-2.64,-6.39,49.61,154.97,127.64,False,True,True,BUY THE DIP,False,34.74,NEGATIVE,5,"Trump Admits “I Expected Oil to Hit $200” Over Iran— Here’s How Close Investors Came to Disaster | Argus Hikes Exxon Mobil Price Target to $169 as Permian, Guyana Production Power 2026 | Shell Earnings Surge on Iran War Oil Boom. Why the Stock Is Falling.",24.66,14.35,11630499840.0,18.261,9.87,7.76,39.83,IGNORE
SWK,https://www.tradingview.com/chart/?symbol=SWK,"Stanley Black & Decker, Inc.",Industrials,80.46,12507955200,2.7,-34.8,-9.46,12.55,67.13,73.98,73.66,True,True,True,BULLISH TREND,False,44.91,NEUTRAL,5,AXON Q1 Earnings Miss Estimates on Tariff-Driven Margins | Kennametal Q3 Earnings Beat Estimates on Pricing and Volume | How Factory Closure and Asset Impairment Charges Will Impact Stanley Black & Decker (SWK) Investors,32.98,13.0,842187520.0,77.606,4.17,2.44,39.79,IGNORE
TKO,https://www.tradingview.com/chart/?symbol=TKO,"TKO Group Holdings, Inc.",Communication Services,190.01,14244606976,11.9,,-8.89,-3.57,60.95,196.32,193.75,False,False,True,NO CLEAR ENTRY,False,57.83,NEUTRAL,5,TKO Group (TKO) Q1 Earnings: How Key Metrics Compare to Wall Street Estimates | TKO Group Holdings (TKO) Surpasses Q1 Earnings and Revenue Estimates | TKO Group (TKO) Stock: Are You Ready to Look Beyond the Near-Term Concerns?,70.64,52.38,759956096.0,43.924,5.63,4.13,39.78,IGNORE
CAG,https://www.tradingview.com/chart/?symbol=CAG,"Conagra Brands, Inc.",Consumer Defensive,14.245,6815336960,-1.9,39.0,-23.86,-6.26,44.51,15.39,16.84,False,False,False,NO CLEAR ENTRY,False,47.82,NEUTRAL,5,These Juicy Dividend Payouts Might Be a Trap | The New Farm Bill Doubles as the Biggest Cut to Food Aid in U.S. History | 1 Small-Cap Stock for Long-Term Investors and 2 Facing Challenges,,8.42,654675008.0,89.813,-0.51,-0.39,39.58,IGNORE
SO,https://www.tradingview.com/chart/?symbol=SO,The Southern Company,Utilities,92.33,104083718144,8.0,-0.8,4.11,-4.98,42.48,95.79,91.82,False,True,True,NO CLEAR ENTRY,False,54.25,NEUTRAL,5,"Is Most-Watched Stock Southern Company (The) (SO) Worth Betting on Now? | Southern (SO) Valuation Check After Recent 2% Move And Conflicting Fair Value Signals | This Boring Utility ETF Just Became a Stealth AI Play, and It’s Up 20%",23.61,18.77,-3950000128.0,190.431,10.99,14.46,39.44,IGNORE
CNP,https://www.tradingview.com/chart/?symbol=CNP,"CenterPoint Energy, Inc.",Utilities,42.23,27625576448,1.9,6.7,5.5,-3.32,43.88,43.08,39.75,False,True,True,NO CLEAR ENTRY,False,65.23,POSITIVE,5,"Evergy's Q1 Earnings Beat Estimates, Revenues Increase Y/Y | Ameren Q1 Earnings Outpace Estimates, Revenues Increase Y/Y | NRG Energy Q1 Earnings Lag Estimates, Revenues Increase Y/Y",25.91,20.28,-4945375232.0,215.591,9.56,11.38,39.37,IGNORE
