CCL,https://www.tradingview.com/chart/?symbol=CCL,Carnival Corporation Ltd.,Consumer Cyclical,30.875,42766184448,6.1,,23.81,23.95,64.41,27.05,28.14,True,True,False,BULLISH TREND,False,47.31,NEUTRAL,5,Countdown to Carnival (CCL) Q2 Earnings: A Look at Estimates Beyond Revenue and EPS | Carnival (CCL) Gains As Market Dips: What You Should Know | Broader Market Weakens as Energy and Software Stocks Fall,13.6,11.83,2174000128.0,203.901,27.85,11.48,60.03,WATCHLIST
APA,https://www.tradingview.com/chart/?symbol=APA,APA Corporation,Energy,34.13,12063939584,-11.9,32.2,-4.21,-14.99,39.69,37.8,29.44,False,True,True,BUY THE DIP,False,48.34,NEUTRAL,5,APA (APA) Stock Gets Fair Value Trim As Analysts Debate Oil And Execution | Stocks Indexes Finish Mostly Lower as Chipmakers Retreat | Broader Market Weakens as Energy and Software Stocks Fall,7.96,7.92,1691250048.0,61.314,26.22,18.31,59.87,IGNORE
LH,https://www.tradingview.com/chart/?symbol=LH,Labcorp Holdings Inc.,Healthcare,261.215,21419630592,5.8,32.9,-3.21,2.49,48.92,261.06,266.26,True,False,False,NO CLEAR ENTRY,False,62.36,POSITIVE,5,"LH vs. CRL: Which Stock Is the Better Value Option? | CVS Health Corporation (CVS) Hit a 52 Week High, Can the Run Continue? | Strong Performance Continues at DHR's Biotechnology Unit: What's Next?",23.16,13.44,1142537472.0,83.407,11.05,6.66,59.84,IGNORE
BKNG,https://www.tradingview.com/chart/?symbol=BKNG,Booking Holdings Inc.,Consumer Cyclical,174.19,134976077824,16.2,240.0,-1.73,12.61,56.35,169.36,190.08,True,False,False,NO CLEAR ENTRY,False,58.95,NEUTRAL,5,"Stocks making big moves yesterday: Booking, Remitly, Expedia, MercadoLibre, and Super Micro | Why Expedia (EXPE) Stock Is Up Today | Why Airbnb (ABNB) Stock Is Trading Up Today",22.95,14.16,7075125248.0,,,22.23,59.82,IGNORE
VTR,https://www.tradingview.com/chart/?symbol=VTR,"Ventas, Inc.",Real Estate,83.05,40376397824,21.9,10.0,-5.02,-5.77,43.3,85.25,78.67,False,True,True,BUY THE DIP,False,56.25,NEUTRAL,5,Is Ventas Stock Outperforming the Dow? | Why Ventas (VTR) is a Great Dividend Stock Right Now | A Look At Ventas (VTR) Valuation After Updated Outlook And Dividend Reaffirmation,151.0,98.09,1483115264.0,93.736,2.14,4.26,59.8,IGNORE
RJF,https://www.tradingview.com/chart/?symbol=RJF,"Raymond James Financial, Inc.",Financial Services,159.2701,31039039488,13.1,15.3,10.63,3.11,89.13,152.32,158.18,True,True,False,WATCH - OVERBOUGHT,False,63.17,POSITIVE,5,"Top Raymond James tech bankers jumping to merchant bank Berenson, sources say | How Raymond James Financial's Stock Performance Compared to Other Financial Stocks? | How The Amerant Bancorp (AMTB) Story Is Shifting With New Leadership And Fair Value Assumptions",15.04,11.91,,48.477,17.29,14.58,59.75,IGNORE
AES,https://www.tradingview.com/chart/?symbol=AES,The AES Corporation,Utilities,14.635,10437062656,8.7,951.1,4.33,0.72,43.04,14.47,14.07,True,True,True,BULLISH TREND,False,54.4,NEUTRAL,5,AES Corporation (AES) Prices $600M 2029 Notes And $400M 2033 Notes In $1 Billion Offering | Is The AES Corporation (AES) A Good Stock To Buy Now? | NiSource (NI) Down 2.5% Since Last Earnings Report: Can It Rebound?,7.62,6.15,-2964999936.0,259.603,5.26,10.82,59.7,IGNORE
ETN,https://www.tradingview.com/chart/?symbol=ETN,Eaton Corporation plc,Industrials,417.505,162117189632,16.8,-9.4,15.03,9.33,56.0,404.04,366.65,True,True,True,BULLISH TREND,False,62.27,POSITIVE,5,VWDRY vs. ETN: Which Stock Is the Better Value Option? | Eaton (ETN) Surged on Accelerated Demand for Data Centre Power Solutions | Eaton-Dana Deal Accelerates ETN's Portfolio Transformation?,40.81,26.56,2646500096.0,110.463,20.84,13.99,59.58,IGNORE
CDW,https://www.tradingview.com/chart/?symbol=CDW,CDW Corporation,Technology,130.75,16703763456,9.2,7.7,11.99,26.42,64.49,124.45,135.28,True,False,False,NO CLEAR ENTRY,False,45.98,NEUTRAL,5,"CDW (CDW): Buy, Sell, or Hold Post Q1 Earnings? | Oppenheimer Picks Alphabet, Dumps Meta in Highest-Conviction Stock Picks | CDW (CDW) Stock Price Jumps 29% Is The Valuation Story Changing?",15.93,11.23,884099968.0,240.522,44.16,4.7,59.58,IGNORE
ORLY,https://www.tradingview.com/chart/?symbol=ORLY,"O'Reilly Automotive, Inc.",Consumer Cyclical,89.62,74269450240,10.2,16.1,0.26,-2.31,51.46,91.66,95.68,False,False,False,NO CLEAR ENTRY,False,55.88,NEUTRAL,5,"Does O'Reilly's Expanded US$31.75 Billion Buyback Shift the Bull Case For ORLY? | AI Likely to Become Functional Part Across Retail Operations, UBS Says | The Dip Is Here for O'Reilly Automotive. Here's Whether to Buy It or Walk Away.",29.1,24.78,1330813184.0,,,14.3,59.57,IGNORE
HOOD,https://www.tradingview.com/chart/?symbol=HOOD,"Robinhood Markets, Inc.",Financial Services,108.38,97596735488,15.1,2.7,40.12,40.48,68.53,82.14,102.77,True,True,False,BULLISH TREND,False,47.3,NEUTRAL,5,"Coinbase wants to be your bank. But should it? | COIN Broadens Reach Beyond Crypto Trading to Be ""Everything Exchange"" | HOOD Stock Gets A New $105 Price Target — Here's What Bulls Think The Market Is Missing",52.61,38.13,,140.483,21.46,41.12,59.48,IGNORE
FITB,https://www.tradingview.com/chart/?symbol=FITB,Fifth Third Bancorp,Financial Services,54.12,49049579520,33.0,-78.9,23.49,12.89,67.24,50.26,46.9,True,True,True,BULLISH TREND,False,66.15,POSITIVE,5,Fifth Third Bancorp (FITB) Could Be a Great Choice | Is NTRS Well-Positioned to Support Its Capital Return Strategy? | Is Fifth Third Bancorp Stock Outperforming the S&P 500?,18.22,11.01,,,7.97,24.13,59.34,IGNORE
BAC,https://www.tradingview.com/chart/?symbol=BAC,Bank of America Corporation,Financial Services,57.415,407450779648,8.1,24.4,22.07,13.86,92.82,52.56,51.67,True,True,True,WATCH - OVERBOUGHT,False,65.36,POSITIVE,5,"Bank of America takes firm position on inflation, economy | Bank of America (BAC) Stock Draws Fresh Price Target Split After Mixed Analyst Revisions | Citigroup's Card Delinquencies Decline, Charge-Offs Rise in May",14.25,11.37,,,10.64,28.96,59.13,IGNORE
WSM,https://www.tradingview.com/chart/?symbol=WSM,"Williams-Sonoma, Inc.",Consumer Cyclical,230.81,27177095168,4.4,4.3,27.21,36.44,72.39,194.04,192.89,True,True,True,WATCH - OVERBOUGHT,False,54.08,NEUTRAL,5,"RH is Chasing Luxury Growth as Tariffs Reshape the Playbook | Is RH Stock a Buy Now or a Value Trap for Patient Investors? | RH Stock Outlook Hinges on Tariffs, Housing and a Big Reset",25.85,22.49,885462144.0,79.878,54.01,13.81,59.08,IGNORE
VLO,https://www.tradingview.com/chart/?symbol=VLO,Valero Energy Corporation,Energy,242.52,72012136448,6.6,,3.27,-5.74,47.89,244.85,198.83,False,True,True,BUY THE DIP,False,45.21,NEUTRAL,5,Valero (VLO) Faces A New Oil Supply Test As Hormuz Reopens | The Number That Could Test Exxon Mobil Stock | Stocks Indexes Finish Mostly Lower as Chipmakers Retreat,17.7,11.35,4786625024.0,42.664,15.85,3.57,58.92,IGNORE
IBKR,https://www.tradingview.com/chart/?symbol=IBKR,"Interactive Brokers Group, Inc.",Financial Services,95.98,162803417088,16.8,22.9,39.99,11.56,75.45,82.96,71.9,True,True,True,WATCH - OVERBOUGHT,False,59.93,NEUTRAL,5,"COIN Broadens Reach Beyond Crypto Trading to Be ""Everything Exchange"" | Is Interactive Brokers (IBKR) a Buy as Wall Street Analysts Look Optimistic? | Is SNEX Stock Worth Buying After Its Sharp Run and Richer Valuation?",41.19,33.36,,152.192,23.56,16.11,58.89,IGNORE
HUM,https://www.tradingview.com/chart/?symbol=HUM,Humana Inc.,Healthcare,365.1,43834454016,23.5,-4.6,114.88,19.31,76.08,278.65,247.37,True,True,True,WATCH - OVERBOUGHT,False,60.14,POSITIVE,5,The Medicare Crisis for Insurers Is Over. The Easy Gains Are Too. | Why Did UnitedHealth Stock Choose Pain Over Growth? | Jim Cramer on UnitedHealth: “Buy It”,38.88,23.21,1431374976.0,77.073,6.28,0.82,58.81,IGNORE
VEEV,https://www.tradingview.com/chart/?symbol=VEEV,Veeva Systems Inc.,Healthcare,159.885,25972244480,16.3,14.6,-14.36,-2.42,46.35,164.48,218.73,False,False,False,NO CLEAR ENTRY,False,70.47,POSITIVE,5,"Vertical Software Stocks Q1 Results: Benchmarking Veeva Systems (NYSE:VEEV) | ADBE, VEEV Rise Overnight: Michael Burry Boosts Stakes On 'Lighter Expectations Stocks' | Veeva Wins UCB Safety Deal As Integrated Platform And Valuation Draw Focus",28.35,15.93,1259549056.0,1.411,13.93,28.37,58.74,IGNORE
DECK,https://www.tradingview.com/chart/?symbol=DECK,Deckers Outdoor Corporation,Consumer Cyclical,110.02,15279682560,9.6,-4.8,5.07,16.29,40.5,106.0,103.26,True,True,True,BULLISH TREND,False,54.04,NEUTRAL,5,Investors Heavily Search Deckers Outdoor Corporation (DECK): Here is What You Need to Know | Ugg Brand Owner Deckers Outdoor Corp. Loses Patent Case Against Quince | Deckers (DECK) Stock Sinks As Market Gains: What You Should Know,15.67,13.26,858725120.0,15.01,40.86,18.71,58.72,IGNORE
TGT,https://www.tradingview.com/chart/?symbol=TGT,Target Corporation,Consumer Defensive,131.005,59501305856,6.7,-24.7,13.26,6.16,54.42,125.76,105.64,True,True,True,BULLISH TREND,False,65.44,POSITIVE,5,"LGBTQ consumers cut spending at Target, Walmart, Amazon over DEI | US Retail Sales Rise in Broad Gain Despite Higher Gas Prices | Target (TGT) Appoints Isaac Mizrahi As First Ever Creative Director At Large",17.33,14.72,3141250048.0,117.548,22.02,3.24,58.69,IGNORE
HBAN,https://www.tradingview.com/chart/?symbol=HBAN,Huntington Bancshares Incorporated,Financial Services,17.175,34815967232,33.6,-26.5,12.73,10.31,64.24,16.4,16.54,True,True,False,BULLISH TREND,False,54.02,NEUTRAL,5,How new payments tech is fueling Huntington's merger conversions | How Is Huntington Bancshares' Stock Performance Compared to Other Regional Banks Stocks? | Automatic Data Processing And 2 Other Reliable Dividend Stocks To Consider,13.21,9.02,,,8.39,26.6,58.47,IGNORE
EXPE,https://www.tradingview.com/chart/?symbol=EXPE,"Expedia Group, Inc.",Consumer Cyclical,242.565,29113155584,14.7,,0.76,13.07,63.25,235.67,239.65,True,True,False,BULLISH TREND,False,56.25,NEUTRAL,5,"Stocks making big moves yesterday: Booking, Remitly, Expedia, MercadoLibre, and Super Micro | JPMorgan, Google Records Sought in Probe Into Epstein’s New Mexico Ranch | Why Expedia (EXPE) Stock Is Up Today",21.41,10.5,3478249984.0,256.536,71.49,9.81,58.4,IGNORE
ELV,https://www.tradingview.com/chart/?symbol=ELV,"Elevance Health, Inc.",Healthcare,393.84,85527232512,2.6,-16.8,33.71,0.35,51.38,371.93,337.6,True,True,True,BULLISH TREND,False,59.02,NEUTRAL,5,The Medicare Crisis for Insurers Is Over. The Easy Gains Are Too. | Why Did UnitedHealth Stock Choose Pain Over Growth? | 1 Unpopular Stock That Deserves Some Love and 2 Facing Challenges,16.7,13.47,4298625024.0,72.299,12.09,2.62,58.37,IGNORE
WMT,https://www.tradingview.com/chart/?symbol=WMT,Walmart Inc.,Consumer Defensive,118.66,944305668096,7.3,19.4,-4.76,-11.01,49.36,125.2,115.95,False,True,True,BUY THE DIP,False,53.62,NEUTRAL,5,"AI vs. inflation: why Wall Street is ignoring soaring rates | LGBTQ consumers cut spending at Target, Walmart, Amazon over DEI | US Retail Sales Rise in Broad Gain Despite Higher Gas Prices",41.78,36.09,6862249984.0,74.816,24.13,3.14,58.34,IGNORE
GILD,https://www.tradingview.com/chart/?symbol=GILD,"Gilead Sciences, Inc.",Healthcare,126.42,156959260672,4.4,54.8,-11.88,-1.87,33.31,131.34,127.73,False,False,True,NO CLEAR ENTRY,False,62.15,POSITIVE,5,"1 Cash-Producing Stock Worth Investigating and 2 We Brush Off | The Zacks Analyst Blog Highlights Gilead Sciences, Merck and GSK | FDA Accepts Gilead's Filing for Weekly Oral Yeztugo for HIV Prevention",17.2,13.08,7934125056.0,94.635,43.36,30.99,58.32,IGNORE
JPM,https://www.tradingview.com/chart/?symbol=JPM,JPMorgan Chase & Co.,Financial Services,336.9,902727335936,12.7,17.2,18.03,12.03,84.55,308.59,305.05,True,True,True,WATCH - OVERBOUGHT,False,50.09,NEUTRAL,5,"Citigroup's Card Delinquencies Decline, Charge-Offs Rise in May | Morningstar Wealth to Launch Public/Private Model Portfolios | Stocks to Watch: SpaceX, Intel, BMW",16.13,14.32,,,16.47,33.94,58.31,IGNORE
HSIC,https://www.tradingview.com/chart/?symbol=HSIC,"Henry Schein, Inc.",Healthcare,81.4242,9275581440,6.3,4.5,8.75,12.02,76.97,75.74,73.61,True,True,True,WATCH - OVERBOUGHT,False,66.16,POSITIVE,5,"How Investors Are Reacting To Henry Schein (HSIC) Upgrade On Dental Strength And Margin Improvements | SpaceX initiated, Intel upgraded: Wall Street's top analyst calls | Here Are Thursday’s Best Wall Street Analyst Research Calls: Callaway Golf, Chewy, CME Group, Danaher, General Dynamics, Intel, SpaceX, Rocket Lab, Toast, and More",24.6,13.76,290124992.0,77.748,8.76,2.95,58.29,IGNORE
VICI,https://www.tradingview.com/chart/?symbol=VICI,VICI Properties Inc.,Real Estate,27.605,29724516352,3.5,60.1,-1.98,-3.14,42.67,28.28,28.76,False,False,False,NO CLEAR ENTRY,False,65.1,POSITIVE,5,VICI Properties Adds Club Med Resort to Experiential Growth Push | Club Med St. Croix Redevelopment Might Change The Case For Investing In VICI Properties (VICI) | VICI Properties Inc. (VICI) Stock Sinks As Market Gains: What You Should Know,9.45,9.41,1285280000.0,61.853,11.33,76.83,58.26,IGNORE
EXE,https://www.tradingview.com/chart/?symbol=EXE,Expand Energy Corporation,Energy,88.165,21091610624,41.0,,-16.64,-10.45,31.17,95.0,103.3,False,False,False,NO CLEAR ENTRY,False,61.67,POSITIVE,5,"Talen Energy Corporation (TLN) Surges 5.3%: Is This an Indication of Further Gains? | Oppenheimer Picks Alphabet, Dumps Meta in Highest-Conviction Stock Picks | 3 S&P 500 Stocks Worth Your Attention",6.56,9.2,1687624960.0,25.883,17.57,24.91,58.23,IGNORE
TT,https://www.tradingview.com/chart/?symbol=TT,Trane Technologies plc,Industrials,481.82,106508951552,6.0,-2.1,13.53,4.89,65.13,467.17,428.79,True,True,True,BULLISH TREND,False,53.55,NEUTRAL,5,Is Modine's HVAC Business Set for a Turnaround in 2027? | 5 High-Flying Tech Services Stocks to Buy for Solid Returns in 2H 2026 | Trane Technologies (TT) Rises Higher Than Market: Key Facts,36.86,28.3,2662362624.0,53.597,36.63,13.41,58.03,IGNORE
WRB,https://www.tradingview.com/chart/?symbol=WRB,W. R. Berkley Corporation,Financial Services,68.15,25370660864,4.0,26.0,-1.02,-0.89,67.26,66.7,69.81,True,False,False,NO CLEAR ENTRY,False,53.99,NEUTRAL,5,"ACGL Outperforms Industry, Trades at a Premium: How to Play the Stock | Goldman Sachs Upgrades W. R. Berkley (WRB) Stock to Buy | W. R. Berkley Stock: Is WRB Underperforming the Financial Sector?",14.44,14.15,3222230528.0,31.76,20.16,12.64,57.97,IGNORE
UHS,https://www.tradingview.com/chart/?symbol=UHS,"Universal Health Services, Inc.",Healthcare,144.715,8760517632,9.6,17.7,-25.09,-14.39,41.17,163.87,197.6,False,False,False,NO CLEAR ENTRY,False,48.36,NEUTRAL,5,Is HCA Healthcare Stock A Trap Or A Missed Opportunity? | What Do Analysts Think About Universal Health Services (UHS) Amid Its Decline To 52-Week Low? | Evaluating Universal Health Services (NYSE:UHS) Valuation After Recent Share Price Weakness,6.04,5.71,650819008.0,67.405,21.37,8.56,57.87,IGNORE
CMI,https://www.tradingview.com/chart/?symbol=CMI,Cummins Inc.,Industrials,729.58,100674068480,2.7,-21.0,34.72,7.97,61.81,658.69,538.42,True,True,True,BULLISH TREND,False,57.66,NEUTRAL,5,"Stock Market Today: Nasdaq Slips Ahead Of Fed News; SpaceX Falls As This Truck Play Breaks Out (Live Coverage) | Here's How Much You'd Have If You Invested $1000 in Cummins a Decade Ago | Zacks.com featured highlights include Costco Wholesale, Cummins and Kennametal",37.9,21.52,1688625024.0,61.621,21.99,7.89,57.81,IGNORE
STE,https://www.tradingview.com/chart/?symbol=STE,STERIS plc,Healthcare,202.845,19768803328,7.3,52.2,-7.58,-4.43,25.8,214.56,238.03,False,False,False,NO CLEAR ENTRY,False,48.47,NEUTRAL,5,Is STERIS Stock Underperforming the Dow? | Steris (STE) Stock After Q4 Miss And 2027 Outlook What The Valuation Signals Now | Why Is Steris (STE) Up 1% Since Last Earnings Report?,25.58,16.76,837287488.0,28.999,11.37,13.18,57.78,IGNORE
JKHY,https://www.tradingview.com/chart/?symbol=JKHY,"Jack Henry & Associates, Inc.",Technology,127.93,9089526784,8.7,12.5,-22.94,-7.62,36.32,142.14,159.55,False,False,False,NO CLEAR ENTRY,False,56.76,NEUTRAL,5,1 Financials Stock on Our Buy List and 2 We Find Risky | Jack Henry & Associates (JKHY) Expands Stock Buyback Authorization by 5M Shares | Aeropay To Leverage Jack Henry (JKHY)’s Embedded Payments Technology To Expand Its Instant Payment Capabilities,17.87,18.04,373407744.0,6.398,24.89,20.64,57.59,IGNORE
SLB,https://www.tradingview.com/chart/?symbol=SLB,SLB N.V.,Energy,51.28,76666552320,2.7,-13.8,11.75,-9.8,38.72,54.7,44.39,False,True,True,BUY THE DIP,False,55.86,NEUTRAL,5,Jim Cramer Points to SLB for Critical Insights Into International Oil Production | Here is What to Know Beyond Why SLB Limited (SLB) is a Trending Stock | Why SLB (SLB) Stock Is Down Today,22.59,15.33,3043124992.0,42.515,14.07,9.26,57.57,IGNORE
MA,https://www.tradingview.com/chart/?symbol=MA,Mastercard Incorporated,Financial Services,498.815,440744902656,15.8,21.2,-1.36,-1.38,52.95,499.34,534.16,False,False,False,NO CLEAR ENTRY,False,50.0,NEUTRAL,5,Why Agentic Commerce Could Be a Game-Changer for Mastercard | Can Visa's SaaS Bet With Mintoak Deepen Merchant Relationships? | 3 Underrated Dividend Stocks That Could Generate Reliable Cash Flow for Your Portfolio for Decades,28.83,21.9,16148124672.0,282.059,232.08,45.88,57.5,IGNORE
VLTO,https://www.tradingview.com/chart/?symbol=VLTO,Veralto Corporation,Industrials,83.925,20611919872,6.8,13.3,-7.62,-3.21,51.38,86.79,95.8,False,False,False,NO CLEAR ENTRY,False,61.51,POSITIVE,5,"Active Energy, Quantum Blockchain Technologies, Metir, Poolbeg Pharma, IXICO, Coiled Therapeutics | Veralto (VLTO) Stock Valuation Check After Recent Share Price Weakness | Metir targets PFAS growth as first commercial sales gain momentum",21.63,18.04,768249984.0,95.542,36.46,17.32,57.47,IGNORE
KMB,https://www.tradingview.com/chart/?symbol=KMB,Kimberly-Clark Corporation,Consumer Defensive,102.82,34130106368,2.7,17.9,3.73,7.99,59.45,97.15,103.25,True,False,False,NO CLEAR ENTRY,False,62.48,POSITIVE,5,Kimberly-Clark credits supply chain for productivity gains | Kimberly-Clark Pull-Ups Learning Layer Aims To Support Earnings Growth | Wall Street CIO: The AI Trade is “Technically Unsustainable.” Buy These Two Industries Instead.,19.89,13.58,1054625024.0,371.264,111.73,12.8,57.3,IGNORE
PRU,https://www.tradingview.com/chart/?symbol=PRU,"Prudential Financial, Inc.",Financial Services,108.3682,37639000064,15.3,-14.3,16.25,6.67,75.28,100.18,101.67,True,True,False,WATCH - OVERBOUGHT,False,56.04,NEUTRAL,5,"PRU Stock Trades at Discount to Industry at 7.64X: Time to Hold? | 3 Reasons to Sell PRU and 1 Stock to Buy Instead | Argus Moves Prudential Financial (PRU) to Hold, Awaiting Clarity on Japan Operations",11.15,7.46,10378999808.0,158.972,10.71,5.48,57.28,IGNORE
CHD,https://www.tradingview.com/chart/?symbol=CHD,"Church & Dwight Co., Inc.",Consumer Defensive,98.47,23331835904,0.2,2.2,1.52,1.75,52.47,95.38,91.46,True,True,True,BULLISH TREND,False,47.57,NEUTRAL,5,Is Church & Dwight Stock Underperforming the Nasdaq? | Why Is National Vision (EYE) Up 3% Since Last Earnings Report? | Kimberly-Clark Stock: Is KMB Underperforming the Consumer Staples Sector?,32.39,24.08,1128824960.0,56.794,16.78,11.81,57.26,IGNORE
UNH,https://www.tradingview.com/chart/?symbol=UNH,UnitedHealth Group Incorporated,Healthcare,407.2,369796415488,2.0,0.7,42.41,4.7,72.24,368.95,328.8,True,True,True,WATCH - OVERBOUGHT,False,61.73,POSITIVE,5,Here’s Why SGA Global Growth Fund Sold Its Stake in UnitedHealth (UNH) | Why Did UnitedHealth Stock Choose Pain Over Growth? | Many Hedge Funds Bought Up This Stock Last Quarter — And You’ve Probably Never Heard of It,30.64,19.48,17687500800.0,73.982,12.18,2.68,57.19,IGNORE
NOC,https://www.tradingview.com/chart/?symbol=NOC,Northrop Grumman Corporation,Industrials,555.545,78905982976,4.4,84.9,-22.93,1.45,49.39,576.73,611.87,False,False,False,NO CLEAR ENTRY,False,75.53,POSITIVE,5,How Is Lockheed Martin Strengthening Its Advanced Radar Portfolio? | Is Lockheed Martin Strengthening Its Sonar Defense Capabilities? | Defense Stocks Are in a Bear Market. How a Peace Deal Can Send Them Higher.,17.4,18.43,2071624960.0,102.682,28.51,10.8,56.89,IGNORE
GE,https://www.tradingview.com/chart/?symbol=GE,GE Aerospace,Industrials,360.865,377042436096,24.7,-1.8,19.46,26.18,71.0,306.82,304.58,True,True,True,WATCH - OVERBOUGHT,False,66.92,POSITIVE,5,"GE Vernova Inc. (GEV) is Attracting Investor Attention: Here is What You Should Know | GE Stock Charts Golden Cross As Strong Aviation Demand, Defense Growth Fuel Momentum | The Zacks Analyst Blog Highlights Applied Materials, GE, AstraZeneca, Team and Applied Energetics",44.83,41.54,5667999744.0,116.527,45.43,17.86,56.5,IGNORE
CINF,https://www.tradingview.com/chart/?symbol=CINF,Cincinnati Financial Corporation,Financial Services,172.05,26613854208,11.6,,5.03,2.62,74.62,164.3,160.9,True,True,True,WATCH - OVERBOUGHT,False,57.47,NEUTRAL,5,ESNT vs. CINF: Which Stock Is the Better Value Option? | Why Cincinnati Financial (CINF) is a Great Dividend Stock Right Now | Cincinnati Financial Outperforms Industry in a Year: Time to Hold?,9.84,18.74,2748250112.0,5.626,18.73,21.33,56.5,IGNORE
AMGN,https://www.tradingview.com/chart/?symbol=AMGN,Amgen Inc.,Healthcare,345.24,186328891392,5.8,4.4,-3.68,6.43,56.31,339.19,327.61,True,True,True,BULLISH TREND,False,68.87,POSITIVE,5,Vedana debuts with $46m to progress migraine therapies | Everyone Is Watching Eli Lilly Stock's New Drugs. Here Is the Metric That Vanished | Morgan Stanley Raises Amgen (AMGN) Price Target Following a Strong Start for Uplizna,24.03,14.71,7436624896.0,623.754,101.32,20.96,56.41,IGNORE
ADM,https://www.tradingview.com/chart/?symbol=ADM,Archer-Daniels-Midland Company,Consumer Defensive,76.67,36951605248,1.6,0.9,7.01,-4.62,40.29,76.09,65.92,True,True,True,BULLISH TREND,False,49.09,NEUTRAL,5,Is Archer Daniels Midland (ADM) Outperforming Other Consumer Staples Stocks This Year? | Archer-Daniels-Midland (ADM) Stock After 59% Year Gain Are Valuation Doubts Warranted | Is Archer-Daniels-Midland Stock Outperforming the S&P 500?,34.23,14.47,1578499968.0,46.128,4.77,1.34,56.38,IGNORE
ES,https://www.tradingview.com/chart/?symbol=ES,Eversource Energy,Utilities,69.66,26197735424,9.4,7.4,-2.7,2.32,52.12,68.39,68.03,True,True,True,BULLISH TREND,False,52.02,NEUTRAL,5,"Is WEC Energy Stock Underperforming the Nasdaq? | AMD upgraded, Adobe downgraded: Wall Street's top analyst calls | Connecticut AG, agencies ask FERC to cut Eversource, Avangrid RTO adder",14.92,14.06,587291392.0,181.822,10.91,12.55,56.26,IGNORE
CHRW,https://www.tradingview.com/chart/?symbol=CHRW,"C.H. Robinson Worldwide, Inc.",Industrials,188.81,22255607808,-0.8,9.9,10.33,11.63,67.55,177.19,162.35,True,True,True,BULLISH TREND,False,55.89,NEUTRAL,5,"Datadog upgraded, Accenture downgraded: Wall Street's top analyst calls | Citi turns cautious on trucking stocks as valuation concerns outweigh earnings ups | C.H. Robinson Worldwide vs. GXO: Which Logistics Stock Is a Better Buy in 2026?",38.14,25.7,642142272.0,96.501,34.84,3.7,56.22,IGNORE
ACN,https://www.tradingview.com/chart/?symbol=ACN,Accenture plc,Technology,162.085,99752804352,8.3,4.0,-17.72,-8.71,36.71,179.21,225.24,False,False,False,NO CLEAR ENTRY,False,52.02,NEUTRAL,5,Jim Cramer Agrees That Accenture Is “Being Outcompeted By OpenAI and Anthropic” | Jim Cramer Explains Why Kroger’s “Margins Will Be Shrinking” | Diverging Household Income Divides Retail Landscape,13.29,10.92,12164313088.0,25.469,24.76,10.61,56.21,IGNORE
ISRG,https://www.tradingview.com/chart/?symbol=ISRG,"Intuitive Surgical, Inc.",Healthcare,412.86,146219663360,23.0,18.8,-14.48,-6.15,43.44,441.06,491.05,False,False,False,NO CLEAR ENTRY,False,52.57,NEUTRAL,5,"Is Align Technology Stock Underperforming the Dow? | Intuitive Surgical, Inc. (ISRG) Gains But Lags Market: What You Should Know | Are Options Traders Betting on a Big Move in Intuitive Surgical Stock?",50.23,35.03,2254087424.0,,17.23,28.15,56.06,IGNORE
ZBH,https://www.tradingview.com/chart/?symbol=ZBH,"Zimmer Biomet Holdings, Inc.",Healthcare,88.55,17131103232,9.3,34.1,-4.03,4.01,70.48,87.18,92.29,True,False,False,WATCH - OVERBOUGHT,False,58.81,NEUTRAL,5,Is Zimmer Biomet Stock Underperforming the S&P 500? | Is Solventum Corporation (SOLV) A Good Stock To Buy Now? | Why The Narrative Around Zimmer Biomet (ZBH) Is Shifting Without New Analyst Updates,22.94,9.85,1044124992.0,59.827,6.07,9.05,55.9,IGNORE
WAT,https://www.tradingview.com/chart/?symbol=WAT,Waters Corporation,Healthcare,359.41,35288977408,91.4,,21.02,8.19,45.59,340.02,344.53,True,True,False,BULLISH TREND,False,52.88,NEUTRAL,5,"Waters Launches New Tools As Investors Weigh Biologics And Battery Upside | 1 Healthcare Stock to Consider Right Now and 2 We Brush Off | SpaceX initiated, Intel upgraded: Wall Street's top analyst calls",45.73,21.84,-502370624.0,36.634,5.21,11.93,55.83,IGNORE
AIG,https://www.tradingview.com/chart/?symbol=AIG,"American International Group, Inc.",Financial Services,74.905,39715094528,1.4,21.6,-1.61,-3.77,55.07,75.64,76.72,False,False,False,NO CLEAR ENTRY,False,63.56,POSITIVE,5,AIG vs. AXAHY: Which Stock Is the Better Value Option? | American International Group (AIG) Stock Valuation Check After Recent Pullback And Analyst Upside Forecast | AIG's Turnaround Continues Despite Stock Weakness: Time to Buy?,13.19,8.42,9517249536.0,22.647,7.72,11.84,55.73,IGNORE
BR,https://www.tradingview.com/chart/?symbol=BR,"Broadridge Financial Solutions, Inc.",Technology,144.1,16666360832,7.8,15.1,-18.58,-3.68,43.35,151.61,195.56,False,False,False,NO CLEAR ENTRY,False,60.97,POSITIVE,5,"Broadridge Financial Solutions, Inc. (BR) DLR Platform Processes $7.2 Trillion in Repo Transactions | How Is Broadridge Financial’s Stock Performance Compared to Other Fintech Stocks? | Is Broadridge Financial Solutions, Inc. (BR) A Good Stock To Buy Now?",15.41,13.85,1187662464.0,120.878,42.31,15.03,55.68,IGNORE
